resnet-autotuner.json
{"input": ["cuda -keys=cuda,gpu -arch=sm_70 -libs=cudnn,cublas -max_num_threads=1024 -thread_warp_size=32", "conv2d_nchw.cuda", [["TENSOR", [16, 3, 224, 224], "float32"], ["TENSOR", [64, 3, 7, 7], "float32"], [2, 2], [3, 3, 3, 3], [1, 1], "float32"], {}], "config": {"index": 44505757, "code_hash": null, "entity": [["tile_f", "sp", [-1, 8, 2, 2]], ["tile_y", "sp", [-1, 2, 14, 2]], ["tile_x", "sp", [-1, 8, 1, 1]], ["tile_rc", "sp", [-1, 3]], ["tile_ry", "sp", [-1, 7]], ["tile_rx", "sp", [-1, 1]], ["auto_unroll_max_step", "ot", 0], ["unroll_explicit", "ot", 1]]}, "result": [[0.03826719738095238], 0, 8.627640962600708, 1700993559.8552556], "version": 0.2, "tvm_version": "0.14.dev0"}
{"input": ["cuda -keys=cuda,gpu -arch=sm_70 -libs=cudnn,cublas -max_num_threads=1024 -thread_warp_size=32", "conv2d_nchw.cuda", [["TENSOR", [16, 3, 224, 224], "float32"], ["TENSOR", [64, 3, 7, 7], "float32"], [2, 2], [3, 3, 3, 3], [1, 1], "float32"], {}], "config": {"index": 44308156, "code_hash": null, "entity": [["tile_f", "sp", [-1, 16, 1, 1]], ["tile_y", "sp", [-1, 1, 2, 7]], ["tile_x", "sp", [-1, 1, 1, 16]], ["tile_rc", "sp", [-1, 1]], ["tile_ry", "sp", [-1, 7]], ["tile_rx", "sp", [-1, 1]], ["auto_unroll_max_step", "ot", 0], ["unroll_explicit", "ot", 1]]}, "result": [[0.3589231689], 0, 7.036396265029907, 1700993564.683725], "version": 0.2, "tvm_version": "0.14.dev0"}
{"input": ["cuda -keys=cuda,gpu -arch=sm_70 -libs=cudnn,cublas -max_num_threads=1024 -thread_warp_size=32", "conv2d_nchw.cuda", [["TENSOR", [16, 3, 224, 224], "float32"], ["TENSOR", [64, 3, 7, 7], "float32"], [2, 2], [3, 3, 3, 3], [1, 1], "float32"], {}], "config": {"index": 14363432, "code_hash": null, "entity": [["tile_f", "sp", [-1, 4, 8, 1]], ["tile_y", "sp", [-1, 1, 2, 2]], ["tile_x", "sp", [-1, 8, 2, 7]], ["tile_rc", "sp", [-1, 1]], ["tile_ry", "sp", [-1, 1]], ["tile_rx", "sp", [-1, 1]], ["auto_unroll_max_step", "ot", 512], ["unroll_explicit", "ot", 0]]}, "result": [[0.02042842442857143], 0, 4.491454362869263, 1700993566.684563], "version": 0.2, "tvm_version": "0.14.dev0"}
{"input": ["cuda -keys=cuda,gpu -arch=sm_70 -libs=cudnn,cublas -max_num_threads=1024 -thread_warp_size=32", "conv2d_nchw.cuda", [["TENSOR", [16, 3, 224, 224], "float32"], ["TENSOR", [64, 3, 7, 7], "float32"], [2, 2], [3, 3, 3, 3], [1, 1], "float32"], {}], "config": {"index": 27296601, "code_hash": null, "entity": [["tile_f", "sp", [-1, 4, 8, 2]], ["tile_y", "sp", [-1, 2, 4, 1]], ["tile_x", "sp", [-1, 1, 2, 4]], ["tile_rc", "sp", [-1, 1]], ["tile_ry", "sp", [-1, 1]], ["tile_rx", "sp", [-1, 1]], ["auto_unroll_max_step", "ot", 1500], ["unroll_explicit", "ot", 0]]}, "result": [[0.0011425445818965517], 0, 3.2149817943573, 1700993568.4959598], "version": 0.2, "tvm_version": "0.14.dev0"}
{"input": ["cuda -keys=cuda,gpu -arch=sm_70 -libs=cudnn,cublas -max_num_threads=1024 -thread_warp_size=32", "conv2d_nchw.cuda", [["TENSOR", [16, 3, 224, 224], "float32"], ["TENSOR", [64, 3, 7, 7], "float32"], [2, 2], [3, 3, 3, 3], [1, 1], "float32"], {}], "config": {"index": 44670084, "code_hash": null, "entity": [["tile_f", "sp", [-1, 4, 4, 4]], ["tile_y", "sp", [-1, 8, 7, 2]], ["tile_x", "sp", [-1, 1, 4, 1]], ["tile_rc", "sp", [-1, 3]], ["tile_ry", "sp", [-1, 7]], ["tile_rx", "sp", [-1, 1]], ["auto_unroll_max_step", "ot", 0], ["unroll_explicit", "ot", 1]]}, "result": [[0.006466639361290322], 0, 4.195927381515503, 1700993570.3499885], "version": 0.2, "tvm_version": "0.14.dev0"}
{"input": ["cuda -keys=cuda,gpu -arch=sm_70 -libs=cudnn,cublas -max_num_threads=1024 -thread_warp_size=32", "conv2d_nchw.cuda", [["TENSOR", [16, 3, 224, 224], "float32"], ["TENSOR", [64, 3, 7, 7], "float32"], [2, 2], [3, 3, 3, 3], [1, 1], "float32"], {}], "config": {"index": 17144557, "code_hash": null, "entity": [["tile_f", "sp", [-1, 1, 8, 8]], ["tile_y", "sp", [-1, 1, 2, 14]], ["tile_x", "sp", [-1, 14, 2, 2]], ["tile_rc", "sp", [-1, 1]], ["tile_ry", "sp", [-1, 7]], ["tile_rx", "sp", [-1, 1]], ["auto_unroll_max_step", "ot", 512], ["unroll_explicit", "ot", 0]]}, "result": [[0.03656587], 0, 10.70647144317627, 1700993574.3862026], "version": 0.2, "tvm_version": "0.14.dev0"}
{"input": ["cuda -keys=cuda,gpu -arch=sm_70 -libs=cudnn,cublas -max_num_threads=1024 -thread_warp_size=32", "conv2d_nchw.cuda", [["TENSOR", [16, 3, 224, 224], "float32"], ["TENSOR", [64, 3, 7, 7], "float32"], [2, 2], [3, 3, 3, 3], [1, 1], "float32"], {}], "config": {"index": 76305019, "code_hash": null, "entity": [["tile_f", "sp", [-1, 1, 2, 1]], ["tile_y", "sp", [-1, 2, 28, 2]], ["tile_x", "sp", [-1, 7, 1, 2]], ["tile_rc", "sp", [-1, 1]], ["tile_ry", "sp", [-1, 7]], ["tile_rx", "sp", [-1, 7]], ["auto_unroll_max_step", "ot", 1500], ["unroll_explicit", "ot", 1]]}, "result": [[0.0014145089971711457], 0, 8.756507873535156, 1700993576.184088], "version": 0.2, "tvm_version": "0.14.dev0"}
{"input": ["cuda -keys=cuda,gpu -arch=sm_70 -libs=cudnn,cublas -max_num_threads=1024 -thread_warp_size=32", "conv2d_nchw.cuda", [["TENSOR", [16, 3, 224, 224], "float32"], ["TENSOR", [64, 3, 7, 7], "float32"], [2, 2], [3, 3, 3, 3], [1, 1], "float32"], {}], "config": {"index": 11443054, "code_hash": null, "entity": [["tile_f", "sp", [-1, 4, 2, 8]], ["tile_y", "sp", [-1, 16, 1, 1]], ["tile_x", "sp", [-1, 1, 2, 28]], ["tile_rc", "sp", [-1, 1]], ["tile_ry", "sp", [-1, 7]], ["tile_rx", "sp", [-1, 7]], ["auto_unroll_max_step", "ot", 0], ["unroll_explicit", "ot", 0]]}, "result": [[0.2624164794], 0, 5.985290050506592, 1700993579.8080878], "version": 0.2, "tvm_version": "0.14.dev0"}
{"input": ["cuda -keys=cuda,gpu -arch=sm_70 -libs=cudnn,cublas -max_num_threads=1024 -thread_warp_size=32", "conv2d_cudnn.cuda", [["TENSOR", [16, 3, 224, 224], "float32"], ["TENSOR", [64, 3, 7, 7], "float32"], [2, 2], [3, 3, 3, 3], [1, 1], 1, "NCHW", "float32"], {}], "config": {"index": 1, "code_hash": null, "entity": [["algo", "ot", 1]]}, "result": [[0.0003070856744001586], 0, 4.960943222045898, 1700993585.9418845], "version": 0.2, "tvm_version": "0.14.dev0"}
{"input": ["cuda -keys=cuda,gpu -arch=sm_70 -libs=cudnn,cublas -max_num_threads=1024 -thread_warp_size=32", "conv2d_cudnn.cuda", [["TENSOR", [16, 3, 224, 224], "float32"], ["TENSOR", [64, 3, 7, 7], "float32"], [2, 2], [3, 3, 3, 3], [1, 1], 1, "NCHW", "float32"], {}], "config": {"index": 2, "code_hash": null, "entity": [["algo", "ot", 2]]}, "result": [[0.0006575058399503721], 0, 5.050178527832031, 1700993591.0044155], "version": 0.2, "tvm_version": "0.14.dev0"}
{"input": ["cuda -keys=cuda,gpu -arch=sm_70 -libs=cudnn,cublas -max_num_threads=1024 -thread_warp_size=32", "conv2d_cudnn.cuda", [["TENSOR", [16, 3, 224, 224], "float32"], ["TENSOR", [64, 3, 7, 7], "float32"], [2, 2], [3, 3, 3, 3], [1, 1], 1, "NCHW", "float32"], {}], "config": {"index": 5, "code_hash": null, "entity": [["algo", "ot", 5]]}, "result": [[0.002532645740648379], 0, 3.581354856491089, 1700993594.5974848], "version": 0.2, "tvm_version": "0.14.dev0"}
{"input": ["cuda -keys=cuda,gpu -arch=sm_70 -libs=cudnn,cublas -max_num_threads=1024 -thread_warp_size=32", "conv2d_cudnn.cuda", [["TENSOR", [16, 3, 224, 224], "float32"], ["TENSOR", [64, 3, 7, 7], "float32"], [2, 2], [3, 3, 3, 3], [1, 1], 1, "NCHW", "float32"], {}], "config": {"index": 0, "code_hash": null, "entity": [["algo", "ot", 0]]}, "result": [[0.00047291654185418536], 0, 3.544421672821045, 1700993598.182963], "version": 0.2, "tvm_version": "0.14.dev0"}
{"input": ["cuda -keys=cuda,gpu -arch=sm_70 -libs=cudnn,cublas -max_num_threads=1024 -thread_warp_size=32", "conv2d_nchw.cuda", [["TENSOR", [16, 64, 56, 56], "float32"], ["TENSOR", [64, 64, 1, 1], "float32"], [1, 1], [0, 0, 0, 0], [1, 1], "float32"], {}], "config": {"index": 8121997, "code_hash": null, "entity": [["tile_f", "sp", [-1, 8, 2, 2]], ["tile_y", "sp", [-1, 7, 1, 4]], ["tile_x", "sp", [-1, 1, 2, 1]], ["tile_rc", "sp", [-1, 2]], ["tile_ry", "sp", [-1, 1]], ["tile_rx", "sp", [-1, 1]], ["auto_unroll_max_step", "ot", 1500], ["unroll_explicit", "ot", 0]]}, "result": [[0.0289425694], 0, 3.444941759109497, 1700993619.9361157], "version": 0.2, "tvm_version": "0.14.dev0"}
{"input": ["cuda -keys=cuda,gpu -arch=sm_70 -libs=cudnn,cublas -max_num_threads=1024 -thread_warp_size=32", "conv2d_nchw.cuda", [["TENSOR", [16, 64, 56, 56], "float32"], ["TENSOR", [64, 64, 1, 1], "float32"], [1, 1], [0, 0, 0, 0], [1, 1], "float32"], {}], "config": {"index": 3827030, "code_hash": null, "entity": [["tile_f", "sp", [-1, 1, 1, 16]], ["tile_y", "sp", [-1, 14, 2, 2]], ["tile_x", "sp", [-1, 2, 2, 1]], ["tile_rc", "sp", [-1, 1]], ["tile_ry", "sp", [-1, 1]], ["tile_rx", "sp", [-1, 1]], ["auto_unroll_max_step", "ot", 512], ["unroll_explicit", "ot", 0]]}, "result": [[0.018018962303571428], 0, 2.946546792984009, 1700993621.7277746], "version": 0.2, "tvm_version": "0.14.dev0"}
{"input": ["cuda -keys=cuda,gpu -arch=sm_70 -libs=cudnn,cublas -max_num_threads=1024 -thread_warp_size=32", "conv2d_nchw.cuda", [["TENSOR", [16, 64, 56, 56], "float32"], ["TENSOR", [64, 64, 1, 1], "float32"], [1, 1], [0, 0, 0, 0], [1, 1], "float32"], {}], "config": {"index": 7232778, "code_hash": null, "entity": [["tile_f", "sp", [-1, 8, 4, 2]], ["tile_y", "sp", [-1, 1, 14, 1]], ["tile_x", "sp", [-1, 1, 2, 2]], ["tile_rc", "sp", [-1, 64]], ["tile_ry", "sp", [-1, 1]], ["tile_rx", "sp", [-1, 1]], ["auto_unroll_max_step", "ot", 512], ["unroll_explicit", "ot", 0]]}, "result": [[0.0001294054192634561], 0, 3.9730517864227295, 1700993624.879759], "version": 0.2, "tvm_version": "0.14.dev0"}
{"input": ["cuda -keys=cuda,gpu -arch=sm_70 -libs=cudnn,cublas -max_num_threads=1024 -thread_warp_size=32", "conv2d_nchw.cuda", [["TENSOR", [16, 64, 56, 56], "float32"], ["TENSOR", [64, 64, 1, 1], "float32"], [1, 1], [0, 0, 0, 0], [1, 1], "float32"], {}], "config": {"index": 5988247, "code_hash": null, "entity": [["tile_f", "sp", [-1, 2, 2, 4]], ["tile_y", "sp", [-1, 1, 2, 1]], ["tile_x", "sp", [-1, 7, 2, 1]], ["tile_rc", "sp", [-1, 16]], ["tile_ry", "sp", [-1, 1]], ["tile_rx", "sp", [-1, 1]], ["auto_unroll_max_step", "ot", 512], ["unroll_explicit", "ot", 0]]}, "result": [[0.00026074130072639224], 0, 4.112035512924194, 1700993628.0420024], "version": 0.2, "tvm_version": "0.14.dev0"}
{"input": ["cuda -keys=cuda,gpu -arch=sm_70 -libs=cudnn,cublas -max_num_threads=1024 -thread_warp_size=32", "conv2d_nchw.cuda", [["TENSOR", [16, 64, 56, 56], "float32"], ["TENSOR", [64, 64, 1, 1], "float32"], [1, 1], [0, 0, 0, 0], [1, 1], "float32"], {}], "config": {"index": 1334990, "code_hash": null, "entity": [["tile_f", "sp", [-1, 2, 8, 4]], ["tile_y", "sp", [-1, 1, 2, 4]], ["tile_x", "sp", [-1, 7, 2, 2]], ["tile_rc", "sp", [-1, 4]], ["tile_ry", "sp", [-1, 1]], ["tile_rx", "sp", [-1, 1]], ["auto_unroll_max_step", "ot", 0], ["unroll_explicit", "ot", 0]]}, "result": [[0.002540362372204473], 0, 4.879173994064331, 1700993631.1718206], "version": 0.2, "tvm_version": "0.14.dev0"}
{"input": ["cuda -keys=cuda,gpu -arch=sm_70 -libs=cudnn,cublas -max_num_threads=1024 -thread_warp_size=32", "conv2d_nchw.cuda", [["TENSOR", [16, 64, 56, 56], "float32"], ["TENSOR", [64, 64, 1, 1], "float32"], [1, 1], [0, 0, 0, 0], [1, 1], "float32"], {}], "config": {"index": 12026335, "code_hash": null, "entity": [["tile_f", "sp", [-1, 2, 2, 4]], ["tile_y", "sp", [-1, 7, 1, 4]], ["tile_x", "sp", [-1, 1, 56, 1]], ["tile_rc", "sp", [-1, 2]], ["tile_ry", "sp", [-1, 1]], ["tile_rx", "sp", [-1, 1]], ["auto_unroll_max_step", "ot", 0], ["unroll_explicit", "ot", 1]]}, "result": [[0.00012238443195579775], 0, 4.333178997039795, 1700993634.350735], "version": 0.2, "tvm_version": "0.14.dev0"}
{"input": ["cuda -keys=cuda,gpu -arch=sm_70 -libs=cudnn,cublas -max_num_threads=1024 -thread_warp_size=32", "conv2d_nchw.cuda", [["TENSOR", [16, 64, 56, 56], "float32"], ["TENSOR", [64, 64, 1, 1], "float32"], [1, 1], [0, 0, 0, 0], [1, 1], "float32"], {}], "config": {"index": 5701408, "code_hash": null, "entity": [["tile_f", "sp", [-1, 4, 1, 16]], ["tile_y", "sp", [-1, 7, 1, 2]], ["tile_x", "sp", [-1, 1, 1, 4]], ["tile_rc", "sp", [-1, 8]], ["tile_ry", "sp", [-1, 1]], ["tile_rx", "sp", [-1, 1]], ["auto_unroll_max_step", "ot", 512], ["unroll_explicit", "ot", 0]]}, "result": [[0.0762783965625], 0, 8.476314544677734, 1700993636.926718], "version": 0.2, "tvm_version": "0.14.dev0"}
{"input": ["cuda -keys=cuda,gpu -arch=sm_70 -libs=cudnn,cublas -max_num_threads=1024 -thread_warp_size=32", "conv2d_nchw.cuda", [["TENSOR", [16, 64, 56, 56], "float32"], ["TENSOR", [64, 64, 1, 1], "float32"], [1, 1], [0, 0, 0, 0], [1, 1], "float32"], {}], "config": {"index": 4057695, "code_hash": null, "entity": [["tile_f", "sp", [-1, 2, 1, 16]], ["tile_y", "sp", [-1, 2, 4, 7]], ["tile_x", "sp", [-1, 2, 7, 2]], ["tile_rc", "sp", [-1, 1]], ["tile_ry", "sp", [-1, 1]], ["tile_rx", "sp", [-1, 1]], ["auto_unroll_max_step", "ot", 512], ["unroll_explicit", "ot", 0]]}, "result": [[0.002890459237410072], 0, 4.641213655471802, 1700993640.0729232], "version": 0.2, "tvm_version": "0.14.dev0"}
{"input": ["cuda -keys=cuda,gpu -arch=sm_70 -libs=cudnn,cublas -max_num_threads=1024 -thread_warp_size=32", "conv2d_nchw.cuda", [["TENSOR", [16, 64, 56, 56], "float32"], ["TENSOR", [64, 64, 1, 1], "float32"], [1, 1], [0, 0, 0, 0], [1, 1], "float32"], {}], "config": {"index": 14999115, "code_hash": null, "entity": [["tile_f", "sp", [-1, 2, 1, 16]], ["tile_y", "sp", [-1, 1, 1, 1]], ["tile_x", "sp", [-1, 4, 1, 14]], ["tile_rc", "sp", [-1, 64]], ["tile_ry", "sp", [-1, 1]], ["tile_rx", "sp", [-1, 1]], ["auto_unroll_max_step", "ot", 0], ["unroll_explicit", "ot", 1]]}, "result": [[0.069992256125], 0, 3.783827304840088, 1700993642.5285146], "version": 0.2, "tvm_version": "0.14.dev0"}
{"input": ["cuda -keys=cuda,gpu -arch=sm_70 -libs=cudnn,cublas -max_num_threads=1024 -thread_warp_size=32", "conv2d_nchw.cuda", [["TENSOR", [16, 64, 56, 56], "float32"], ["TENSOR", [64, 64, 1, 1], "float32"], [1, 1], [0, 0, 0, 0], [1, 1], "float32"], {}], "config": {"index": 19909630, "code_hash": null, "entity": [["tile_f", "sp", [-1, 1, 2, 2]], ["tile_y", "sp", [-1, 4, 1, 7]], ["tile_x", "sp", [-1, 4, 1, 1]], ["tile_rc", "sp", [-1, 4]], ["tile_ry", "sp", [-1, 1]], ["tile_rx", "sp", [-1, 1]], ["auto_unroll_max_step", "ot", 1500], ["unroll_explicit", "ot", 1]]}, "result": [[0.054414711368421055], 0, 6.296907186508179, 1700993644.8120985], "version": 0.2, "tvm_version": "0.14.dev0"}
{"input": ["cuda -keys=cuda,gpu -arch=sm_70 -libs=cudnn,cublas -max_num_threads=1024 -thread_warp_size=32", "conv2d_nchw.cuda", [["TENSOR", [16, 64, 56, 56], "float32"], ["TENSOR", [64, 64, 1, 1], "float32"], [1, 1], [0, 0, 0, 0], [1, 1], "float32"], {}], "config": {"index": 14183417, "code_hash": null, "entity": [["tile_f", "sp", [-1, 16, 4, 1]], ["tile_y", "sp", [-1, 7, 1, 4]], ["tile_x", "sp", [-1, 1, 1, 2]], ["tile_rc", "sp", [-1, 32]], ["tile_ry", "sp", [-1, 1]], ["tile_rx", "sp", [-1, 1]], ["auto_unroll_max_step", "ot", 0], ["unroll_explicit", "ot", 1]]}, "result": [[0.03108954039393939], 0, 5.161579847335815, 1700993646.8495178], "version": 0.2, "tvm_version": "0.14.dev0"}
{"input": ["cuda -keys=cuda,gpu -arch=sm_70 -libs=cudnn,cublas -max_num_threads=1024 -thread_warp_size=32", "conv2d_nchw.cuda", [["TENSOR", [16, 64, 56, 56], "float32"], ["TENSOR", [64, 64, 1, 1], "float32"], [1, 1], [0, 0, 0, 0], [1, 1], "float32"], {}], "config": {"index": 17795894, "code_hash": null, "entity": [["tile_f", "sp", [-1, 1, 1, 16]], ["tile_y", "sp", [-1, 2, 4, 1]], ["tile_x", "sp", [-1, 1, 2, 1]], ["tile_rc", "sp", [-1, 32]], ["tile_ry", "sp", [-1, 1]], ["tile_rx", "sp", [-1, 1]], ["auto_unroll_max_step", "ot", 512], ["unroll_explicit", "ot", 1]]}, "result": [[0.0003373070554272517], 0, 4.765106678009033, 1700993650.0094728], "version": 0.2, "tvm_version": "0.14.dev0"}
{"input": ["cuda -keys=cuda,gpu -arch=sm_70 -libs=cudnn,cublas -max_num_threads=1024 -thread_warp_size=32", "conv2d_nchw.cuda", [["TENSOR", [16, 64, 56, 56], "float32"], ["TENSOR", [64, 64, 1, 1], "float32"], [1, 1], [0, 0, 0, 0], [1, 1], "float32"], {}], "config": {"index": 15556743, "code_hash": null, "entity": [["tile_f", "sp", [-1, 1, 64, 1]], ["tile_y", "sp", [-1, 1, 1, 56]], ["tile_x", "sp", [-1, 2, 2, 14]], ["tile_rc", "sp", [-1, 1]], ["tile_ry", "sp", [-1, 1]], ["tile_rx", "sp", [-1, 1]], ["auto_unroll_max_step", "ot", 512], ["unroll_explicit", "ot", 1]]}, "result": [[0.0038651775827338135], 0, 4.126804828643799, 1700993653.1695986], "version": 0.2, "tvm_version": "0.14.dev0"}
{"input": ["cuda -keys=cuda,gpu -arch=sm_70 -libs=cudnn,cublas -max_num_threads=1024 -thread_warp_size=32", "conv2d_cudnn.cuda", [["TENSOR", [16, 64, 56, 56], "float32"], ["TENSOR", [64, 64, 1, 1], "float32"], [1, 1], [0, 0, 0, 0], [1, 1], 1, "NCHW", "float32"], {}], "config": {"index": 1, "code_hash": null, "entity": [["algo", "ot", 1]]}, "result": [[7.02657134427335e-05], 0, 3.4466488361358643, 1700993657.6471584], "version": 0.2, "tvm_version": "0.14.dev0"}
{"input": ["cuda -keys=cuda,gpu -arch=sm_70 -libs=cudnn,cublas -max_num_threads=1024 -thread_warp_size=32", "conv2d_cudnn.cuda", [["TENSOR", [16, 64, 56, 56], "float32"], ["TENSOR", [64, 64, 1, 1], "float32"], [1, 1], [0, 0, 0, 0], [1, 1], 1, "NCHW", "float32"], {}], "config": {"index": 2, "code_hash": null, "entity": [["algo", "ot", 2]]}, "result": [[0.0001285672415118514], 0, 4.558703899383545, 1700993668.4843452], "version": 0.2, "tvm_version": "0.14.dev0"}
{"input": ["cuda -keys=cuda,gpu -arch=sm_70 -libs=cudnn,cublas -max_num_threads=1024 -thread_warp_size=32", "conv2d_cudnn.cuda", [["TENSOR", [16, 64, 56, 56], "float32"], ["TENSOR", [64, 64, 1, 1], "float32"], [1, 1], [0, 0, 0, 0], [1, 1], 1, "NCHW", "float32"], {}], "config": {"index": 4, "code_hash": null, "entity": [["algo", "ot", 4]]}, "result": [[0.0004401628526698351], 0, 5.012777805328369, 1700993673.5370579], "version": 0.2, "tvm_version": "0.14.dev0"}
{"input": ["cuda -keys=cuda,gpu -arch=sm_70 -libs=cudnn,cublas -max_num_threads=1024 -thread_warp_size=32", "conv2d_cudnn.cuda", [["TENSOR", [16, 64, 56, 56], "float32"], ["TENSOR", [64, 64, 1, 1], "float32"], [1, 1], [0, 0, 0, 0], [1, 1], 1, "NCHW", "float32"], {}], "config": {"index": 5, "code_hash": null, "entity": [["algo", "ot", 5]]}, "result": [[0.0001921076237082067], 0, 5.102450370788574, 1700993678.6512642], "version": 0.2, "tvm_version": "0.14.dev0"}
{"input": ["cuda -keys=cuda,gpu -arch=sm_70 -libs=cudnn,cublas -max_num_threads=1024 -thread_warp_size=32", "conv2d_cudnn.cuda", [["TENSOR", [16, 64, 56, 56], "float32"], ["TENSOR", [64, 64, 1, 1], "float32"], [1, 1], [0, 0, 0, 0], [1, 1], 1, "NCHW", "float32"], {}], "config": {"index": 0, "code_hash": null, "entity": [["algo", "ot", 0]]}, "result": [[7.227716405238908e-05], 0, 4.553187847137451, 1700993683.215761], "version": 0.2, "tvm_version": "0.14.dev0"}
{"input": ["cuda -keys=cuda,gpu -arch=sm_70 -libs=cudnn,cublas -max_num_threads=1024 -thread_warp_size=32", "conv2d_nchw.cuda", [["TENSOR", [16, 64, 56, 56], "float32"], ["TENSOR", [64, 64, 3, 3], "float32"], [1, 1], [1, 1, 1, 1], [1, 1], "float32"], {}], "config": {"index": 15650339, "code_hash": null, "entity": [["tile_f", "sp", [-1, 2, 16, 2]], ["tile_y", "sp", [-1, 1, 2, 14]], ["tile_x", "sp", [-1, 1, 2, 1]], ["tile_rc", "sp", [-1, 2]], ["tile_ry", "sp", [-1, 1]], ["tile_rx", "sp", [-1, 1]], ["auto_unroll_max_step", "ot", 512], ["unroll_explicit", "ot", 0]]}, "result": [[0.0008551014916890081], 0, 4.218587160110474, 1700993697.5586586], "version": 0.2, "tvm_version": "0.14.dev0"}
{"input": ["cuda -keys=cuda,gpu -arch=sm_70 -libs=cudnn,cublas -max_num_threads=1024 -thread_warp_size=32", "conv2d_nchw.cuda", [["TENSOR", [16, 64, 56, 56], "float32"], ["TENSOR", [64, 64, 3, 3], "float32"], [1, 1], [1, 1, 1, 1], [1, 1], "float32"], {}], "config": {"index": 18024293, "code_hash": null, "entity": [["tile_f", "sp", [-1, 1, 2, 16]], ["tile_y", "sp", [-1, 1, 4, 1]], ["tile_x", "sp", [-1, 1, 7, 2]], ["tile_rc", "sp", [-1, 32]], ["tile_ry", "sp", [-1, 1]], ["tile_rx", "sp", [-1, 1]], ["auto_unroll_max_step", "ot", 512], ["unroll_explicit", "ot", 0]]}, "result": [[0.0013691105461473326], 0, 4.5013604164123535, 1700993700.819287], "version": 0.2, "tvm_version": "0.14.dev0"}
{"input": ["cuda -keys=cuda,gpu -arch=sm_70 -libs=cudnn,cublas -max_num_threads=1024 -thread_warp_size=32", "conv2d_nchw.cuda", [["TENSOR", [16, 64, 56, 56], "float32"], ["TENSOR", [64, 64, 3, 3], "float32"], [1, 1], [1, 1, 1, 1], [1, 1], "float32"], {}], "config": {"index": 35084900, "code_hash": null, "entity": [["tile_f", "sp", [-1, 16, 1, 2]], ["tile_y", "sp", [-1, 2, 1, 28]], ["tile_x", "sp", [-1, 4, 7, 1]], ["tile_rc", "sp", [-1, 4]], ["tile_ry", "sp", [-1, 3]], ["tile_rx", "sp", [-1, 1]], ["auto_unroll_max_step", "ot", 1500], ["unroll_explicit", "ot", 0]]}, "result": [[0.7271269531], 0, 11.963563442230225, 1700993709.4937346], "version": 0.2, "tvm_version": "0.14.dev0"}
{"input": ["cuda -keys=cuda,gpu -arch=sm_70 -libs=cudnn,cublas -max_num_threads=1024 -thread_warp_size=32", "conv2d_nchw.cuda", [["TENSOR", [16, 64, 56, 56], "float32"], ["TENSOR", [64, 64, 3, 3], "float32"], [1, 1], [1, 1, 1, 1], [1, 1], "float32"], {}], "config": {"index": 68470676, "code_hash": null, "entity": [["tile_f", "sp", [-1, 2, 2, 1]], ["tile_y", "sp", [-1, 56, 1, 1]], ["tile_x", "sp", [-1, 1, 56, 1]], ["tile_rc", "sp", [-1, 2]], ["tile_ry", "sp", [-1, 1]], ["tile_rx", "sp", [-1, 3]], ["auto_unroll_max_step", "ot", 512], ["unroll_explicit", "ot", 1]]}, "result": [[0.0014833212752293577], 0, 5.471524477005005, 1700993712.68783], "version": 0.2, "tvm_version": "0.14.dev0"}
{"input": ["cuda -keys=cuda,gpu -arch=sm_70 -libs=cudnn,cublas -max_num_threads=1024 -thread_warp_size=32", "conv2d_nchw.cuda", [["TENSOR", [16, 64, 56, 56], "float32"], ["TENSOR", [64, 64, 3, 3], "float32"], [1, 1], [1, 1, 1, 1], [1, 1], "float32"], {}], "config": {"index": 32014954, "code_hash": null, "entity": [["tile_f", "sp", [-1, 1, 2, 2]], ["tile_y", "sp", [-1, 4, 2, 1]], ["tile_x", "sp", [-1, 4, 7, 2]], ["tile_rc", "sp", [-1, 8]], ["tile_ry", "sp", [-1, 1]], ["tile_rx", "sp", [-1, 1]], ["auto_unroll_max_step", "ot", 1500], ["unroll_explicit", "ot", 0]]}, "result": [[0.009143146854545455], 0, 5.551119089126587, 1700993714.377669], "version": 0.2, "tvm_version": "0.14.dev0"}
{"input": ["cuda -keys=cuda,gpu -arch=sm_70 -libs=cudnn,cublas -max_num_threads=1024 -thread_warp_size=32", "conv2d_nchw.cuda", [["TENSOR", [16, 64, 56, 56], "float32"], ["TENSOR", [64, 64, 3, 3], "float32"], [1, 1], [1, 1, 1, 1], [1, 1], "float32"], {}], "config": {"index": 13539631, "code_hash": null, "entity": [["tile_f", "sp", [-1, 1, 2, 1]], ["tile_y", "sp", [-1, 1, 8, 7]], ["tile_x", "sp", [-1, 1, 4, 1]], ["tile_rc", "sp", [-1, 16]], ["tile_ry", "sp", [-1, 3]], ["tile_rx", "sp", [-1, 3]], ["auto_unroll_max_step", "ot", 0], ["unroll_explicit", "ot", 0]]}, "result": [[0.002407871978365385], 0, 2.953263759613037, 1700993716.0289676], "version": 0.2, "tvm_version": "0.14.dev0"}
{"input": ["cuda -keys=cuda,gpu -arch=sm_70 -libs=cudnn,cublas -max_num_threads=1024 -thread_warp_size=32", "conv2d_nchw.cuda", [["TENSOR", [16, 64, 56, 56], "float32"], ["TENSOR", [64, 64, 3, 3], "float32"], [1, 1], [1, 1, 1, 1], [1, 1], "float32"], {}], "config": {"index": 50091810, "code_hash": null, "entity": [["tile_f", "sp", [-1, 64, 1, 1]], ["tile_y", "sp", [-1, 7, 2, 1]], ["tile_x", "sp", [-1, 1, 4, 1]], ["tile_rc", "sp", [-1, 4]], ["tile_ry", "sp", [-1, 3]], ["tile_rx", "sp", [-1, 1]], ["auto_unroll_max_step", "ot", 0], ["unroll_explicit", "ot", 1]]}, "result": [[0.05101762694999999], 0, 4.581489086151123, 1700993718.155698], "version": 0.2, "tvm_version": "0.14.dev0"}
{"input": ["cuda -keys=cuda,gpu -arch=sm_70 -libs=cudnn,cublas -max_num_threads=1024 -thread_warp_size=32", "conv2d_nchw.cuda", [["TENSOR", [16, 64, 56, 56], "float32"], ["TENSOR", [64, 64, 3, 3], "float32"], [1, 1], [1, 1, 1, 1], [1, 1], "float32"], {}], "config": {"index": 78007246, "code_hash": null, "entity": [["tile_f", "sp", [-1, 1, 4, 4]], ["tile_y", "sp", [-1, 14, 4, 1]], ["tile_x", "sp", [-1, 1, 2, 1]], ["tile_rc", "sp", [-1, 32]], ["tile_ry", "sp", [-1, 1]], ["tile_rx", "sp", [-1, 1]], ["auto_unroll_max_step", "ot", 1500], ["unroll_explicit", "ot", 1]]}, "result": [[0.0021300496517150393], 0, 5.910330533981323, 1700993721.3230882], "version": 0.2, "tvm_version": "0.14.dev0"}
{"input": ["cuda -keys=cuda,gpu -arch=sm_70 -libs=cudnn,cublas -max_num_threads=1024 -thread_warp_size=32", "conv2d_nchw.cuda", [["TENSOR", [16, 64, 56, 56], "float32"], ["TENSOR", [64, 64, 3, 3], "float32"], [1, 1], [1, 1, 1, 1], [1, 1], "float32"], {}], "config": {"index": 30542021, "code_hash": null, "entity": [["tile_f", "sp", [-1, 4, 4, 2]], ["tile_y", "sp", [-1, 1, 4, 14]], ["tile_x", "sp", [-1, 1, 4, 7]], ["tile_rc", "sp", [-1, 1]], ["tile_ry", "sp", [-1, 1]], ["tile_rx", "sp", [-1, 1]], ["auto_unroll_max_step", "ot", 1500], ["unroll_explicit", "ot", 0]]}, "result": [[0.05911082188235294], 0, 8.055044174194336, 1700993723.575762], "version": 0.2, "tvm_version": "0.14.dev0"}
{"input": ["cuda -keys=cuda,gpu -arch=sm_70 -libs=cudnn,cublas -max_num_threads=1024 -thread_warp_size=32", "conv2d_nchw.cuda", [["TENSOR", [16, 64, 56, 56], "float32"], ["TENSOR", [64, 64, 3, 3], "float32"], [1, 1], [1, 1, 1, 1], [1, 1], "float32"], {}], "config": {"index": 12773948, "code_hash": null, "entity": [["tile_f", "sp", [-1, 1, 2, 8]], ["tile_y", "sp", [-1, 1, 1, 14]], ["tile_x", "sp", [-1, 8, 1, 7]], ["tile_rc", "sp", [-1, 4]], ["tile_ry", "sp", [-1, 3]], ["tile_rx", "sp", [-1, 3]], ["auto_unroll_max_step", "ot", 0], ["unroll_explicit", "ot", 0]]}, "result": [[0.3481903076], 0, 8.993404626846313, 1700993727.9402304], "version": 0.2, "tvm_version": "0.14.dev0"}
{"input": ["cuda -keys=cuda,gpu -arch=sm_70 -libs=cudnn,cublas -max_num_threads=1024 -thread_warp_size=32", "conv2d_nchw.cuda", [["TENSOR", [16, 64, 56, 56], "float32"], ["TENSOR", [64, 64, 3, 3], "float32"], [1, 1], [1, 1, 1, 1], [1, 1], "float32"], {}], "config": {"index": 23242629, "code_hash": null, "entity": [["tile_f", "sp", [-1, 2, 1, 32]], ["tile_y", "sp", [-1, 1, 1, 7]], ["tile_x", "sp", [-1, 1, 7, 1]], ["tile_rc", "sp", [-1, 2]], ["tile_ry", "sp", [-1, 1]], ["tile_rx", "sp", [-1, 3]], ["auto_unroll_max_step", "ot", 512], ["unroll_explicit", "ot", 0]]}, "result": [[0.043409576375], 0, 6.231212377548218, 1700993730.1196923], "version": 0.2, "tvm_version": "0.14.dev0"}
{"input": ["cuda -keys=cuda,gpu -arch=sm_70 -libs=cudnn,cublas -max_num_threads=1024 -thread_warp_size=32", "conv2d_nchw_winograd.cuda", [["TENSOR", [16, 64, 56, 56], "float32"], ["TENSOR", [64, 64, 3, 3], "float32"], [1, 1], [1, 1, 1, 1], [1, 1], "float32"], {}], "config": {"index": 606742, "code_hash": null, "entity": [["tile_b", "sp", [-1, 1, 1, 1]], ["tile_y", "sp", [-1, 8, 2, 1]], ["tile_x", "sp", [-1, 1, 8, 8]], ["tile_rc", "sp", [-1, 2]], ["auto_unroll_max_step", "ot", 128], ["unroll_explicit", "ot", 0]]}, "result": [[0.0004313768939929329], 0, 8.291908979415894, 1700993744.309966], "version": 0.2, "tvm_version": "0.14.dev0"}
{"input": ["cuda -keys=cuda,gpu -arch=sm_70 -libs=cudnn,cublas -max_num_threads=1024 -thread_warp_size=32", "conv2d_nchw_winograd.cuda", [["TENSOR", [16, 64, 56, 56], "float32"], ["TENSOR", [64, 64, 3, 3], "float32"], [1, 1], [1, 1, 1, 1], [1, 1], "float32"], {}], "config": {"index": 607433, "code_hash": null, "entity": [["tile_b", "sp", [-1, 1, 1, 1]], ["tile_y", "sp", [-1, 2, 1, 2]], ["tile_x", "sp", [-1, 28, 14, 8]], ["tile_rc", "sp", [-1, 2]], ["auto_unroll_max_step", "ot", 128], ["unroll_explicit", "ot", 0]]}, "result": [[0.015397293523809521], 0, 9.775198459625244, 1700993747.6417496], "version": 0.2, "tvm_version": "0.14.dev0"}
{"input": ["cuda -keys=cuda,gpu -arch=sm_70 -libs=cudnn,cublas -max_num_threads=1024 -thread_warp_size=32", "conv2d_nchw_winograd.cuda", [["TENSOR", [16, 64, 56, 56], "float32"], ["TENSOR", [64, 64, 3, 3], "float32"], [1, 1], [1, 1, 1, 1], [1, 1], "float32"], {}], "config": {"index": 795501, "code_hash": null, "entity": [["tile_b", "sp", [-1, 1, 1, 1]], ["tile_y", "sp", [-1, 8, 8, 1]], ["tile_x", "sp", [-1, 28, 8, 2]], ["tile_rc", "sp", [-1, 16]], ["auto_unroll_max_step", "ot", 128], ["unroll_explicit", "ot", 0]]}, "result": [[0.006624356535947713], 0, 9.428210258483887, 1700993749.395969], "version": 0.2, "tvm_version": "0.14.dev0"}
{"input": ["cuda -keys=cuda,gpu -arch=sm_70 -libs=cudnn,cublas -max_num_threads=1024 -thread_warp_size=32", "conv2d_nchw_winograd.cuda", [["TENSOR", [16, 64, 56, 56], "float32"], ["TENSOR", [64, 64, 3, 3], "float32"], [1, 1], [1, 1, 1, 1], [1, 1], "float32"], {}], "config": {"index": 1237190, "code_hash": null, "entity": [["tile_b", "sp", [-1, 1, 1, 1]], ["tile_y", "sp", [-1, 16, 2, 2]], ["tile_x", "sp", [-1, 2, 28, 7]], ["tile_rc", "sp", [-1, 8]], ["auto_unroll_max_step", "ot", 1500], ["unroll_explicit", "ot", 0]]}, "result": [[0.0034593361462365592], 0, 8.745620965957642, 1700993752.5609448], "version": 0.2, "tvm_version": "0.14.dev0"}
{"input": ["cuda -keys=cuda,gpu -arch=sm_70 -libs=cudnn,cublas -max_num_threads=1024 -thread_warp_size=32", "conv2d_nchw_winograd.cuda", [["TENSOR", [16, 64, 56, 56], "float32"], ["TENSOR", [64, 64, 3, 3], "float32"], [1, 1], [1, 1, 1, 1], [1, 1], "float32"], {}], "config": {"index": 311422, "code_hash": null, "entity": [["tile_b", "sp", [-1, 1, 1, 1]], ["tile_y", "sp", [-1, 1, 2, 2]], ["tile_x", "sp", [-1, 2, 14, 4]], ["tile_rc", "sp", [-1, 16]], ["auto_unroll_max_step", "ot", 0], ["unroll_explicit", "ot", 0]]}, "result": [[0.0005270500802348337], 0, 9.230831384658813, 1700993755.8084028], "version": 0.2, "tvm_version": "0.14.dev0"}
{"input": ["cuda -keys=cuda,gpu -arch=sm_70 -libs=cudnn,cublas -max_num_threads=1024 -thread_warp_size=32", "conv2d_nchw_winograd.cuda", [["TENSOR", [16, 64, 56, 56], "float32"], ["TENSOR", [64, 64, 3, 3], "float32"], [1, 1], [1, 1, 1, 1], [1, 1], "float32"], {}], "config": {"index": 66579, "code_hash": null, "entity": [["tile_b", "sp", [-1, 1, 1, 1]], ["tile_y", "sp", [-1, 4, 1, 4]], ["tile_x", "sp", [-1, 1, 28, 112]], ["tile_rc", "sp", [-1, 1]], ["auto_unroll_max_step", "ot", 0], ["unroll_explicit", "ot", 0]]}, "result": [[0.0069959110625000005], 0, 8.27700161933899, 1700993757.4496715], "version": 0.2, "tvm_version": "0.14.dev0"}
{"input": ["cuda -keys=cuda,gpu -arch=sm_70 -libs=cudnn,cublas -max_num_threads=1024 -thread_warp_size=32", "conv2d_nchw_winograd.cuda", [["TENSOR", [16, 64, 56, 56], "float32"], ["TENSOR", [64, 64, 3, 3], "float32"], [1, 1], [1, 1, 1, 1], [1, 1], "float32"], {}], "config": {"index": 1987701, "code_hash": null, "entity": [["tile_b", "sp", [-1, 1, 1, 1]], ["tile_y", "sp", [-1, 4, 2, 1]], ["tile_x", "sp", [-1, 4, 112, 1]], ["tile_rc", "sp", [-1, 1]], ["auto_unroll_max_step", "ot", 128], ["unroll_explicit", "ot", 1]]}, "result": [[0.0003027966458567679], 0, 7.891350030899048, 1700993760.6009498], "version": 0.2, "tvm_version": "0.14.dev0"}
{"input": ["cuda -keys=cuda,gpu -arch=sm_70 -libs=cudnn,cublas -max_num_threads=1024 -thread_warp_size=32", "conv2d_nchw_winograd.cuda", [["TENSOR", [16, 64, 56, 56], "float32"], ["TENSOR", [64, 64, 3, 3], "float32"], [1, 1], [1, 1, 1, 1], [1, 1], "float32"], {}], "config": {"index": 1284977, "code_hash": null, "entity": [["tile_b", "sp", [-1, 1, 1, 1]], ["tile_y", "sp", [-1, 2, 1, 2]], ["tile_x", "sp", [-1, 49, 1, 2]], ["tile_rc", "sp", [-1, 16]], ["auto_unroll_max_step", "ot", 1500], ["unroll_explicit", "ot", 0]]}, "result": [[0.07327462762499999], 0, 9.698659658432007, 1700993763.1386533], "version": 0.2, "tvm_version": "0.14.dev0"}
{"input": ["cuda -keys=cuda,gpu -arch=sm_70 -libs=cudnn,cublas -max_num_threads=1024 -thread_warp_size=32", "conv2d_nchw_winograd.cuda", [["TENSOR", [16, 64, 56, 56], "float32"], ["TENSOR", [64, 64, 3, 3], "float32"], [1, 1], [1, 1, 1, 1], [1, 1], "float32"], {}], "config": {"index": 2292924, "code_hash": null, "entity": [["tile_b", "sp", [-1, 1, 1, 1]], ["tile_y", "sp", [-1, 4, 4, 4]], ["tile_x", "sp", [-1, 16, 4, 7]], ["tile_rc", "sp", [-1, 16]], ["auto_unroll_max_step", "ot", 128], ["unroll_explicit", "ot", 1]]}, "result": [[0.014670698681818181], 0, 9.961062908172607, 1700993766.479376], "version": 0.2, "tvm_version": "0.14.dev0"}
{"input": ["cuda -keys=cuda,gpu -arch=sm_70 -libs=cudnn,cublas -max_num_threads=1024 -thread_warp_size=32", "conv2d_nchw_winograd.cuda", [["TENSOR", [16, 64, 56, 56], "float32"], ["TENSOR", [64, 64, 3, 3], "float32"], [1, 1], [1, 1, 1, 1], [1, 1], "float32"], {}], "config": {"index": 623802, "code_hash": null, "entity": [["tile_b", "sp", [-1, 1, 1, 1]], ["tile_y", "sp", [-1, 1, 8, 1]], ["tile_x", "sp", [-1, 8, 4, 49]], ["tile_rc", "sp", [-1, 2]], ["auto_unroll_max_step", "ot", 128], ["unroll_explicit", "ot", 0]]}, "result": [[0.0065764758496732025], 0, 7.6938745975494385, 1700993768.113958], "version": 0.2, "tvm_version": "0.14.dev0"}
{"input": ["cuda -keys=cuda,gpu -arch=sm_70 -libs=cudnn,cublas -max_num_threads=1024 -thread_warp_size=32", "conv2d_cudnn.cuda", [["TENSOR", [16, 64, 56, 56], "float32"], ["TENSOR", [64, 64, 3, 3], "float32"], [1, 1], [1, 1, 1, 1], [1, 1], 1, "NCHW", "float32"], {}], "config": {"index": 0, "code_hash": null, "entity": [["algo", "ot", 0]]}, "result": [[0.0004433065006490697], 0, 3.348980665206909, 1700993774.3933141], "version": 0.2, "tvm_version": "0.14.dev0"}
{"input": ["cuda -keys=cuda,gpu -arch=sm_70 -libs=cudnn,cublas -max_num_threads=1024 -thread_warp_size=32", "conv2d_cudnn.cuda", [["TENSOR", [16, 64, 56, 56], "float32"], ["TENSOR", [64, 64, 3, 3], "float32"], [1, 1], [1, 1, 1, 1], [1, 1], 1, "NCHW", "float32"], {}], "config": {"index": 7, "code_hash": null, "entity": [["algo", "ot", 7]]}, "result": [[0.00022212924829190288], 0, 4.709683179855347, 1700993779.1110146], "version": 0.2, "tvm_version": "0.14.dev0"}
{"input": ["cuda -keys=cuda,gpu -arch=sm_70 -libs=cudnn,cublas -max_num_threads=1024 -thread_warp_size=32", "conv2d_cudnn.cuda", [["TENSOR", [16, 64, 56, 56], "float32"], ["TENSOR", [64, 64, 3, 3], "float32"], [1, 1], [1, 1, 1, 1], [1, 1], 1, "NCHW", "float32"], {}], "config": {"index": 1, "code_hash": null, "entity": [["algo", "ot", 1]]}, "result": [[0.00027121698902087834], 0, 4.640849590301514, 1700993783.755863], "version": 0.2, "tvm_version": "0.14.dev0"}
{"input": ["cuda -keys=cuda,gpu -arch=sm_70 -libs=cudnn,cublas -max_num_threads=1024 -thread_warp_size=32", "conv2d_cudnn.cuda", [["TENSOR", [16, 64, 56, 56], "float32"], ["TENSOR", [64, 64, 3, 3], "float32"], [1, 1], [1, 1, 1, 1], [1, 1], 1, "NCHW", "float32"], {}], "config": {"index": 6, "code_hash": null, "entity": [["algo", "ot", 6]]}, "result": [[0.00018974449644694927], 0, 4.887118339538574, 1700993788.6517854], "version": 0.2, "tvm_version": "0.14.dev0"}
{"input": ["cuda -keys=cuda,gpu -arch=sm_70 -libs=cudnn,cublas -max_num_threads=1024 -thread_warp_size=32", "conv2d_cudnn.cuda", [["TENSOR", [16, 64, 56, 56], "float32"], ["TENSOR", [64, 64, 3, 3], "float32"], [1, 1], [1, 1, 1, 1], [1, 1], 1, "NCHW", "float32"], {}], "config": {"index": 2, "code_hash": null, "entity": [["algo", "ot", 2]]}, "result": [[0.0006095099945504087], 0, 4.673018217086792, 1700993793.36415], "version": 0.2, "tvm_version": "0.14.dev0"}
{"input": ["cuda -keys=cuda,gpu -arch=sm_70 -libs=cudnn,cublas -max_num_threads=1024 -thread_warp_size=32", "conv2d_cudnn.cuda", [["TENSOR", [16, 64, 56, 56], "float32"], ["TENSOR", [64, 64, 3, 3], "float32"], [1, 1], [1, 1, 1, 1], [1, 1], 1, "NCHW", "float32"], {}], "config": {"index": 4, "code_hash": null, "entity": [["algo", "ot", 4]]}, "result": [[0.0004419676770011274], 0, 5.16308331489563, 1700993798.5343895], "version": 0.2, "tvm_version": "0.14.dev0"}
{"input": ["cuda -keys=cuda,gpu -arch=sm_70 -libs=cudnn,cublas -max_num_threads=1024 -thread_warp_size=32", "conv2d_cudnn.cuda", [["TENSOR", [16, 64, 56, 56], "float32"], ["TENSOR", [64, 64, 3, 3], "float32"], [1, 1], [1, 1, 1, 1], [1, 1], 1, "NCHW", "float32"], {}], "config": {"index": 5, "code_hash": null, "entity": [["algo", "ot", 5]]}, "result": [[0.000345681804835924], 0, 4.91141414642334, 1700993803.4580772], "version": 0.2, "tvm_version": "0.14.dev0"}
{"input": ["cuda -keys=cuda,gpu -arch=sm_70 -libs=cudnn,cublas -max_num_threads=1024 -thread_warp_size=32", "conv2d_nchw.cuda", [["TENSOR", [16, 64, 56, 56], "float32"], ["TENSOR", [256, 64, 1, 1], "float32"], [1, 1], [0, 0, 0, 0], [1, 1], "float32"], {}], "config": {"index": 19418794, "code_hash": null, "entity": [["tile_f", "sp", [-1, 1, 1, 8]], ["tile_y", "sp", [-1, 2, 2, 1]], ["tile_x", "sp", [-1, 2, 1, 2]], ["tile_rc", "sp", [-1, 16]], ["tile_ry", "sp", [-1, 1]], ["tile_rx", "sp", [-1, 1]], ["auto_unroll_max_step", "ot", 1500], ["unroll_explicit", "ot", 0]]}, "result": [[0.002645117139312977], 0, 4.435832500457764, 1700993814.1263852], "version": 0.2, "tvm_version": "0.14.dev0"}
{"input": ["cuda -keys=cuda,gpu -arch=sm_70 -libs=cudnn,cublas -max_num_threads=1024 -thread_warp_size=32", "conv2d_nchw.cuda", [["TENSOR", [16, 64, 56, 56], "float32"], ["TENSOR", [256, 64, 1, 1], "float32"], [1, 1], [0, 0, 0, 0], [1, 1], "float32"], {}], "config": {"index": 22797193, "code_hash": null, "entity": [["tile_f", "sp", [-1, 8, 1, 16]], ["tile_y", "sp", [-1, 8, 1, 1]], ["tile_x", "sp", [-1, 1, 28, 2]], ["tile_rc", "sp", [-1, 1]], ["tile_ry", "sp", [-1, 1]], ["tile_rx", "sp", [-1, 1]], ["auto_unroll_max_step", "ot", 0], ["unroll_explicit", "ot", 1]]}, "result": [[0.010821202430107528], 0, 3.7722580432891846, 1700993816.0910285], "version": 0.2, "tvm_version": "0.14.dev0"}
{"input": ["cuda -keys=cuda,gpu -arch=sm_70 -libs=cudnn,cublas -max_num_threads=1024 -thread_warp_size=32", "conv2d_nchw.cuda", [["TENSOR", [16, 64, 56, 56], "float32"], ["TENSOR", [256, 64, 1, 1], "float32"], [1, 1], [0, 0, 0, 0], [1, 1], "float32"], {}], "config": {"index": 12911566, "code_hash": null, "entity": [["tile_f", "sp", [-1, 4, 2, 32]], ["tile_y", "sp", [-1, 7, 2, 1]], ["tile_x", "sp", [-1, 1, 7, 1]], ["tile_rc", "sp", [-1, 32]], ["tile_ry", "sp", [-1, 1]], ["tile_rx", "sp", [-1, 1]], ["auto_unroll_max_step", "ot", 512], ["unroll_explicit", "ot", 0]]}, "result": [[0.014507700324324324], 0, 6.708369016647339, 1700993818.0940173], "version": 0.2, "tvm_version": "0.14.dev0"}
{"input": ["cuda -keys=cuda,gpu -arch=sm_70 -libs=cudnn,cublas -max_num_threads=1024 -thread_warp_size=32", "conv2d_nchw.cuda", [["TENSOR", [16, 64, 56, 56], "float32"], ["TENSOR", [256, 64, 1, 1], "float32"], [1, 1], [0, 0, 0, 0], [1, 1], "float32"], {}], "config": {"index": 7753792, "code_hash": null, "entity": [["tile_f", "sp", [-1, 8, 1, 8]], ["tile_y", "sp", [-1, 4, 1, 2]], ["tile_x", "sp", [-1, 1, 28, 1]], ["tile_rc", "sp", [-1, 1]], ["tile_ry", "sp", [-1, 1]], ["tile_rx", "sp", [-1, 1]], ["auto_unroll_max_step", "ot", 512], ["unroll_explicit", "ot", 0]]}, "result": [[0.01289867146153846], 0, 3.9456210136413574, 1700993820.0307324], "version": 0.2, "tvm_version": "0.14.dev0"}
{"input": ["cuda -keys=cuda,gpu -arch=sm_70 -libs=cudnn,cublas -max_num_threads=1024 -thread_warp_size=32", "conv2d_nchw.cuda", [["TENSOR", [16, 64, 56, 56], "float32"], ["TENSOR", [256, 64, 1, 1], "float32"], [1, 1], [0, 0, 0, 0], [1, 1], "float32"], {}], "config": {"index": 42477875, "code_hash": null, "entity": [["tile_f", "sp", [-1, 2, 1, 8]], ["tile_y", "sp", [-1, 2, 1, 1]], ["tile_x", "sp", [-1, 1, 7, 1]], ["tile_rc", "sp", [-1, 32]], ["tile_ry", "sp", [-1, 1]], ["tile_rx", "sp", [-1, 1]], ["auto_unroll_max_step", "ot", 1500], ["unroll_explicit", "ot", 1]]}, "result": [[0.0012325346410060976], 0, 7.88977575302124, 1700993823.461321], "version": 0.2, "tvm_version": "0.14.dev0"}
{"input": ["cuda -keys=cuda,gpu -arch=sm_70 -libs=cudnn,cublas -max_num_threads=1024 -thread_warp_size=32", "conv2d_nchw.cuda", [["TENSOR", [16, 64, 56, 56], "float32"], ["TENSOR", [256, 64, 1, 1], "float32"], [1, 1], [0, 0, 0, 0], [1, 1], "float32"], {}], "config": {"index": 17741090, "code_hash": null, "entity": [["tile_f", "sp", [-1, 2, 8, 8]], ["tile_y", "sp", [-1, 2, 1, 1]], ["tile_x", "sp", [-1, 1, 4, 7]], ["tile_rc", "sp", [-1, 4]], ["tile_ry", "sp", [-1, 1]], ["tile_rx", "sp", [-1, 1]], ["auto_unroll_max_step", "ot", 1500], ["unroll_explicit", "ot", 0]]}, "result": [[0.0014939534499999998], 0, 5.678476333618164, 1700993828.0858376], "version": 0.2, "tvm_version": "0.14.dev0"}
{"input": ["cuda -keys=cuda,gpu -arch=sm_70 -libs=cudnn,cublas -max_num_threads=1024 -thread_warp_size=32", "conv2d_nchw.cuda", [["TENSOR", [16, 64, 56, 56], "float32"], ["TENSOR", [256, 64, 1, 1], "float32"], [1, 1], [0, 0, 0, 0], [1, 1], "float32"], {}], "config": {"index": 2343836, "code_hash": null, "entity": [["tile_f", "sp", [-1, 4, 2, 1]], ["tile_y", "sp", [-1, 1, 14, 2]], ["tile_x", "sp", [-1, 14, 4, 1]], ["tile_rc", "sp", [-1, 4]], ["tile_ry", "sp", [-1, 1]], ["tile_rx", "sp", [-1, 1]], ["auto_unroll_max_step", "ot", 0], ["unroll_explicit", "ot", 0]]}, "result": [[0.0009391513893085416], 0, 5.638650894165039, 1700993831.5207152], "version": 0.2, "tvm_version": "0.14.dev0"}
{"input": ["cuda -keys=cuda,gpu -arch=sm_70 -libs=cudnn,cublas -max_num_threads=1024 -thread_warp_size=32", "conv2d_nchw.cuda", [["TENSOR", [16, 64, 56, 56], "float32"], ["TENSOR", [256, 64, 1, 1], "float32"], [1, 1], [0, 0, 0, 0], [1, 1], "float32"], {}], "config": {"index": 9239388, "code_hash": null, "entity": [["tile_f", "sp", [-1, 8, 1, 2]], ["tile_y", "sp", [-1, 1, 1, 28]], ["tile_x", "sp", [-1, 4, 1, 7]], ["tile_rc", "sp", [-1, 2]], ["tile_ry", "sp", [-1, 1]], ["tile_rx", "sp", [-1, 1]], ["auto_unroll_max_step", "ot", 512], ["unroll_explicit", "ot", 0]]}, "result": [[0.4675329101], 0, 9.891610145568848, 1700993837.508238], "version": 0.2, "tvm_version": "0.14.dev0"}
{"input": ["cuda -keys=cuda,gpu -arch=sm_70 -libs=cudnn,cublas -max_num_threads=1024 -thread_warp_size=32", "conv2d_nchw.cuda", [["TENSOR", [16, 64, 56, 56], "float32"], ["TENSOR", [256, 64, 1, 1], "float32"], [1, 1], [0, 0, 0, 0], [1, 1], "float32"], {}], "config": {"index": 40742192, "code_hash": null, "entity": [["tile_f", "sp", [-1, 4, 4, 2]], ["tile_y", "sp", [-1, 1, 7, 2]], ["tile_x", "sp", [-1, 2, 14, 2]], ["tile_rc", "sp", [-1, 8]], ["tile_ry", "sp", [-1, 1]], ["tile_rx", "sp", [-1, 1]], ["auto_unroll_max_step", "ot", 1500], ["unroll_explicit", "ot", 1]]}, "result": [[0.0004958790110599077], 0, 5.024980068206787, 1700993840.9008427], "version": 0.2, "tvm_version": "0.14.dev0"}
{"input": ["cuda -keys=cuda,gpu -arch=sm_70 -libs=cudnn,cublas -max_num_threads=1024 -thread_warp_size=32", "conv2d_nchw.cuda", [["TENSOR", [16, 64, 56, 56], "float32"], ["TENSOR", [256, 64, 1, 1], "float32"], [1, 1], [0, 0, 0, 0], [1, 1], "float32"], {}], "config": {"index": 40046506, "code_hash": null, "entity": [["tile_f", "sp", [-1, 128, 2, 1]], ["tile_y", "sp", [-1, 1, 8, 7]], ["tile_x", "sp", [-1, 1, 2, 14]], ["tile_rc", "sp", [-1, 4]], ["tile_ry", "sp", [-1, 1]], ["tile_rx", "sp", [-1, 1]], ["auto_unroll_max_step", "ot", 1500], ["unroll_explicit", "ot", 1]]}, "result": [[0.019559207615384617], 0, 8.357322454452515, 1700993842.9435441], "version": 0.2, "tvm_version": "0.14.dev0"}
{"input": ["cuda -keys=cuda,gpu -arch=sm_70 -libs=cudnn,cublas -max_num_threads=1024 -thread_warp_size=32", "conv2d_nchw.cuda", [["TENSOR", [16, 64, 56, 56], "float32"], ["TENSOR", [256, 64, 1, 1], "float32"], [1, 1], [0, 0, 0, 0], [1, 1], "float32"], {}], "config": {"index": 97361, "code_hash": null, "entity": [["tile_f", "sp", [-1, 4, 2, 1]], ["tile_y", "sp", [-1, 1, 1, 2]], ["tile_x", "sp", [-1, 56, 1, 1]], ["tile_rc", "sp", [-1, 1]], ["tile_ry", "sp", [-1, 1]], ["tile_rx", "sp", [-1, 1]], ["auto_unroll_max_step", "ot", 0], ["unroll_explicit", "ot", 0]]}, "result": [[0.2536345703], 0, 6.64355206489563, 1700993846.512281], "version": 0.2, "tvm_version": "0.14.dev0"}
{"input": ["cuda -keys=cuda,gpu -arch=sm_70 -libs=cudnn,cublas -max_num_threads=1024 -thread_warp_size=32", "conv2d_cudnn.cuda", [["TENSOR", [16, 64, 56, 56], "float32"], ["TENSOR", [256, 64, 1, 1], "float32"], [1, 1], [0, 0, 0, 0], [1, 1], 1, "NCHW", "float32"], {}], "config": {"index": 2, "code_hash": null, "entity": [["algo", "ot", 2]]}, "result": [[0.0002994964421052632], 0, 4.740041255950928, 1700993853.5227482], "version": 0.2, "tvm_version": "0.14.dev0"}
{"input": ["cuda -keys=cuda,gpu -arch=sm_70 -libs=cudnn,cublas -max_num_threads=1024 -thread_warp_size=32", "conv2d_cudnn.cuda", [["TENSOR", [16, 64, 56, 56], "float32"], ["TENSOR", [256, 64, 1, 1], "float32"], [1, 1], [0, 0, 0, 0], [1, 1], 1, "NCHW", "float32"], {}], "config": {"index": 1, "code_hash": null, "entity": [["algo", "ot", 1]]}, "result": [[0.00014332972202067842], 0, 4.472510099411011, 1700993858.1022344], "version": 0.2, "tvm_version": "0.14.dev0"}
{"input": ["cuda -keys=cuda,gpu -arch=sm_70 -libs=cudnn,cublas -max_num_threads=1024 -thread_warp_size=32", "conv2d_cudnn.cuda", [["TENSOR", [16, 64, 56, 56], "float32"], ["TENSOR", [256, 64, 1, 1], "float32"], [1, 1], [0, 0, 0, 0], [1, 1], 1, "NCHW", "float32"], {}], "config": {"index": 5, "code_hash": null, "entity": [["algo", "ot", 5]]}, "result": [[0.0004880425415575916], 0, 4.89208984375, 1700993867.4893255], "version": 0.2, "tvm_version": "0.14.dev0"}
{"input": ["cuda -keys=cuda,gpu -arch=sm_70 -libs=cudnn,cublas -max_num_threads=1024 -thread_warp_size=32", "conv2d_cudnn.cuda", [["TENSOR", [16, 64, 56, 56], "float32"], ["TENSOR", [256, 64, 1, 1], "float32"], [1, 1], [0, 0, 0, 0], [1, 1], 1, "NCHW", "float32"], {}], "config": {"index": 4, "code_hash": null, "entity": [["algo", "ot", 4]]}, "result": [[0.015014086358208955], 0, 3.626340389251709, 1700993873.619383], "version": 0.2, "tvm_version": "0.14.dev0"}
{"input": ["cuda -keys=cuda,gpu -arch=sm_70 -libs=cudnn,cublas -max_num_threads=1024 -thread_warp_size=32", "conv2d_cudnn.cuda", [["TENSOR", [16, 64, 56, 56], "float32"], ["TENSOR", [256, 64, 1, 1], "float32"], [1, 1], [0, 0, 0, 0], [1, 1], 1, "NCHW", "float32"], {}], "config": {"index": 0, "code_hash": null, "entity": [["algo", "ot", 0]]}, "result": [[0.00025541011134763383], 0, 5.13727331161499, 1700993878.7707195], "version": 0.2, "tvm_version": "0.14.dev0"}
{"input": ["cuda -keys=cuda,gpu -arch=sm_70 -libs=cudnn,cublas -max_num_threads=1024 -thread_warp_size=32", "conv2d_nchw.cuda", [["TENSOR", [16, 256, 56, 56], "float32"], ["TENSOR", [64, 256, 1, 1], "float32"], [1, 1], [0, 0, 0, 0], [1, 1], "float32"], {}], "config": {"index": 10154141, "code_hash": null, "entity": [["tile_f", "sp", [-1, 16, 1, 4]], ["tile_y", "sp", [-1, 4, 1, 1]], ["tile_x", "sp", [-1, 2, 1, 14]], ["tile_rc", "sp", [-1, 1]], ["tile_ry", "sp", [-1, 1]], ["tile_rx", "sp", [-1, 1]], ["auto_unroll_max_step", "ot", 1500], ["unroll_explicit", "ot", 0]]}, "result": [[0.45867182609999996], 0, 8.079399585723877, 1700993895.6138191], "version": 0.2, "tvm_version": "0.14.dev0"}
{"input": ["cuda -keys=cuda,gpu -arch=sm_70 -libs=cudnn,cublas -max_num_threads=1024 -thread_warp_size=32", "conv2d_nchw.cuda", [["TENSOR", [16, 256, 56, 56], "float32"], ["TENSOR", [64, 256, 1, 1], "float32"], [1, 1], [0, 0, 0, 0], [1, 1], "float32"], {}], "config": {"index": 19844634, "code_hash": null, "entity": [["tile_f", "sp", [-1, 1, 2, 4]], ["tile_y", "sp", [-1, 14, 1, 1]], ["tile_x", "sp", [-1, 1, 2, 14]], ["tile_rc", "sp", [-1, 1]], ["tile_ry", "sp", [-1, 1]], ["tile_rx", "sp", [-1, 1]], ["auto_unroll_max_step", "ot", 512], ["unroll_explicit", "ot", 1]]}, "result": [[0.090318656875], 0, 10.95524287223816, 1700993898.828818], "version": 0.2, "tvm_version": "0.14.dev0"}
{"input": ["cuda -keys=cuda,gpu -arch=sm_70 -libs=cudnn,cublas -max_num_threads=1024 -thread_warp_size=32", "conv2d_nchw.cuda", [["TENSOR", [16, 256, 56, 56], "float32"], ["TENSOR", [64, 256, 1, 1], "float32"], [1, 1], [0, 0, 0, 0], [1, 1], "float32"], {}], "config": {"index": 25362939, "code_hash": null, "entity": [["tile_f", "sp", [-1, 1, 16, 4]], ["tile_y", "sp", [-1, 2, 7, 1]], ["tile_x", "sp", [-1, 1, 4, 1]], ["tile_rc", "sp", [-1, 4]], ["tile_ry", "sp", [-1, 1]], ["tile_rx", "sp", [-1, 1]], ["auto_unroll_max_step", "ot", 1500], ["unroll_explicit", "ot", 1]]}, "result": [[0.000252064364163662], 0, 3.8157992362976074, 1700993902.2407043], "version": 0.2, "tvm_version": "0.14.dev0"}
{"input": ["cuda -keys=cuda,gpu -arch=sm_70 -libs=cudnn,cublas -max_num_threads=1024 -thread_warp_size=32", "conv2d_nchw.cuda", [["TENSOR", [16, 256, 56, 56], "float32"], ["TENSOR", [64, 256, 1, 1], "float32"], [1, 1], [0, 0, 0, 0], [1, 1], "float32"], {}], "config": {"index": 8574867, "code_hash": null, "entity": [["tile_f", "sp", [-1, 1, 16, 4]], ["tile_y", "sp", [-1, 2, 1, 1]], ["tile_x", "sp", [-1, 1, 1, 28]], ["tile_rc", "sp", [-1, 64]], ["tile_ry", "sp", [-1, 1]], ["tile_rx", "sp", [-1, 1]], ["auto_unroll_max_step", "ot", 512], ["unroll_explicit", "ot", 0]]}, "result": [[0.0008870384223806912], 0, 5.3676064014434814, 1700993905.6818895], "version": 0.2, "tvm_version": "0.14.dev0"}
{"input": ["cuda -keys=cuda,gpu -arch=sm_70 -libs=cudnn,cublas -max_num_threads=1024 -thread_warp_size=32", "conv2d_nchw.cuda", [["TENSOR", [16, 256, 56, 56], "float32"], ["TENSOR", [64, 256, 1, 1], "float32"], [1, 1], [0, 0, 0, 0], [1, 1], "float32"], {}], "config": {"index": 24892368, "code_hash": null, "entity": [["tile_f", "sp", [-1, 4, 4, 4]], ["tile_y", "sp", [-1, 14, 4, 1]], ["tile_x", "sp", [-1, 1, 14, 1]], ["tile_rc", "sp", [-1, 2]], ["tile_ry", "sp", [-1, 1]], ["tile_rx", "sp", [-1, 1]], ["auto_unroll_max_step", "ot", 1500], ["unroll_explicit", "ot", 1]]}, "result": [[0.00034226885362517094], 0, 3.300194263458252, 1700993907.4437547], "version": 0.2, "tvm_version": "0.14.dev0"}
{"input": ["cuda -keys=cuda,gpu -arch=sm_70 -libs=cudnn,cublas -max_num_threads=1024 -thread_warp_size=32", "conv2d_nchw.cuda", [["TENSOR", [16, 256, 56, 56], "float32"], ["TENSOR", [64, 256, 1, 1], "float32"], [1, 1], [0, 0, 0, 0], [1, 1], "float32"], {}], "config": {"index": 26947048, "code_hash": null, "entity": [["tile_f", "sp", [-1, 8, 4, 1]], ["tile_y", "sp", [-1, 1, 2, 28]], ["tile_x", "sp", [-1, 2, 2, 1]], ["tile_rc", "sp", [-1, 32]], ["tile_ry", "sp", [-1, 1]], ["tile_rx", "sp", [-1, 1]], ["auto_unroll_max_step", "ot", 1500], ["unroll_explicit", "ot", 1]]}, "result": [[0.009903314921568627], 0, 9.911916732788086, 1700993909.320111], "version": 0.2, "tvm_version": "0.14.dev0"}
{"input": ["cuda -keys=cuda,gpu -arch=sm_70 -libs=cudnn,cublas -max_num_threads=1024 -thread_warp_size=32", "conv2d_nchw.cuda", [["TENSOR", [16, 256, 56, 56], "float32"], ["TENSOR", [64, 256, 1, 1], "float32"], [1, 1], [0, 0, 0, 0], [1, 1], "float32"], {}], "config": {"index": 6749440, "code_hash": null, "entity": [["tile_f", "sp", [-1, 2, 4, 2]], ["tile_y", "sp", [-1, 1, 1, 2]], ["tile_x", "sp", [-1, 4, 7, 2]], ["tile_rc", "sp", [-1, 8]], ["tile_ry", "sp", [-1, 1]], ["tile_rx", "sp", [-1, 1]], ["auto_unroll_max_step", "ot", 512], ["unroll_explicit", "ot", 0]]}, "result": [[0.0005857205597826087], 0, 4.630432605743408, 1700993912.8831344], "version": 0.2, "tvm_version": "0.14.dev0"}
{"input": ["cuda -keys=cuda,gpu -arch=sm_70 -libs=cudnn,cublas -max_num_threads=1024 -thread_warp_size=32", "conv2d_nchw.cuda", [["TENSOR", [16, 256, 56, 56], "float32"], ["TENSOR", [64, 256, 1, 1], "float32"], [1, 1], [0, 0, 0, 0], [1, 1], "float32"], {}], "config": {"index": 1811108, "code_hash": null, "entity": [["tile_f", "sp", [-1, 1, 2, 8]], ["tile_y", "sp", [-1, 1, 4, 2]], ["tile_x", "sp", [-1, 1, 56, 1]], ["tile_rc", "sp", [-1, 8]], ["tile_ry", "sp", [-1, 1]], ["tile_rx", "sp", [-1, 1]], ["auto_unroll_max_step", "ot", 0], ["unroll_explicit", "ot", 0]]}, "result": [[0.00027517334482758617], 0, 3.7210655212402344, 1700993916.252733], "version": 0.2, "tvm_version": "0.14.dev0"}
{"input": ["cuda -keys=cuda,gpu -arch=sm_70 -libs=cudnn,cublas -max_num_threads=1024 -thread_warp_size=32", "conv2d_cudnn.cuda", [["TENSOR", [16, 256, 56, 56], "float32"], ["TENSOR", [64, 256, 1, 1], "float32"], [1, 1], [0, 0, 0, 0], [1, 1], 1, "NCHW", "float32"], {}], "config": {"index": 0, "code_hash": null, "entity": [["algo", "ot", 0]]}, "result": [[0.0002157004000304785], 0, 4.993185043334961, 1700993922.316043], "version": 0.2, "tvm_version": "0.14.dev0"}
{"input": ["cuda -keys=cuda,gpu -arch=sm_70 -libs=cudnn,cublas -max_num_threads=1024 -thread_warp_size=32", "conv2d_cudnn.cuda", [["TENSOR", [16, 256, 56, 56], "float32"], ["TENSOR", [64, 256, 1, 1], "float32"], [1, 1], [0, 0, 0, 0], [1, 1], 1, "NCHW", "float32"], {}], "config": {"index": 1, "code_hash": null, "entity": [["algo", "ot", 1]]}, "result": [[0.00014075490225261465], 0, 4.742620468139648, 1700993933.9092708], "version": 0.2, "tvm_version": "0.14.dev0"}
{"input": ["cuda -keys=cuda,gpu -arch=sm_70 -libs=cudnn,cublas -max_num_threads=1024 -thread_warp_size=32", "conv2d_cudnn.cuda", [["TENSOR", [16, 256, 56, 56], "float32"], ["TENSOR", [64, 256, 1, 1], "float32"], [1, 1], [0, 0, 0, 0], [1, 1], 1, "NCHW", "float32"], {}], "config": {"index": 5, "code_hash": null, "entity": [["algo", "ot", 5]]}, "result": [[0.000508974924826904], 0, 5.213752031326294, 1700993939.1538892], "version": 0.2, "tvm_version": "0.14.dev0"}
{"input": ["cuda -keys=cuda,gpu -arch=sm_70 -libs=cudnn,cublas -max_num_threads=1024 -thread_warp_size=32", "conv2d_cudnn.cuda", [["TENSOR", [16, 256, 56, 56], "float32"], ["TENSOR", [64, 256, 1, 1], "float32"], [1, 1], [0, 0, 0, 0], [1, 1], 1, "NCHW", "float32"], {}], "config": {"index": 4, "code_hash": null, "entity": [["algo", "ot", 4]]}, "result": [[0.015128560985074627], 0, 3.7397053241729736, 1700993942.9090607], "version": 0.2, "tvm_version": "0.14.dev0"}
{"input": ["cuda -keys=cuda,gpu -arch=sm_70 -libs=cudnn,cublas -max_num_threads=1024 -thread_warp_size=32", "conv2d_cudnn.cuda", [["TENSOR", [16, 256, 56, 56], "float32"], ["TENSOR", [64, 256, 1, 1], "float32"], [1, 1], [0, 0, 0, 0], [1, 1], 1, "NCHW", "float32"], {}], "config": {"index": 2, "code_hash": null, "entity": [["algo", "ot", 2]]}, "result": [[0.00039065792973651194], 0, 4.970468282699585, 1700993947.8914416], "version": 0.2, "tvm_version": "0.14.dev0"}
{"input": ["cuda -keys=cuda,gpu -arch=sm_70 -libs=cudnn,cublas -max_num_threads=1024 -thread_warp_size=32", "conv2d_nchw.cuda", [["TENSOR", [16, 256, 56, 56], "float32"], ["TENSOR", [128, 256, 1, 1], "float32"], [1, 1], [0, 0, 0, 0], [1, 1], "float32"], {}], "config": {"index": 628462, "code_hash": null, "entity": [["tile_f", "sp", [-1, 2, 8, 1]], ["tile_y", "sp", [-1, 2, 2, 2]], ["tile_x", "sp", [-1, 2, 4, 7]], ["tile_rc", "sp", [-1, 1]], ["tile_ry", "sp", [-1, 1]], ["tile_rx", "sp", [-1, 1]], ["auto_unroll_max_step", "ot", 0], ["unroll_explicit", "ot", 0]]}, "result": [[0.0005967935202140309], 0, 2.5607354640960693, 1700993960.9026794], "version": 0.2, "tvm_version": "0.14.dev0"}
{"input": ["cuda -keys=cuda,gpu -arch=sm_70 -libs=cudnn,cublas -max_num_threads=1024 -thread_warp_size=32", "conv2d_nchw.cuda", [["TENSOR", [16, 256, 56, 56], "float32"], ["TENSOR", [128, 256, 1, 1], "float32"], [1, 1], [0, 0, 0, 0], [1, 1], "float32"], {}], "config": {"index": 35738401, "code_hash": null, "entity": [["tile_f", "sp", [-1, 2, 1, 1]], ["tile_y", "sp", [-1, 8, 1, 7]], ["tile_x", "sp", [-1, 1, 7, 2]], ["tile_rc", "sp", [-1, 2]], ["tile_ry", "sp", [-1, 1]], ["tile_rx", "sp", [-1, 1]], ["auto_unroll_max_step", "ot", 1500], ["unroll_explicit", "ot", 1]]}, "result": [[0.00987421132352941], 0, 4.5345985889434814, 1700993962.8626535], "version": 0.2, "tvm_version": "0.14.dev0"}
{"input": ["cuda -keys=cuda,gpu -arch=sm_70 -libs=cudnn,cublas -max_num_threads=1024 -thread_warp_size=32", "conv2d_nchw.cuda", [["TENSOR", [16, 256, 56, 56], "float32"], ["TENSOR", [128, 256, 1, 1], "float32"], [1, 1], [0, 0, 0, 0], [1, 1], "float32"], {}], "config": {"index": 37752033, "code_hash": null, "entity": [["tile_f", "sp", [-1, 1, 64, 1]], ["tile_y", "sp", [-1, 1, 4, 2]], ["tile_x", "sp", [-1, 14, 2, 1]], ["tile_rc", "sp", [-1, 16]], ["tile_ry", "sp", [-1, 1]], ["tile_rx", "sp", [-1, 1]], ["auto_unroll_max_step", "ot", 1500], ["unroll_explicit", "ot", 1]]}, "result": [[0.0007243243386167148], 0, 4.103021860122681, 1700993964.758377], "version": 0.2, "tvm_version": "0.14.dev0"}
{"input": ["cuda -keys=cuda,gpu -arch=sm_70 -libs=cudnn,cublas -max_num_threads=1024 -thread_warp_size=32", "conv2d_nchw.cuda", [["TENSOR", [16, 256, 56, 56], "float32"], ["TENSOR", [128, 256, 1, 1], "float32"], [1, 1], [0, 0, 0, 0], [1, 1], "float32"], {}], "config": {"index": 9111509, "code_hash": null, "entity": [["tile_f", "sp", [-1, 8, 16, 1]], ["tile_y", "sp", [-1, 2, 2, 1]], ["tile_x", "sp", [-1, 1, 7, 8]], ["tile_rc", "sp", [-1, 4]], ["tile_ry", "sp", [-1, 1]], ["tile_rx", "sp", [-1, 1]], ["auto_unroll_max_step", "ot", 512], ["unroll_explicit", "ot", 0]]}, "result": [[0.000790001217603912], 0, 4.267563581466675, 1700993968.2209406], "version": 0.2, "tvm_version": "0.14.dev0"}
{"input": ["cuda -keys=cuda,gpu -arch=sm_70 -libs=cudnn,cublas -max_num_threads=1024 -thread_warp_size=32", "conv2d_nchw.cuda", [["TENSOR", [16, 256, 56, 56], "float32"], ["TENSOR", [128, 256, 1, 1], "float32"], [1, 1], [0, 0, 0, 0], [1, 1], "float32"], {}], "config": {"index": 1901264, "code_hash": null, "entity": [["tile_f", "sp", [-1, 1, 2, 16]], ["tile_y", "sp", [-1, 7, 1, 1]], ["tile_x", "sp", [-1, 7, 2, 2]], ["tile_rc", "sp", [-1, 4]], ["tile_ry", "sp", [-1, 1]], ["tile_rx", "sp", [-1, 1]], ["auto_unroll_max_step", "ot", 0], ["unroll_explicit", "ot", 0]]}, "result": [[0.21445109859999997], 0, 4.737870693206787, 1700993971.4201488], "version": 0.2, "tvm_version": "0.14.dev0"}
{"input": ["cuda -keys=cuda,gpu -arch=sm_70 -libs=cudnn,cublas -max_num_threads=1024 -thread_warp_size=32", "conv2d_nchw.cuda", [["TENSOR", [16, 256, 56, 56], "float32"], ["TENSOR", [128, 256, 1, 1], "float32"], [1, 1], [0, 0, 0, 0], [1, 1], "float32"], {}], "config": {"index": 3296621, "code_hash": null, "entity": [["tile_f", "sp", [-1, 2, 1, 16]], ["tile_y", "sp", [-1, 2, 1, 2]], ["tile_x", "sp", [-1, 7, 8, 1]], ["tile_rc", "sp", [-1, 16]], ["tile_ry", "sp", [-1, 1]], ["tile_rx", "sp", [-1, 1]], ["auto_unroll_max_step", "ot", 0], ["unroll_explicit", "ot", 0]]}, "result": [[0.061858994411764706], 0, 3.757195472717285, 1700993974.0391815], "version": 0.2, "tvm_version": "0.14.dev0"}
{"input": ["cuda -keys=cuda,gpu -arch=sm_70 -libs=cudnn,cublas -max_num_threads=1024 -thread_warp_size=32", "conv2d_nchw.cuda", [["TENSOR", [16, 256, 56, 56], "float32"], ["TENSOR", [128, 256, 1, 1], "float32"], [1, 1], [0, 0, 0, 0], [1, 1], "float32"], {}], "config": {"index": 36746966, "code_hash": null, "entity": [["tile_f", "sp", [-1, 2, 1, 8]], ["tile_y", "sp", [-1, 1, 4, 7]], ["tile_x", "sp", [-1, 1, 1, 8]], ["tile_rc", "sp", [-1, 4]], ["tile_ry", "sp", [-1, 1]], ["tile_rx", "sp", [-1, 1]], ["auto_unroll_max_step", "ot", 1500], ["unroll_explicit", "ot", 1]]}, "result": [[0.1441816528], 0, 12.15881872177124, 1700993976.5137184], "version": 0.2, "tvm_version": "0.14.dev0"}
{"input": ["cuda -keys=cuda,gpu -arch=sm_70 -libs=cudnn,cublas -max_num_threads=1024 -thread_warp_size=32", "conv2d_nchw.cuda", [["TENSOR", [16, 256, 56, 56], "float32"], ["TENSOR", [128, 256, 1, 1], "float32"], [1, 1], [0, 0, 0, 0], [1, 1], "float32"], {}], "config": {"index": 21187426, "code_hash": null, "entity": [["tile_f", "sp", [-1, 4, 2, 16]], ["tile_y", "sp", [-1, 2, 1, 1]], ["tile_x", "sp", [-1, 1, 28, 2]], ["tile_rc", "sp", [-1, 1]], ["tile_ry", "sp", [-1, 1]], ["tile_rx", "sp", [-1, 1]], ["auto_unroll_max_step", "ot", 0], ["unroll_explicit", "ot", 1]]}, "result": [[0.0008279389220912352], 0, 4.427595853805542, 1700993979.974016], "version": 0.2, "tvm_version": "0.14.dev0"}
{"input": ["cuda -keys=cuda,gpu -arch=sm_70 -libs=cudnn,cublas -max_num_threads=1024 -thread_warp_size=32", "conv2d_cudnn.cuda", [["TENSOR", [16, 256, 56, 56], "float32"], ["TENSOR", [128, 256, 1, 1], "float32"], [1, 1], [0, 0, 0, 0], [1, 1], 1, "NCHW", "float32"], {}], "config": {"index": 2, "code_hash": null, "entity": [["algo", "ot", 2]]}, "result": [[0.0005283032309442549], 0, 4.681777715682983, 1700993985.734267], "version": 0.2, "tvm_version": "0.14.dev0"}
{"input": ["cuda -keys=cuda,gpu -arch=sm_70 -libs=cudnn,cublas -max_num_threads=1024 -thread_warp_size=32", "conv2d_cudnn.cuda", [["TENSOR", [16, 256, 56, 56], "float32"], ["TENSOR", [128, 256, 1, 1], "float32"], [1, 1], [0, 0, 0, 0], [1, 1], 1, "NCHW", "float32"], {}], "config": {"index": 5, "code_hash": null, "entity": [["algo", "ot", 5]]}, "result": [[0.0007527485844032335], 0, 5.563348770141602, 1700993991.3316417], "version": 0.2, "tvm_version": "0.14.dev0"}
{"input": ["cuda -keys=cuda,gpu -arch=sm_70 -libs=cudnn,cublas -max_num_threads=1024 -thread_warp_size=32", "conv2d_cudnn.cuda", [["TENSOR", [16, 256, 56, 56], "float32"], ["TENSOR", [128, 256, 1, 1], "float32"], [1, 1], [0, 0, 0, 0], [1, 1], 1, "NCHW", "float32"], {}], "config": {"index": 4, "code_hash": null, "entity": [["algo", "ot", 4]]}, "result": [[0.016330735725806452], 0, 3.7810072898864746, 1700993999.9141004], "version": 0.2, "tvm_version": "0.14.dev0"}
{"input": ["cuda -keys=cuda,gpu -arch=sm_70 -libs=cudnn,cublas -max_num_threads=1024 -thread_warp_size=32", "conv2d_cudnn.cuda", [["TENSOR", [16, 256, 56, 56], "float32"], ["TENSOR", [128, 256, 1, 1], "float32"], [1, 1], [0, 0, 0, 0], [1, 1], 1, "NCHW", "float32"], {}], "config": {"index": 1, "code_hash": null, "entity": [["algo", "ot", 1]]}, "result": [[0.0002751082289308176], 0, 4.324265241622925, 1700994004.2522824], "version": 0.2, "tvm_version": "0.14.dev0"}
{"input": ["cuda -keys=cuda,gpu -arch=sm_70 -libs=cudnn,cublas -max_num_threads=1024 -thread_warp_size=32", "conv2d_cudnn.cuda", [["TENSOR", [16, 256, 56, 56], "float32"], ["TENSOR", [128, 256, 1, 1], "float32"], [1, 1], [0, 0, 0, 0], [1, 1], 1, "NCHW", "float32"], {}], "config": {"index": 0, "code_hash": null, "entity": [["algo", "ot", 0]]}, "result": [[0.0003446476414640019], 0, 4.829383373260498, 1700994009.0996294], "version": 0.2, "tvm_version": "0.14.dev0"}
{"input": ["cuda -keys=cuda,gpu -arch=sm_70 -libs=cudnn,cublas -max_num_threads=1024 -thread_warp_size=32", "conv2d_nchw.cuda", [["TENSOR", [16, 128, 56, 56], "float32"], ["TENSOR", [128, 128, 3, 3], "float32"], [2, 2], [1, 1, 1, 1], [1, 1], "float32"], {}], "config": {"index": 18853288, "code_hash": null, "entity": [["tile_f", "sp", [-1, 8, 1, 8]], ["tile_y", "sp", [-1, 1, 1, 7]], ["tile_x", "sp", [-1, 2, 2, 1]], ["tile_rc", "sp", [-1, 4]], ["tile_ry", "sp", [-1, 1]], ["tile_rx", "sp", [-1, 1]], ["auto_unroll_max_step", "ot", 0], ["unroll_explicit", "ot", 1]]}, "result": [[0.4128120605], 0, 6.401007413864136, 1700994027.031736], "version": 0.2, "tvm_version": "0.14.dev0"}
{"input": ["cuda -keys=cuda,gpu -arch=sm_70 -libs=cudnn,cublas -max_num_threads=1024 -thread_warp_size=32", "conv2d_nchw.cuda", [["TENSOR", [16, 128, 56, 56], "float32"], ["TENSOR", [128, 128, 3, 3], "float32"], [2, 2], [1, 1, 1, 1], [1, 1], "float32"], {}], "config": {"index": 17559429, "code_hash": null, "entity": [["tile_f", "sp", [-1, 32, 1, 4]], ["tile_y", "sp", [-1, 7, 2, 1]], ["tile_x", "sp", [-1, 1, 1, 2]], ["tile_rc", "sp", [-1, 8]], ["tile_ry", "sp", [-1, 3]], ["tile_rx", "sp", [-1, 3]], ["auto_unroll_max_step", "ot", 1500], ["unroll_explicit", "ot", 0]]}, "result": [[0.47530815420000005], 0, 13.383305072784424, 1700994032.8105383], "version": 0.2, "tvm_version": "0.14.dev0"}
{"input": ["cuda -keys=cuda,gpu -arch=sm_70 -libs=cudnn,cublas -max_num_threads=1024 -thread_warp_size=32", "conv2d_nchw.cuda", [["TENSOR", [16, 128, 56, 56], "float32"], ["TENSOR", [128, 128, 3, 3], "float32"], [2, 2], [1, 1, 1, 1], [1, 1], "float32"], {}], "config": {"index": 17133464, "code_hash": null, "entity": [["tile_f", "sp", [-1, 1, 2, 16]], ["tile_y", "sp", [-1, 1, 1, 2]], ["tile_x", "sp", [-1, 14, 2, 1]], ["tile_rc", "sp", [-1, 2]], ["tile_ry", "sp", [-1, 3]], ["tile_rx", "sp", [-1, 3]], ["auto_unroll_max_step", "ot", 1500], ["unroll_explicit", "ot", 0]]}, "result": [[0.1031296997], 0, 9.496160507202148, 1700994034.6589253], "version": 0.2, "tvm_version": "0.14.dev0"}
