util/prepare_model_store/distilbert-tune-v100.json
{"input": ["cuda -keys=cuda,gpu -arch=sm_70 -max_num_threads=1024 -thread_warp_size=32", "dense_small_batch.gpu", [["TENSOR", [64, 768], "float32"], ["TENSOR", [768, 768], "float32"], null, "float32"], {}], "config": {"index": 10, "code_hash": null, "entity": [["tile_k", "sp", [-1, 48]]]}, "result": [[7.373903412715288e-05], 0, 2.862705945968628, 1704883966.8100057], "version": 0.2, "tvm_version": "0.14.dev0"}
{"input": ["cuda -keys=cuda,gpu -arch=sm_70 -max_num_threads=1024 -thread_warp_size=32", "dense_small_batch.gpu", [["TENSOR", [64, 768], "float32"], ["TENSOR", [768, 768], "float32"], null, "float32"], {}], "config": {"index": 0, "code_hash": null, "entity": [["tile_k", "sp", [-1, 1]]]}, "result": [[0.0010096055071830107], 0, 3.2945327758789062, 1704883969.825646], "version": 0.2, "tvm_version": "0.14.dev0"}
{"input": ["cuda -keys=cuda,gpu -arch=sm_70 -max_num_threads=1024 -thread_warp_size=32", "dense_small_batch.gpu", [["TENSOR", [64, 768], "float32"], ["TENSOR", [768, 768], "float32"], null, "float32"], {}], "config": {"index": 9, "code_hash": null, "entity": [["tile_k", "sp", [-1, 32]]]}, "result": [[7.26144138382971e-05], 0, 3.274324655532837, 1704883972.8073938], "version": 0.2, "tvm_version": "0.14.dev0"}
{"input": ["cuda -keys=cuda,gpu -arch=sm_70 -max_num_threads=1024 -thread_warp_size=32", "dense_small_batch.gpu", [["TENSOR", [64, 768], "float32"], ["TENSOR", [768, 768], "float32"], null, "float32"], {}], "config": {"index": 7, "code_hash": null, "entity": [["tile_k", "sp", [-1, 16]]]}, "result": [[8.076420120512177e-05], 0, 3.3274998664855957, 1704883975.830741], "version": 0.2, "tvm_version": "0.14.dev0"}
{"input": ["cuda -keys=cuda,gpu -arch=sm_70 -max_num_threads=1024 -thread_warp_size=32", "dense_small_batch.gpu", [["TENSOR", [64, 768], "float32"], ["TENSOR", [768, 768], "float32"], null, "float32"], {}], "config": {"index": 5, "code_hash": null, "entity": [["tile_k", "sp", [-1, 8]]]}, "result": [[0.00012974270136037995], 0, 3.287489175796509, 1704883978.8324988], "version": 0.2, "tvm_version": "0.14.dev0"}
{"input": ["cuda -keys=cuda,gpu -arch=sm_70 -max_num_threads=1024 -thread_warp_size=32", "dense_small_batch.gpu", [["TENSOR", [64, 768], "float32"], ["TENSOR", [768, 768], "float32"], null, "float32"], {}], "config": {"index": 8, "code_hash": null, "entity": [["tile_k", "sp", [-1, 24]]]}, "result": [[7.382392391504229e-05], 0, 3.2622592449188232, 1704883981.8112283], "version": 0.2, "tvm_version": "0.14.dev0"}
{"input": ["cuda -keys=cuda,gpu -arch=sm_70 -max_num_threads=1024 -thread_warp_size=32", "dense_small_batch.gpu", [["TENSOR", [64, 768], "float32"], ["TENSOR", [768, 768], "float32"], null, "float32"], {}], "config": {"index": 3, "code_hash": null, "entity": [["tile_k", "sp", [-1, 4]]]}, "result": [[0.00025436806696076884], 0, 3.3105647563934326, 1704883984.8458893], "version": 0.2, "tvm_version": "0.14.dev0"}
{"input": ["cuda -keys=cuda,gpu -arch=sm_70 -max_num_threads=1024 -thread_warp_size=32", "dense_small_batch.gpu", [["TENSOR", [64, 768], "float32"], ["TENSOR", [768, 768], "float32"], null, "float32"], {}], "config": {"index": 16, "code_hash": null, "entity": [["tile_k", "sp", [-1, 384]]]}, "result": [[0.0001632647481016503], 0, 3.252622604370117, 1704883987.8382843], "version": 0.2, "tvm_version": "0.14.dev0"}
{"input": ["cuda -keys=cuda,gpu -arch=sm_70 -max_num_threads=1024 -thread_warp_size=32", "dense_small_batch.gpu", [["TENSOR", [64, 768], "float32"], ["TENSOR", [768, 768], "float32"], null, "float32"], {}], "config": {"index": 17, "code_hash": null, "entity": [["tile_k", "sp", [-1, 768]]]}, "result": [[0.0004023363654468509], 0, 3.2603747844696045, 1704883990.8381658], "version": 0.2, "tvm_version": "0.14.dev0"}
{"input": ["cuda -keys=cuda,gpu -arch=sm_70 -max_num_threads=1024 -thread_warp_size=32", "dense_small_batch.gpu", [["TENSOR", [64, 768], "float32"], ["TENSOR", [768, 768], "float32"], null, "float32"], {}], "config": {"index": 2, "code_hash": null, "entity": [["tile_k", "sp", [-1, 3]]]}, "result": [[0.00033777921059242205], 0, 3.3436179161071777, 1704883993.8842833], "version": 0.2, "tvm_version": "0.14.dev0"}
{"input": ["cuda -keys=cuda,gpu -arch=sm_70 -max_num_threads=1024 -thread_warp_size=32", "dense_small_batch.gpu", [["TENSOR", [64, 768], "float32"], ["TENSOR", [768, 768], "float32"], null, "float32"], {}], "config": {"index": 15, "code_hash": null, "entity": [["tile_k", "sp", [-1, 256]]]}, "result": [[0.00011217037275511626], 0, 3.264374017715454, 1704883996.8864276], "version": 0.2, "tvm_version": "0.14.dev0"}
{"input": ["cuda -keys=cuda,gpu -arch=sm_70 -max_num_threads=1024 -thread_warp_size=32", "dense_small_batch.gpu", [["TENSOR", [64, 768], "float32"], ["TENSOR", [768, 768], "float32"], null, "float32"], {}], "config": {"index": 1, "code_hash": null, "entity": [["tile_k", "sp", [-1, 2]]]}, "result": [[0.0005047918407742741], 0, 3.2893474102020264, 1704883999.8862963], "version": 0.2, "tvm_version": "0.14.dev0"}
{"input": ["cuda -keys=cuda,gpu -arch=sm_70 -max_num_threads=1024 -thread_warp_size=32", "dense_small_batch.gpu", [["TENSOR", [64, 768], "float32"], ["TENSOR", [768, 768], "float32"], null, "float32"], {}], "config": {"index": 6, "code_hash": null, "entity": [["tile_k", "sp", [-1, 12]]]}, "result": [[9.449657275341903e-05], 0, 3.32906436920166, 1704884002.9164765], "version": 0.2, "tvm_version": "0.14.dev0"}
{"input": ["cuda -keys=cuda,gpu -arch=sm_70 -max_num_threads=1024 -thread_warp_size=32", "dense_small_batch.gpu", [["TENSOR", [64, 768], "float32"], ["TENSOR", [768, 768], "float32"], null, "float32"], {}], "config": {"index": 12, "code_hash": null, "entity": [["tile_k", "sp", [-1, 96]]]}, "result": [[7.276477032474298e-05], 0, 3.4043216705322266, 1704884006.0471156], "version": 0.2, "tvm_version": "0.14.dev0"}
{"input": ["cuda -keys=cuda,gpu -arch=sm_70 -max_num_threads=1024 -thread_warp_size=32", "dense_small_batch.gpu", [["TENSOR", [64, 768], "float32"], ["TENSOR", [768, 768], "float32"], null, "float32"], {}], "config": {"index": 4, "code_hash": null, "entity": [["tile_k", "sp", [-1, 6]]]}, "result": [[0.00017112650079660117], 0, 3.286604642868042, 1704884009.0394282], "version": 0.2, "tvm_version": "0.14.dev0"}
{"input": ["cuda -keys=cuda,gpu -arch=sm_70 -max_num_threads=1024 -thread_warp_size=32", "dense_small_batch.gpu", [["TENSOR", [64, 768], "float32"], ["TENSOR", [768, 768], "float32"], null, "float32"], {}], "config": {"index": 13, "code_hash": null, "entity": [["tile_k", "sp", [-1, 128]]]}, "result": [[7.351967839333913e-05], 0, 3.29276967048645, 1704884012.0645952], "version": 0.2, "tvm_version": "0.14.dev0"}
{"input": ["cuda -keys=cuda,gpu -arch=sm_70 -max_num_threads=1024 -thread_warp_size=32", "dense_small_batch.gpu", [["TENSOR", [64, 768], "float32"], ["TENSOR", [768, 768], "float32"], null, "float32"], {}], "config": {"index": 11, "code_hash": null, "entity": [["tile_k", "sp", [-1, 64]]]}, "result": [[7.296747523718734e-05], 0, 3.387676477432251, 1704884015.1821883], "version": 0.2, "tvm_version": "0.14.dev0"}
{"input": ["cuda -keys=cuda,gpu -arch=sm_70 -max_num_threads=1024 -thread_warp_size=32", "dense_small_batch.gpu", [["TENSOR", [64, 768], "float32"], ["TENSOR", [768, 768], "float32"], null, "float32"], {}], "config": {"index": 14, "code_hash": null, "entity": [["tile_k", "sp", [-1, 192]]]}, "result": [[9.345004567614625e-05], 0, 3.2489235401153564, 1704884018.1640828], "version": 0.2, "tvm_version": "0.14.dev0"}
{"input": ["cuda -keys=cuda,gpu -arch=sm_70 -max_num_threads=1024 -thread_warp_size=32", "dense_large_batch.gpu", [["TENSOR", [64, 768], "float32"], ["TENSOR", [768, 768], "float32"], null, "float32"], {}], "config": {"index": 365248, "code_hash": null, "entity": [["tile_x", "sp", [-1, 8, 4, 1]], ["tile_y", "sp", [-1, 2, 4, 6]], ["tile_k", "sp", [-1, 12, 1]]]}, "result": [[0.00023294365799695997], 0, 6.841276168823242, 1704884031.2547147], "version": 0.2, "tvm_version": "0.14.dev0"}
{"input": ["cuda -keys=cuda,gpu -arch=sm_70 -max_num_threads=1024 -thread_warp_size=32", "dense_large_batch.gpu", [["TENSOR", [64, 768], "float32"], ["TENSOR", [768, 768], "float32"], null, "float32"], {}], "config": {"index": 2397730, "code_hash": null, "entity": [["tile_x", "sp", [-1, 1, 2, 2]], ["tile_y", "sp", [-1, 192, 2, 2]], ["tile_k", "sp", [-1, 1, 4]]]}, "result": [[0.09570597075000001], 0, 7.536550283432007, 1704884034.3701673], "version": 0.2, "tvm_version": "0.14.dev0"}
{"input": ["cuda -keys=cuda,gpu -arch=sm_70 -max_num_threads=1024 -thread_warp_size=32", "dense_large_batch.gpu", [["TENSOR", [64, 768], "float32"], ["TENSOR", [768, 768], "float32"], null, "float32"], {}], "config": {"index": 483681, "code_hash": null, "entity": [["tile_x", "sp", [-1, 4, 2, 1]], ["tile_y", "sp", [-1, 1, 2, 12]], ["tile_k", "sp", [-1, 24, 1]]]}, "result": [[0.00014269216000827986], 0, 4.715104818344116, 1704884135.5179594], "version": 0.2, "tvm_version": "0.14.dev0"}
{"input": ["cuda -keys=cuda,gpu -arch=sm_70 -max_num_threads=1024 -thread_warp_size=32", "dense_large_batch.gpu", [["TENSOR", [64, 768], "float32"], ["TENSOR", [768, 768], "float32"], null, "float32"], {}], "config": {"index": 469063, "code_hash": null, "entity": [["tile_x", "sp", [-1, 1, 2, 1]], ["tile_y", "sp", [-1, 3, 2, 4]], ["tile_k", "sp", [-1, 24, 1]]]}, "result": [[0.00016373242080162354], 0, 4.903302192687988, 1704884139.1962414], "version": 0.2, "tvm_version": "0.14.dev0"}
{"input": ["cuda -keys=cuda,gpu -arch=sm_70 -max_num_threads=1024 -thread_warp_size=32", "dense_large_batch.gpu", [["TENSOR", [64, 768], "float32"], ["TENSOR", [768, 768], "float32"], null, "float32"], {}], "config": {"index": 578762, "code_hash": null, "entity": [["tile_x", "sp", [-1, 4, 1, 1]], ["tile_y", "sp", [-1, 3, 1, 4]], ["tile_k", "sp", [-1, 48, 1]]]}, "result": [[0.0003986571827189853], 0, 7.801471948623657, 1704884140.5922937], "version": 0.2, "tvm_version": "0.14.dev0"}
{"input": ["cuda -keys=cuda,gpu -arch=sm_70 -max_num_threads=1024 -thread_warp_size=32", "dense_large_batch.gpu", [["TENSOR", [64, 768], "float32"], ["TENSOR", [768, 768], "float32"], null, "float32"], {}], "config": {"index": 475533, "code_hash": null, "entity": [["tile_x", "sp", [-1, 4, 2, 1]], ["tile_y", "sp", [-1, 2, 2, 6]], ["tile_k", "sp", [-1, 24, 1]]]}, "result": [[0.00014247606353273834], 0, 5.4623703956604, 1704884143.6307213], "version": 0.2, "tvm_version": "0.14.dev0"}
{"input": ["cuda -keys=cuda,gpu -arch=sm_70 -max_num_threads=1024 -thread_warp_size=32", "batch_matmul.cuda", [["TENSOR", [12, 64, 64], "float32"], ["TENSOR", [12, 64, 64], "float32"], [12, 64, 64], "float32", 0, 1], {}], "config": {"index": 15016, "code_hash": null, "entity": [["tile_y", "sp", [-1, 2, 2]], ["tile_x", "sp", [-1, 16, 1]], ["tile_k", "sp", [-1, 32]], ["auto_unroll_max_step", "ot", 32], ["unroll_explicit", "ot", 0]]}, "result": [[7.57101470901604e-06], 0, 3.4034550189971924, 1704884242.9835548], "version": 0.2, "tvm_version": "0.14.dev0"}
{"input": ["cuda -keys=cuda,gpu -arch=sm_70 -max_num_threads=1024 -thread_warp_size=32", "batch_matmul.cuda", [["TENSOR", [12, 64, 64], "float32"], ["TENSOR", [12, 64, 64], "float32"], [12, 64, 64], "float32", 0, 1], {}], "config": {"index": 22338, "code_hash": null, "entity": [["tile_y", "sp", [-1, 1, 16]], ["tile_x", "sp", [-1, 1, 4]], ["tile_k", "sp", [-1, 1]], ["auto_unroll_max_step", "ot", 8], ["unroll_explicit", "ot", 1]]}, "result": [[2.9814047634879297e-05], 0, 3.8015952110290527, 1704884245.9958816], "version": 0.2, "tvm_version": "0.14.dev0"}
{"input": ["cuda -keys=cuda,gpu -arch=sm_70 -max_num_threads=1024 -thread_warp_size=32", "batch_matmul.cuda", [["TENSOR", [12, 64, 64], "float32"], ["TENSOR", [12, 64, 64], "float32"], [12, 64, 64], "float32", 0, 1], {}], "config": {"index": 38025, "code_hash": null, "entity": [["tile_y", "sp", [-1, 2, 1]], ["tile_x", "sp", [-1, 2, 4]], ["tile_k", "sp", [-1, 64]], ["auto_unroll_max_step", "ot", 32], ["unroll_explicit", "ot", 1]]}, "result": [[2.858763527434396e-05], 0, 3.8945469856262207, 1704884248.9277043], "version": 0.2, "tvm_version": "0.14.dev0"}
{"input": ["cuda -keys=cuda,gpu -arch=sm_70 -max_num_threads=1024 -thread_warp_size=32", "batch_matmul.cuda", [["TENSOR", [12, 64, 64], "float32"], ["TENSOR", [12, 64, 64], "float32"], [12, 64, 64], "float32", 0, 1], {}], "config": {"index": 39710, "code_hash": null, "entity": [["tile_y", "sp", [-1, 64, 1]], ["tile_x", "sp", [-1, 1, 8]], ["tile_k", "sp", [-1, 2]], ["auto_unroll_max_step", "ot", 64], ["unroll_explicit", "ot", 1]]}, "result": [[1.1696516950687538e-05], 0, 3.8131043910980225, 1704884251.7977645], "version": 0.2, "tvm_version": "0.14.dev0"}
{"input": ["cuda -keys=cuda,gpu -arch=sm_70 -max_num_threads=1024 -thread_warp_size=32", "batch_matmul.cuda", [["TENSOR", [12, 64, 64], "float32"], ["TENSOR", [12, 64, 64], "float32"], [12, 64, 64], "float32", 0, 1], {}], "config": {"index": 34426, "code_hash": null, "entity": [["tile_y", "sp", [-1, 2, 4]], ["tile_x", "sp", [-1, 1, 32]], ["tile_k", "sp", [-1, 2]], ["auto_unroll_max_step", "ot", 32], ["unroll_explicit", "ot", 1]]}, "result": [[2.5242685703371216e-05], 0, 4.133203506469727, 1704884254.7657223], "version": 0.2, "tvm_version": "0.14.dev0"}
{"input": ["cuda -keys=cuda,gpu -arch=sm_70 -max_num_threads=1024 -thread_warp_size=32", "batch_matmul.cuda", [["TENSOR", [12, 64, 64], "float32"], ["TENSOR", [12, 64, 64], "float32"], [12, 64, 64], "float32", 0, 1], {}], "config": {"index": 35670, "code_hash": null, "entity": [["tile_y", "sp", [-1, 2, 32]], ["tile_x", "sp", [-1, 1, 4]], ["tile_k", "sp", [-1, 8]], ["auto_unroll_max_step", "ot", 32], ["unroll_explicit", "ot", 1]]}, "result": [[3.992758540783238e-05], 0, 4.113970756530762, 1704884257.778116], "version": 0.2, "tvm_version": "0.14.dev0"}
{"input": ["cuda -keys=cuda,gpu -arch=sm_70 -max_num_threads=1024 -thread_warp_size=32", "batch_matmul.cuda", [["TENSOR", [12, 64, 64], "float32"], ["TENSOR", [12, 64, 64], "float32"], [12, 64, 64], "float32", 0, 1], {}], "config": {"index": 36296, "code_hash": null, "entity": [["tile_y", "sp", [-1, 2, 2]], ["tile_x", "sp", [-1, 2, 2]], ["tile_k", "sp", [-1, 16]], ["auto_unroll_max_step", "ot", 32], ["unroll_explicit", "ot", 1]]}, "result": [[1.5935101232643808e-05], 0, 3.890310525894165, 1704884260.6862497], "version": 0.2, "tvm_version": "0.14.dev0"}
{"input": ["cuda -keys=cuda,gpu -arch=sm_70 -max_num_threads=1024 -thread_warp_size=32", "batch_matmul.cuda", [["TENSOR", [12, 64, 64], "float32"], ["TENSOR", [12, 64, 64], "float32"], [12, 64, 64], "float32", 0, 1], {}], "config": {"index": 35253, "code_hash": null, "entity": [["tile_y", "sp", [-1, 2, 1]], ["tile_x", "sp", [-1, 1, 64]], ["tile_k", "sp", [-1, 4]], ["auto_unroll_max_step", "ot", 32], ["unroll_explicit", "ot", 1]]}, "result": [[3.3192333664041665e-05], 0, 3.9711570739746094, 1704884263.6871119], "version": 0.2, "tvm_version": "0.14.dev0"}
{"input": ["cuda -keys=cuda,gpu -arch=sm_70 -max_num_threads=1024 -thread_warp_size=32", "batch_matmul.cuda", [["TENSOR", [12, 64, 64], "float32"], ["TENSOR", [12, 64, 64], "float32"], [12, 64, 64], "float32", 0, 1], {}], "config": {"index": 40371, "code_hash": null, "entity": [["tile_y", "sp", [-1, 2, 16]], ["tile_x", "sp", [-1, 1, 4]], ["tile_k", "sp", [-1, 4]], ["auto_unroll_max_step", "ot", 64], ["unroll_explicit", "ot", 1]]}, "result": [[2.0721543081621466e-05], 0, 4.072416067123413, 1704884266.6906147], "version": 0.2, "tvm_version": "0.14.dev0"}
{"input": ["cuda -keys=cuda,gpu -arch=sm_70 -max_num_threads=1024 -thread_warp_size=32", "batch_matmul.cuda", [["TENSOR", [12, 64, 64], "float32"], ["TENSOR", [12, 64, 64], "float32"], [12, 64, 64], "float32", 0, 1], {}], "config": {"index": 17780, "code_hash": null, "entity": [["tile_y", "sp", [-1, 1, 1]], ["tile_x", "sp", [-1, 2, 8]], ["tile_k", "sp", [-1, 2]], ["auto_unroll_max_step", "ot", 64], ["unroll_explicit", "ot", 0]]}, "result": [[4.8875066206770245e-05], 0, 3.9356443881988525, 1704884269.643808], "version": 0.2, "tvm_version": "0.14.dev0"}
{"input": ["cuda -keys=cuda,gpu -arch=sm_70 -max_num_threads=1024 -thread_warp_size=32", "batch_matmul.cuda", [["TENSOR", [12, 64, 64], "float32"], ["TENSOR", [12, 64, 64], "float32"], [12, 64, 64], "float32", 0, 1], {}], "config": {"index": 41854, "code_hash": null, "entity": [["tile_y", "sp", [-1, 1, 16]], ["tile_x", "sp", [-1, 8, 2]], ["tile_k", "sp", [-1, 16]], ["auto_unroll_max_step", "ot", 64], ["unroll_explicit", "ot", 1]]}, "result": [[1.1822163339217929e-05], 0, 4.1252501010894775, 1704884272.5679488], "version": 0.2, "tvm_version": "0.14.dev0"}
{"input": ["cuda -keys=cuda,gpu -arch=sm_70 -max_num_threads=1024 -thread_warp_size=32", "batch_matmul.cuda", [["TENSOR", [12, 64, 64], "float32"], ["TENSOR", [12, 64, 64], "float32"], [12, 64, 64], "float32", 0, 1], {}], "config": {"index": 14132, "code_hash": null, "entity": [["tile_y", "sp", [-1, 4, 8]], ["tile_x", "sp", [-1, 1, 1]], ["tile_k", "sp", [-1, 16]], ["auto_unroll_max_step", "ot", 32], ["unroll_explicit", "ot", 0]]}, "result": [[4.5602165304087735e-05], 0, 4.044262170791626, 1704884275.6570587], "version": 0.2, "tvm_version": "0.14.dev0"}
{"input": ["cuda -keys=cuda,gpu -arch=sm_70 -max_num_threads=1024 -thread_warp_size=32", "batch_matmul.cuda", [["TENSOR", [12, 64, 64], "float32"], ["TENSOR", [12, 64, 64], "float32"], [12, 64, 64], "float32", 0, 1], {}], "config": {"index": 16626, "code_hash": null, "entity": [["tile_y", "sp", [-1, 1, 16]], ["tile_x", "sp", [-1, 32, 1]], ["tile_k", "sp", [-1, 1]], ["auto_unroll_max_step", "ot", 64], ["unroll_explicit", "ot", 0]]}, "result": [[2.6125021607833457e-05], 0, 3.872346878051758, 1704884278.5758557], "version": 0.2, "tvm_version": "0.14.dev0"}
{"input": ["cuda -keys=cuda,gpu -arch=sm_70 -max_num_threads=1024 -thread_warp_size=32", "batch_matmul.cuda", [["TENSOR", [12, 64, 64], "float32"], ["TENSOR", [12, 64, 64], "float32"], [12, 64, 64], "float32", 0, 1], {}], "config": {"index": 20881, "code_hash": null, "entity": [["tile_y", "sp", [-1, 8, 8]], ["tile_x", "sp", [-1, 16, 4]], ["tile_k", "sp", [-1, 32]], ["auto_unroll_max_step", "ot", 64], ["unroll_explicit", "ot", 0]]}, "result": [[1.1519888515652349e-05], 0, 3.8961081504821777, 1704884281.4747581], "version": 0.2, "tvm_version": "0.14.dev0"}
{"input": ["cuda -keys=cuda,gpu -arch=sm_70 -max_num_threads=1024 -thread_warp_size=32", "batch_matmul.cuda", [["TENSOR", [12, 64, 64], "float32"], ["TENSOR", [12, 64, 64], "float32"], [12, 64, 64], "float32", 0, 1], {}], "config": {"index": 20347, "code_hash": null, "entity": [["tile_y", "sp", [-1, 2, 8]], ["tile_x", "sp", [-1, 2, 32]], ["tile_k", "sp", [-1, 16]], ["auto_unroll_max_step", "ot", 64], ["unroll_explicit", "ot", 0]]}, "result": [[0.0001301950157604413], 0, 4.252538681030273, 1704884284.251178], "version": 0.2, "tvm_version": "0.14.dev0"}
{"input": ["cuda -keys=cuda,gpu -arch=sm_70 -max_num_threads=1024 -thread_warp_size=32", "batch_matmul.cuda", [["TENSOR", [12, 64, 64], "float32"], ["TENSOR", [12, 64, 64], "float32"], [12, 64, 64], "float32", 0, 1], {}], "config": {"index": 1350, "code_hash": null, "entity": [["tile_y", "sp", [-1, 64, 1]], ["tile_x", "sp", [-1, 4, 8]], ["tile_k", "sp", [-1, 2]], ["auto_unroll_max_step", "ot", 8], ["unroll_explicit", "ot", 0]]}, "result": [[1.4958604948299917e-05], 0, 3.7623002529144287, 1704884287.1401458], "version": 0.2, "tvm_version": "0.14.dev0"}
{"input": ["cuda -keys=cuda,gpu -arch=sm_70 -max_num_threads=1024 -thread_warp_size=32", "batch_matmul.cuda", [["TENSOR", [12, 64, 64], "float32"], ["TENSOR", [12, 64, 64], "float32"], [12, 64, 64], "float32", 0, 1], {}], "config": {"index": 22928, "code_hash": null, "entity": [["tile_y", "sp", [-1, 4, 16]], ["tile_x", "sp", [-1, 64, 1]], ["tile_k", "sp", [-1, 2]], ["auto_unroll_max_step", "ot", 8], ["unroll_explicit", "ot", 1]]}, "result": [[2.1270945682207217e-05], 0, 3.89235258102417, 1704884290.0942886], "version": 0.2, "tvm_version": "0.14.dev0"}
{"input": ["cuda -keys=cuda,gpu -arch=sm_70 -max_num_threads=1024 -thread_warp_size=32", "batch_matmul.cuda", [["TENSOR", [12, 64, 64], "float32"], ["TENSOR", [12, 64, 64], "float32"], [12, 64, 64], "float32", 0, 1], {}], "config": {"index": 2692, "code_hash": null, "entity": [["tile_y", "sp", [-1, 16, 1]], ["tile_x", "sp", [-1, 32, 2]], ["tile_k", "sp", [-1, 8]], ["auto_unroll_max_step", "ot", 8], ["unroll_explicit", "ot", 0]]}, "result": [[9.612564123017482e-06], 0, 3.7620818614959717, 1704884292.9473724], "version": 0.2, "tvm_version": "0.14.dev0"}
{"input": ["cuda -keys=cuda,gpu -arch=sm_70 -max_num_threads=1024 -thread_warp_size=32", "batch_matmul.cuda", [["TENSOR", [12, 64, 64], "float32"], ["TENSOR", [12, 64, 64], "float32"], [12, 64, 64], "float32", 0, 1], {}], "config": {"index": 40110, "code_hash": null, "entity": [["tile_y", "sp", [-1, 2, 4]], ["tile_x", "sp", [-1, 16, 1]], ["tile_k", "sp", [-1, 4]], ["auto_unroll_max_step", "ot", 64], ["unroll_explicit", "ot", 1]]}, "result": [[6.5563277379662625e-06], 0, 3.668098211288452, 1704884295.8126273], "version": 0.2, "tvm_version": "0.14.dev0"}
{"input": ["cuda -keys=cuda,gpu -arch=sm_70 -max_num_threads=1024 -thread_warp_size=32", "batch_matmul.cuda", [["TENSOR", [12, 64, 64], "float32"], ["TENSOR", [12, 64, 64], "float32"], [12, 64, 64], "float32", 0, 1], {}], "config": {"index": 17525, "code_hash": null, "entity": [["tile_y", "sp", [-1, 1, 32]], ["tile_x", "sp", [-1, 4, 2]], ["tile_k", "sp", [-1, 2]], ["auto_unroll_max_step", "ot", 64], ["unroll_explicit", "ot", 0]]}, "result": [[2.244618187607914e-05], 0, 3.9117252826690674, 1704884298.7813284], "version": 0.2, "tvm_version": "0.14.dev0"}
{"input": ["cuda -keys=cuda,gpu -arch=sm_70 -max_num_threads=1024 -thread_warp_size=32", "batch_matmul.cuda", [["TENSOR", [12, 64, 64], "float32"], ["TENSOR", [12, 64, 64], "float32"], [12, 64, 64], "float32", 0, 1], {}], "config": {"index": 18643, "code_hash": null, "entity": [["tile_y", "sp", [-1, 2, 16]], ["tile_x", "sp", [-1, 8, 8]], ["tile_k", "sp", [-1, 4]], ["auto_unroll_max_step", "ot", 64], ["unroll_explicit", "ot", 0]]}, "result": [[3.0193221103908413e-05], 0, 4.013871908187866, 1704884301.7131603], "version": 0.2, "tvm_version": "0.14.dev0"}
{"input": ["cuda -keys=cuda,gpu -arch=sm_70 -max_num_threads=1024 -thread_warp_size=32", "batch_matmul.cuda", [["TENSOR", [12, 64, 64], "float32"], ["TENSOR", [12, 64, 64], "float32"], [12, 64, 64], "float32", 0, 1], {}], "config": {"index": 40106, "code_hash": null, "entity": [["tile_y", "sp", [-1, 8, 2]], ["tile_x", "sp", [-1, 16, 1]], ["tile_k", "sp", [-1, 4]], ["auto_unroll_max_step", "ot", 64], ["unroll_explicit", "ot", 1]]}, "result": [[5.310745828674637e-06], 0, 3.380706548690796, 1704884304.5888128], "version": 0.2, "tvm_version": "0.14.dev0"}
{"input": ["cuda -keys=cuda,gpu -arch=sm_70 -max_num_threads=1024 -thread_warp_size=32", "batch_matmul.cuda", [["TENSOR", [12, 64, 64], "float32"], ["TENSOR", [12, 64, 64], "float32"], [12, 64, 64], "float32", 0, 1], {}], "config": {"index": 42148, "code_hash": null, "entity": [["tile_y", "sp", [-1, 2, 2]], ["tile_x", "sp", [-1, 8, 8]], ["tile_k", "sp", [-1, 16]], ["auto_unroll_max_step", "ot", 64], ["unroll_explicit", "ot", 1]]}, "result": [[9.202810954318876e-06], 0, 3.9088759422302246, 1704884307.4653084], "version": 0.2, "tvm_version": "0.14.dev0"}
{"input": ["cuda -keys=cuda,gpu -arch=sm_70 -max_num_threads=1024 -thread_warp_size=32", "batch_matmul.cuda", [["TENSOR", [12, 64, 64], "float32"], ["TENSOR", [12, 64, 64], "float32"], [12, 64, 64], "float32", 0, 1], {}], "config": {"index": 24239, "code_hash": null, "entity": [["tile_y", "sp", [-1, 2, 8]], ["tile_x", "sp", [-1, 1, 32]], ["tile_k", "sp", [-1, 4]], ["auto_unroll_max_step", "ot", 8], ["unroll_explicit", "ot", 1]]}, "result": [[5.9398028161196014e-05], 0, 4.059212923049927, 1704884310.426462], "version": 0.2, "tvm_version": "0.14.dev0"}
{"input": ["cuda -keys=cuda,gpu -arch=sm_70 -max_num_threads=1024 -thread_warp_size=32", "batch_matmul.cuda", [["TENSOR", [12, 64, 64], "float32"], ["TENSOR", [12, 64, 64], "float32"], [12, 64, 64], "float32", 0, 1], {}], "config": {"index": 10186, "code_hash": null, "entity": [["tile_y", "sp", [-1, 1, 16]], ["tile_x", "sp", [-1, 1, 64]], ["tile_k", "sp", [-1, 32]], ["auto_unroll_max_step", "ot", 16], ["unroll_explicit", "ot", 0]]}, "result": [[0.0012941911166950597], 0, 4.237884998321533, 1704884313.264734], "version": 0.2, "tvm_version": "0.14.dev0"}
{"input": ["cuda -keys=cuda,gpu -arch=sm_70 -max_num_threads=1024 -thread_warp_size=32", "batch_matmul.cuda", [["TENSOR", [12, 64, 64], "float32"], ["TENSOR", [12, 64, 64], "float32"], [12, 64, 64], "float32", 0, 1], {}], "config": {"index": 41795, "code_hash": null, "entity": [["tile_y", "sp", [-1, 2, 8]], ["tile_x", "sp", [-1, 2, 2]], ["tile_k", "sp", [-1, 16]], ["auto_unroll_max_step", "ot", 64], ["unroll_explicit", "ot", 1]]}, "result": [[1.06645929051971e-05], 0, 3.941531181335449, 1704884316.1850514], "version": 0.2, "tvm_version": "0.14.dev0"}
{"input": ["cuda -keys=cuda,gpu -arch=sm_70 -max_num_threads=1024 -thread_warp_size=32", "batch_matmul.cuda", [["TENSOR", [12, 64, 64], "float32"], ["TENSOR", [12, 64, 64], "float32"], [12, 64, 64], "float32", 0, 1], {}], "config": {"index": 36697, "code_hash": null, "entity": [["tile_y", "sp", [-1, 16, 4]], ["tile_x", "sp", [-1, 1, 16]], ["tile_k", "sp", [-1, 16]], ["auto_unroll_max_step", "ot", 32], ["unroll_explicit", "ot", 1]]}, "result": [[1.796464293208046e-05], 0, 4.088684320449829, 1704884319.0961304], "version": 0.2, "tvm_version": "0.14.dev0"}
{"input": ["cuda -keys=cuda,gpu -arch=sm_70 -max_num_threads=1024 -thread_warp_size=32", "batch_matmul.cuda", [["TENSOR", [12, 64, 64], "float32"], ["TENSOR", [12, 64, 64], "float32"], [12, 64, 64], "float32", 0, 1], {}], "config": {"index": 18890, "code_hash": null, "entity": [["tile_y", "sp", [-1, 1, 8]], ["tile_x", "sp", [-1, 4, 1]], ["tile_k", "sp", [-1, 8]], ["auto_unroll_max_step", "ot", 64], ["unroll_explicit", "ot", 0]]}, "result": [[1.186108614947074e-05], 0, 3.6647913455963135, 1704884321.9805295], "version": 0.2, "tvm_version": "0.14.dev0"}
{"input": ["cuda -keys=cuda,gpu -arch=sm_70 -max_num_threads=1024 -thread_warp_size=32", "batch_matmul.cuda", [["TENSOR", [12, 64, 64], "float32"], ["TENSOR", [12, 64, 64], "float32"], [12, 64, 64], "float32", 0, 1], {}], "config": {"index": 14584, "code_hash": null, "entity": [["tile_y", "sp", [-1, 4, 16]], ["tile_x", "sp", [-1, 8, 4]], ["tile_k", "sp", [-1, 16]], ["auto_unroll_max_step", "ot", 32], ["unroll_explicit", "ot", 0]]}, "result": [[1.5727051598553237e-05], 0, 3.874176502227783, 1704884324.9807916], "version": 0.2, "tvm_version": "0.14.dev0"}
{"input": ["cuda -keys=cuda,gpu -arch=sm_70 -max_num_threads=1024 -thread_warp_size=32", "batch_matmul.cuda", [["TENSOR", [12, 64, 64], "float32"], ["TENSOR", [12, 64, 64], "float32"], [12, 64, 64], "float32", 0, 1], {}], "config": {"index": 33627, "code_hash": null, "entity": [["tile_y", "sp", [-1, 1, 64]], ["tile_x", "sp", [-1, 4, 16]], ["tile_k", "sp", [-1, 1]], ["auto_unroll_max_step", "ot", 32], ["unroll_explicit", "ot", 1]]}, "result": [[0.0009318950324825985], 0, 3.797736406326294, 1704884327.9482045], "version": 0.2, "tvm_version": "0.14.dev0"}
{"input": ["cuda -keys=cuda,gpu -arch=sm_70 -max_num_threads=1024 -thread_warp_size=32", "batch_matmul.cuda", [["TENSOR", [12, 64, 64], "float32"], ["TENSOR", [12, 64, 64], "float32"], [12, 64, 64], "float32", 0, 1], {}], "config": {"index": 39611, "code_hash": null, "entity": [["tile_y", "sp", [-1, 2, 8]], ["tile_x", "sp", [-1, 2, 4]], ["tile_k", "sp", [-1, 2]], ["auto_unroll_max_step", "ot", 64], ["unroll_explicit", "ot", 1]]}, "result": [[1.1975499379279354e-05], 0, 3.81754207611084, 1704884330.8581748], "version": 0.2, "tvm_version": "0.14.dev0"}
{"input": ["cuda -keys=cuda,gpu -arch=sm_70 -max_num_threads=1024 -thread_warp_size=32", "batch_matmul.cuda", [["TENSOR", [12, 64, 64], "float32"], ["TENSOR", [12, 64, 64], "float32"], [12, 64, 64], "float32", 0, 1], {}], "config": {"index": 35557, "code_hash": null, "entity": [["tile_y", "sp", [-1, 1, 32]], ["tile_x", "sp", [-1, 4, 2]], ["tile_k", "sp", [-1, 8]], ["auto_unroll_max_step", "ot", 32], ["unroll_explicit", "ot", 1]]}, "result": [[1.6244588701090608e-05], 0, 4.209751605987549, 1704884333.907038], "version": 0.2, "tvm_version": "0.14.dev0"}
{"input": ["cuda -keys=cuda,gpu -arch=sm_70 -max_num_threads=1024 -thread_warp_size=32", "batch_matmul.cuda", [["TENSOR", [12, 64, 64], "float32"], ["TENSOR", [12, 64, 64], "float32"], [12, 64, 64], "float32", 0, 1], {}], "config": {"index": 4768, "code_hash": null, "entity": [["tile_y", "sp", [-1, 2, 2]], ["tile_x", "sp", [-1, 4, 1]], ["tile_k", "sp", [-1, 64]], ["auto_unroll_max_step", "ot", 8], ["unroll_explicit", "ot", 0]]}, "result": [[1.4279562110229389e-05], 0, 3.803945541381836, 1704884336.8154752], "version": 0.2, "tvm_version": "0.14.dev0"}
{"input": ["cuda -keys=cuda,gpu -arch=sm_70 -max_num_threads=1024 -thread_warp_size=32", "batch_matmul.cuda", [["TENSOR", [12, 64, 64], "float32"], ["TENSOR", [12, 64, 64], "float32"], [12, 64, 64], "float32", 0, 1], {}], "config": {"index": 20634, "code_hash": null, "entity": [["tile_y", "sp", [-1, 2, 32]], ["tile_x", "sp", [-1, 2, 2]], ["tile_k", "sp", [-1, 32]], ["auto_unroll_max_step", "ot", 64], ["unroll_explicit", "ot", 0]]}, "result": [[2.1175291673913916e-05], 0, 3.72939133644104, 1704884339.7385724], "version": 0.2, "tvm_version": "0.14.dev0"}
{"input": ["cuda -keys=cuda,gpu -arch=sm_70 -max_num_threads=1024 -thread_warp_size=32", "batch_matmul.cuda", [["TENSOR", [12, 64, 64], "float32"], ["TENSOR", [12, 64, 64], "float32"], [12, 64, 64], "float32", 0, 1], {}], "config": {"index": 5301, "code_hash": null, "entity": [["tile_y", "sp", [-1, 4, 2]], ["tile_x", "sp", [-1, 8, 8]], ["tile_k", "sp", [-1, 64]], ["auto_unroll_max_step", "ot", 8], ["unroll_explicit", "ot", 0]]}, "result": [[1.23828683992611e-05], 0, 3.6488308906555176, 1704884342.6818306], "version": 0.2, "tvm_version": "0.14.dev0"}
{"input": ["cuda -keys=cuda,gpu -arch=sm_70 -max_num_threads=1024 -thread_warp_size=32", "batch_matmul.cuda", [["TENSOR", [12, 64, 64], "float32"], ["TENSOR", [12, 64, 64], "float32"], [12, 64, 64], "float32", 0, 1], {}], "config": {"index": 3415, "code_hash": null, "entity": [["tile_y", "sp", [-1, 1, 64]], ["tile_x", "sp", [-1, 4, 2]], ["tile_k", "sp", [-1, 16]], ["auto_unroll_max_step", "ot", 8], ["unroll_explicit", "ot", 0]]}, "result": [[4.434987264523407e-05], 0, 4.368855714797974, 1704884345.6001108], "version": 0.2, "tvm_version": "0.14.dev0"}
{"input": ["cuda -keys=cuda,gpu -arch=sm_70 -max_num_threads=1024 -thread_warp_size=32", "batch_matmul.cuda", [["TENSOR", [12, 64, 64], "float32"], ["TENSOR", [12, 64, 64], "float32"], [12, 64, 64], "float32", 0, 1], {}], "config": {"index": 7026, "code_hash": null, "entity": [["tile_y", "sp", [-1, 2, 32]], ["tile_x", "sp", [-1, 2, 32]], ["tile_k", "sp", [-1, 2]], ["auto_unroll_max_step", "ot", 16], ["unroll_explicit", "ot", 0]]}, "result": [[0.0008198446780786918], 0, 3.9526541233062744, 1704884348.575992], "version": 0.2, "tvm_version": "0.14.dev0"}
{"input": ["cuda -keys=cuda,gpu -arch=sm_70 -max_num_threads=1024 -thread_warp_size=32", "batch_matmul.cuda", [["TENSOR", [12, 64, 64], "float32"], ["TENSOR", [12, 64, 64], "float32"], [12, 64, 64], "float32", 0, 1], {}], "config": {"index": 43594, "code_hash": null, "entity": [["tile_y", "sp", [-1, 2, 32]], ["tile_x", "sp", [-1, 8, 4]], ["tile_k", "sp", [-1, 64]], ["auto_unroll_max_step", "ot", 64], ["unroll_explicit", "ot", 1]]}, "result": [[2.0878288005504976e-05], 0, 3.9999423027038574, 1704884351.6566498], "version": 0.2, "tvm_version": "0.14.dev0"}
{"input": ["cuda -keys=cuda,gpu -arch=sm_70 -max_num_threads=1024 -thread_warp_size=32", "batch_matmul.cuda", [["TENSOR", [12, 64, 64], "float32"], ["TENSOR", [12, 64, 64], "float32"], [12, 64, 64], "float32", 0, 1], {}], "config": {"index": 8641, "code_hash": null, "entity": [["tile_y", "sp", [-1, 16, 4]], ["tile_x", "sp", [-1, 1, 1]], ["tile_k", "sp", [-1, 16]], ["auto_unroll_max_step", "ot", 16], ["unroll_explicit", "ot", 0]]}, "result": [[4.4671263225125656e-05], 0, 3.689969301223755, 1704884354.6155832], "version": 0.2, "tvm_version": "0.14.dev0"}
{"input": ["cuda -keys=cuda,gpu -arch=sm_70 -max_num_threads=1024 -thread_warp_size=32", "batch_matmul.cuda", [["TENSOR", [12, 64, 64], "float32"], ["TENSOR", [12, 64, 64], "float32"], [12, 64, 64], "float32", 0, 1], {}], "config": {"index": 1660, "code_hash": null, "entity": [["tile_y", "sp", [-1, 2, 2]], ["tile_x", "sp", [-1, 8, 1]], ["tile_k", "sp", [-1, 4]], ["auto_unroll_max_step", "ot", 8], ["unroll_explicit", "ot", 0]]}, "result": [[9.378475854081522e-06], 0, 3.6385443210601807, 1704884357.4815705], "version": 0.2, "tvm_version": "0.14.dev0"}
{"input": ["cuda -keys=cuda,gpu -arch=sm_70 -max_num_threads=1024 -thread_warp_size=32", "batch_matmul.cuda", [["TENSOR", [12, 64, 64], "float32"], ["TENSOR", [12, 64, 64], "float32"], [12, 64, 64], "float32", 0, 1], {}], "config": {"index": 25682, "code_hash": null, "entity": [["tile_y", "sp", [-1, 64, 1]], ["tile_x", "sp", [-1, 8, 8]], ["tile_k", "sp", [-1, 16]], ["auto_unroll_max_step", "ot", 8], ["unroll_explicit", "ot", 1]]}, "result": [[4.944825166893312e-05], 0, 4.011042833328247, 1704884360.6347106], "version": 0.2, "tvm_version": "0.14.dev0"}
{"input": ["cuda -keys=cuda,gpu -arch=sm_70 -max_num_threads=1024 -thread_warp_size=32", "batch_matmul.cuda", [["TENSOR", [12, 64, 64], "float32"], ["TENSOR", [12, 64, 64], "float32"], [12, 64, 64], "float32", 0, 1], {}], "config": {"index": 9728, "code_hash": null, "entity": [["tile_y", "sp", [-1, 32, 2]], ["tile_x", "sp", [-1, 16, 2]], ["tile_k", "sp", [-1, 32]], ["auto_unroll_max_step", "ot", 16], ["unroll_explicit", "ot", 0]]}, "result": [[1.4033836991246276e-05], 0, 3.649043083190918, 1704884363.5041022], "version": 0.2, "tvm_version": "0.14.dev0"}
{"input": ["cuda -keys=cuda,gpu -arch=sm_70 -max_num_threads=1024 -thread_warp_size=32", "batch_matmul.cuda", [["TENSOR", [12, 64, 64], "float32"], ["TENSOR", [12, 64, 64], "float32"], [12, 64, 64], "float32", 0, 1], {}], "config": {"index": 7075, "code_hash": null, "entity": [["tile_y", "sp", [-1, 2, 8]], ["tile_x", "sp", [-1, 1, 1]], ["tile_k", "sp", [-1, 4]], ["auto_unroll_max_step", "ot", 16], ["unroll_explicit", "ot", 0]]}, "result": [[5.105436726996101e-05], 0, 3.7256364822387695, 1704884366.4625347], "version": 0.2, "tvm_version": "0.14.dev0"}
{"input": ["cuda -keys=cuda,gpu -arch=sm_70 -max_num_threads=1024 -thread_warp_size=32", "batch_matmul.cuda", [["TENSOR", [12, 64, 64], "float32"], ["TENSOR", [12, 64, 64], "float32"], [12, 64, 64], "float32", 0, 1], {}], "config": {"index": 32698, "code_hash": null, "entity": [["tile_y", "sp", [-1, 1, 16]], ["tile_x", "sp", [-1, 2, 8]], ["tile_k", "sp", [-1, 64]], ["auto_unroll_max_step", "ot", 16], ["unroll_explicit", "ot", 1]]}, "result": [[2.6603653491877405e-05], 0, 4.010486841201782, 1704884369.56847], "version": 0.2, "tvm_version": "0.14.dev0"}
{"input": ["cuda -keys=cuda,gpu -arch=sm_70 -max_num_threads=1024 -thread_warp_size=32", "batch_matmul.cuda", [["TENSOR", [12, 64, 64], "float32"], ["TENSOR", [12, 64, 64], "float32"], [12, 64, 64], "float32", 0, 1], {}], "config": {"index": 2520, "code_hash": null, "entity": [["tile_y", "sp", [-1, 1, 1]], ["tile_x", "sp", [-1, 64, 1]], ["tile_k", "sp", [-1, 8]], ["auto_unroll_max_step", "ot", 8], ["unroll_explicit", "ot", 0]]}, "result": [[2.3346326994583517e-05], 0, 3.442033290863037, 1704884372.5094328], "version": 0.2, "tvm_version": "0.14.dev0"}
{"input": ["cuda -keys=cuda,gpu -arch=sm_70 -max_num_threads=1024 -thread_warp_size=32", "batch_matmul.cuda", [["TENSOR", [12, 64, 64], "float32"], ["TENSOR", [12, 64, 64], "float32"], [12, 64, 64], "float32", 0, 1], {}], "config": {"index": 39064, "code_hash": null, "entity": [["tile_y", "sp", [-1, 16, 1]], ["tile_x", "sp", [-1, 2, 16]], ["tile_k", "sp", [-1, 1]], ["auto_unroll_max_step", "ot", 64], ["unroll_explicit", "ot", 1]]}, "result": [[1.0409499702131117e-05], 0, 3.6919336318969727, 1704884375.3560576], "version": 0.2, "tvm_version": "0.14.dev0"}
{"input": ["cuda -keys=cuda,gpu -arch=sm_70 -max_num_threads=1024 -thread_warp_size=32", "batch_matmul.cuda", [["TENSOR", [12, 64, 64], "float32"], ["TENSOR", [12, 64, 64], "float32"], [12, 64, 64], "float32", 0, 1], {}], "config": {"index": 7668, "code_hash": null, "entity": [["tile_y", "sp", [-1, 4, 16]], ["tile_x", "sp", [-1, 8, 8]], ["tile_k", "sp", [-1, 4]], ["auto_unroll_max_step", "ot", 16], ["unroll_explicit", "ot", 0]]}, "result": [[3.067122121952628e-05], 0, 3.8174397945404053, 1704884378.3430927], "version": 0.2, "tvm_version": "0.14.dev0"}
{"input": ["cuda -keys=cuda,gpu -arch=sm_70 -max_num_threads=1024 -thread_warp_size=32", "batch_matmul.cuda", [["TENSOR", [12, 64, 64], "float32"], ["TENSOR", [12, 64, 64], "float32"], [12, 64, 64], "float32", 0, 1], {}], "config": {"index": 4663, "code_hash": null, "entity": [["tile_y", "sp", [-1, 4, 4]], ["tile_x", "sp", [-1, 2, 32]], ["tile_k", "sp", [-1, 32]], ["auto_unroll_max_step", "ot", 8], ["unroll_explicit", "ot", 0]]}, "result": [[2.68804660677123e-05], 0, 3.8365325927734375, 1704884381.275612], "version": 0.2, "tvm_version": "0.14.dev0"}
{"input": ["cuda -keys=cuda,gpu -arch=sm_70 -max_num_threads=1024 -thread_warp_size=32", "batch_matmul.cuda", [["TENSOR", [12, 64, 64], "float32"], ["TENSOR", [12, 64, 64], "float32"], [12, 64, 64], "float32", 0, 1], {}], "config": {"index": 39432, "code_hash": null, "entity": [["tile_y", "sp", [-1, 2, 2]], ["tile_x", "sp", [-1, 2, 2]], ["tile_k", "sp", [-1, 2]], ["auto_unroll_max_step", "ot", 64], ["unroll_explicit", "ot", 1]]}, "result": [[2.3603904369949118e-05], 0, 3.631532669067383, 1704884384.1880023], "version": 0.2, "tvm_version": "0.14.dev0"}
{"input": ["cuda -keys=cuda,gpu -arch=sm_70 -max_num_threads=1024 -thread_warp_size=32", "batch_matmul.cuda", [["TENSOR", [12, 64, 64], "float32"], ["TENSOR", [12, 64, 64], "float32"], [12, 64, 64], "float32", 0, 1], {}], "config": {"index": 31693, "code_hash": null, "entity": [["tile_y", "sp", [-1, 1, 32]], ["tile_x", "sp", [-1, 16, 2]], ["tile_k", "sp", [-1, 32]], ["auto_unroll_max_step", "ot", 16], ["unroll_explicit", "ot", 1]]}, "result": [[1.4278988634709181e-05], 0, 4.3112757205963135, 1704884387.1345968], "version": 0.2, "tvm_version": "0.14.dev0"}
{"input": ["cuda -keys=cuda,gpu -arch=sm_70 -max_num_threads=1024 -thread_warp_size=32", "batch_matmul.cuda", [["TENSOR", [12, 64, 64], "float32"], ["TENSOR", [12, 64, 64], "float32"], [12, 64, 64], "float32", 0, 1], {}], "config": {"index": 6353, "code_hash": null, "entity": [["tile_y", "sp", [-1, 1, 32]], ["tile_x", "sp", [-1, 4, 1]], ["tile_k", "sp", [-1, 2]], ["auto_unroll_max_step", "ot", 16], ["unroll_explicit", "ot", 0]]}, "result": [[2.3165276568946797e-05], 0, 3.617741584777832, 1704884390.0804915], "version": 0.2, "tvm_version": "0.14.dev0"}
{"input": ["cuda -keys=cuda,gpu -arch=sm_70 -max_num_threads=1024 -thread_warp_size=32", "batch_matmul.cuda", [["TENSOR", [12, 64, 64], "float32"], ["TENSOR", [12, 64, 64], "float32"], [12, 64, 64], "float32", 0, 1], {}], "config": {"index": 35621, "code_hash": null, "entity": [["tile_y", "sp", [-1, 32, 1]], ["tile_x", "sp", [-1, 32, 2]], ["tile_k", "sp", [-1, 8]], ["auto_unroll_max_step", "ot", 32], ["unroll_explicit", "ot", 1]]}, "result": [[1.6268093106739706e-05], 0, 3.754817485809326, 1704884392.9760308], "version": 0.2, "tvm_version": "0.14.dev0"}
{"input": ["cuda -keys=cuda,gpu -arch=sm_70 -max_num_threads=1024 -thread_warp_size=32", "batch_matmul.cuda", [["TENSOR", [12, 64, 64], "float32"], ["TENSOR", [12, 64, 64], "float32"], [12, 64, 64], "float32", 0, 1], {}], "config": {"index": 33209, "code_hash": null, "entity": [["tile_y", "sp", [-1, 2, 1]], ["tile_x", "sp", [-1, 8, 2]], ["tile_k", "sp", [-1, 1]], ["auto_unroll_max_step", "ot", 32], ["unroll_explicit", "ot", 1]]}, "result": [[3.614575859106529e-05], 0, 3.4596188068389893, 1704884395.9651024], "version": 0.2, "tvm_version": "0.14.dev0"}
{"input": ["cuda -keys=cuda,gpu -arch=sm_70 -max_num_threads=1024 -thread_warp_size=32", "batch_matmul.cuda", [["TENSOR", [12, 64, 64], "float32"], ["TENSOR", [12, 64, 64], "float32"], [12, 64, 64], "float32", 0, 1], {}], "config": {"index": 41815, "code_hash": null, "entity": [["tile_y", "sp", [-1, 16, 2]], ["tile_x", "sp", [-1, 4, 2]], ["tile_k", "sp", [-1, 16]], ["auto_unroll_max_step", "ot", 64], ["unroll_explicit", "ot", 1]]}, "result": [[6.850719118828958e-06], 0, 3.6481680870056152, 1704884398.779353], "version": 0.2, "tvm_version": "0.14.dev0"}
{"input": ["cuda -keys=cuda,gpu -arch=sm_70 -max_num_threads=1024 -thread_warp_size=32", "batch_matmul.cuda", [["TENSOR", [12, 64, 64], "float32"], ["TENSOR", [12, 64, 64], "float32"], [12, 64, 64], "float32", 0, 1], {}], "config": {"index": 27856, "code_hash": null, "entity": [["tile_y", "sp", [-1, 4, 16]], ["tile_x", "sp", [-1, 2, 4]], ["tile_k", "sp", [-1, 1]], ["auto_unroll_max_step", "ot", 16], ["unroll_explicit", "ot", 1]]}, "result": [[2.3441692241875284e-05], 0, 3.4996538162231445, 1704884401.7104988], "version": 0.2, "tvm_version": "0.14.dev0"}
{"input": ["cuda -keys=cuda,gpu -arch=sm_70 -max_num_threads=1024 -thread_warp_size=32", "batch_matmul.cuda", [["TENSOR", [12, 64, 64], "float32"], ["TENSOR", [12, 64, 64], "float32"], [12, 64, 64], "float32", 0, 1], {}], "config": {"index": 28352, "code_hash": null, "entity": [["tile_y", "sp", [-1, 8, 4]], ["tile_x", "sp", [-1, 16, 1]], ["tile_k", "sp", [-1, 2]], ["auto_unroll_max_step", "ot", 16], ["unroll_explicit", "ot", 1]]}, "result": [[7.47001627543499e-06], 0, 3.4440367221832275, 1704884404.5675042], "version": 0.2, "tvm_version": "0.14.dev0"}
{"input": ["cuda -keys=cuda,gpu -arch=sm_70 -max_num_threads=1024 -thread_warp_size=32", "batch_matmul.cuda", [["TENSOR", [12, 64, 64], "float32"], ["TENSOR", [12, 64, 64], "float32"], [12, 64, 64], "float32", 0, 1], {}], "config": {"index": 36797, "code_hash": null, "entity": [["tile_y", "sp", [-1, 32, 1]], ["tile_x", "sp", [-1, 2, 32]], ["tile_k", "sp", [-1, 16]], ["auto_unroll_max_step", "ot", 32], ["unroll_explicit", "ot", 1]]}, "result": [[1.1508844622337754e-05], 0, 4.0677149295806885, 1704884407.6091328], "version": 0.2, "tvm_version": "0.14.dev0"}
{"input": ["cuda -keys=cuda,gpu -arch=sm_70 -max_num_threads=1024 -thread_warp_size=32", "batch_matmul.cuda", [["TENSOR", [12, 64, 64], "float32"], ["TENSOR", [12, 64, 64], "float32"], [12, 64, 64], "float32", 0, 1], {}], "config": {"index": 24667, "code_hash": null, "entity": [["tile_y", "sp", [-1, 1, 64]], ["tile_x", "sp", [-1, 32, 2]], ["tile_k", "sp", [-1, 8]], ["auto_unroll_max_step", "ot", 8], ["unroll_explicit", "ot", 1]]}, "result": [[3.8762335299114184e-05], 0, 4.064586162567139, 1704884410.554695], "version": 0.2, "tvm_version": "0.14.dev0"}
{"input": ["cuda -keys=cuda,gpu -arch=sm_70 -max_num_threads=1024 -thread_warp_size=32", "batch_matmul.cuda", [["TENSOR", [12, 64, 64], "float32"], ["TENSOR", [12, 64, 64], "float32"], [12, 64, 64], "float32", 0, 1], {}], "config": {"index": 1643, "code_hash": null, "entity": [["tile_y", "sp", [-1, 2, 8]], ["tile_x", "sp", [-1, 4, 1]], ["tile_k", "sp", [-1, 4]], ["auto_unroll_max_step", "ot", 8], ["unroll_explicit", "ot", 0]]}, "result": [[9.604172095174984e-06], 0, 3.5889904499053955, 1704884413.4392624], "version": 0.2, "tvm_version": "0.14.dev0"}
{"input": ["cuda -keys=cuda,gpu -arch=sm_70 -max_num_threads=1024 -thread_warp_size=32", "batch_matmul.cuda", [["TENSOR", [12, 64, 64], "float32"], ["TENSOR", [12, 64, 64], "float32"], [12, 64, 64], "float32", 0, 1], {}], "config": {"index": 27316, "code_hash": null, "entity": [["tile_y", "sp", [-1, 8, 4]], ["tile_x", "sp", [-1, 2, 16]], ["tile_k", "sp", [-1, 64]], ["auto_unroll_max_step", "ot", 8], ["unroll_explicit", "ot", 1]]}, "result": [[1.7633769496605638e-05], 0, 3.8179683685302734, 1704884416.349421], "version": 0.2, "tvm_version": "0.14.dev0"}
{"input": ["cuda -keys=cuda,gpu -arch=sm_70 -max_num_threads=1024 -thread_warp_size=32", "batch_matmul.cuda", [["TENSOR", [12, 64, 64], "float32"], ["TENSOR", [12, 64, 64], "float32"], [12, 64, 64], "float32", 0, 1], {}], "config": {"index": 24828, "code_hash": null, "entity": [["tile_y", "sp", [-1, 4, 8]], ["tile_x", "sp", [-1, 1, 8]], ["tile_k", "sp", [-1, 8]], ["auto_unroll_max_step", "ot", 8], ["unroll_explicit", "ot", 1]]}, "result": [[1.6853515627179384e-05], 0, 3.8774538040161133, 1704884419.2582295], "version": 0.2, "tvm_version": "0.14.dev0"}
{"input": ["cuda -keys=cuda,gpu -arch=sm_70 -max_num_threads=1024 -thread_warp_size=32", "batch_matmul.cuda", [["TENSOR", [12, 64, 64], "float32"], ["TENSOR", [12, 64, 64], "float32"], [12, 64, 64], "float32", 0, 1], {}], "config": {"index": 26594, "code_hash": null, "entity": [["tile_y", "sp", [-1, 1, 16]], ["tile_x", "sp", [-1, 1, 32]], ["tile_k", "sp", [-1, 32]], ["auto_unroll_max_step", "ot", 8], ["unroll_explicit", "ot", 1]]}, "result": [[0.0015083163470757431], 0, 4.337127685546875, 1704884422.2289274], "version": 0.2, "tvm_version": "0.14.dev0"}
{"input": ["cuda -keys=cuda,gpu -arch=sm_70 -max_num_threads=1024 -thread_warp_size=32", "batch_matmul.cuda", [["TENSOR", [12, 64, 64], "float32"], ["TENSOR", [12, 64, 64], "float32"], [12, 64, 64], "float32", 0, 1], {}], "config": {"index": 21847, "code_hash": null, "entity": [["tile_y", "sp", [-1, 1, 2]], ["tile_x", "sp", [-1, 4, 16]], ["tile_k", "sp", [-1, 64]], ["auto_unroll_max_step", "ot", 64], ["unroll_explicit", "ot", 0]]}, "result": [[1.884516946517413e-05], 0, 3.7740767002105713, 1704884425.140882], "version": 0.2, "tvm_version": "0.14.dev0"}
{"input": ["cuda -keys=cuda,gpu -arch=sm_70 -max_num_threads=1024 -thread_warp_size=32", "batch_matmul.cuda", [["TENSOR", [12, 64, 64], "float32"], ["TENSOR", [12, 64, 64], "float32"], [12, 64, 64], "float32", 0, 1], {}], "config": {"index": 14249, "code_hash": null, "entity": [["tile_y", "sp", [-1, 1, 32]], ["tile_x", "sp", [-1, 16, 1]], ["tile_k", "sp", [-1, 16]], ["auto_unroll_max_step", "ot", 32], ["unroll_explicit", "ot", 0]]}, "result": [[9.881062206692513e-06], 0, 3.927011013031006, 1704884428.0080786], "version": 0.2, "tvm_version": "0.14.dev0"}
{"input": ["cuda -keys=cuda,gpu -arch=sm_70 -max_num_threads=1024 -thread_warp_size=32", "batch_matmul.cuda", [["TENSOR", [12, 64, 64], "float32"], ["TENSOR", [12, 64, 64], "float32"], [12, 64, 64], "float32", 0, 1], {}], "config": {"index": 4105, "code_hash": null, "entity": [["tile_y", "sp", [-1, 16, 4]], ["tile_x", "sp", [-1, 64, 1]], ["tile_k", "sp", [-1, 32]], ["auto_unroll_max_step", "ot", 8], ["unroll_explicit", "ot", 0]]}, "result": [[1.653641323036726e-05], 0, 3.7891626358032227, 1704884430.9549735], "version": 0.2, "tvm_version": "0.14.dev0"}
{"input": ["cuda -keys=cuda,gpu -arch=sm_70 -max_num_threads=1024 -thread_warp_size=32", "batch_matmul.cuda", [["TENSOR", [12, 64, 64], "float32"], ["TENSOR", [12, 64, 64], "float32"], [12, 64, 64], "float32", 0, 1], {}], "config": {"index": 6708, "code_hash": null, "entity": [["tile_y", "sp", [-1, 8, 4]], ["tile_x", "sp", [-1, 4, 4]], ["tile_k", "sp", [-1, 2]], ["auto_unroll_max_step", "ot", 16], ["unroll_explicit", "ot", 0]]}, "result": [[8.323245830823417e-06], 0, 3.62438702583313, 1704884433.7943726], "version": 0.2, "tvm_version": "0.14.dev0"}
{"input": ["cuda -keys=cuda,gpu -arch=sm_70 -max_num_threads=1024 -thread_warp_size=32", "batch_matmul.cuda", [["TENSOR", [12, 64, 64], "float32"], ["TENSOR", [12, 64, 64], "float32"], [12, 64, 64], "float32", 0, 1], {}], "config": {"index": 37019, "code_hash": null, "entity": [["tile_y", "sp", [-1, 8, 1]], ["tile_x", "sp", [-1, 64, 1]], ["tile_k", "sp", [-1, 32]], ["auto_unroll_max_step", "ot", 32], ["unroll_explicit", "ot", 1]]}, "result": [[1.4352839321804497e-05], 0, 3.620709180831909, 1704884436.7582808], "version": 0.2, "tvm_version": "0.14.dev0"}
{"input": ["cuda -keys=cuda,gpu -arch=sm_70 -max_num_threads=1024 -thread_warp_size=32", "batch_matmul.cuda", [["TENSOR", [12, 64, 64], "float32"], ["TENSOR", [12, 64, 64], "float32"], [12, 64, 64], "float32", 0, 1], {}], "config": {"index": 39162, "code_hash": null, "entity": [["tile_y", "sp", [-1, 1, 8]], ["tile_x", "sp", [-1, 2, 32]], ["tile_k", "sp", [-1, 1]], ["auto_unroll_max_step", "ot", 64], ["unroll_explicit", "ot", 1]]}, "result": [[9.401700338725691e-05], 0, 4.238786220550537, 1704884439.7654662], "version": 0.2, "tvm_version": "0.14.dev0"}
{"input": ["cuda -keys=cuda,gpu -arch=sm_70 -max_num_threads=1024 -thread_warp_size=32", "batch_matmul.cuda", [["TENSOR", [12, 64, 64], "float32"], ["TENSOR", [12, 64, 64], "float32"], [12, 64, 64], "float32", 0, 1], {}], "config": {"index": 33138, "code_hash": null, "entity": [["tile_y", "sp", [-1, 2, 4]], ["tile_x", "sp", [-1, 1, 2]], ["tile_k", "sp", [-1, 1]], ["auto_unroll_max_step", "ot", 32], ["unroll_explicit", "ot", 1]]}, "result": [[4.7042533011366985e-05], 0, 3.708144187927246, 1704884442.7092779], "version": 0.2, "tvm_version": "0.14.dev0"}
{"input": ["cuda -keys=cuda,gpu -arch=sm_70 -max_num_threads=1024 -thread_warp_size=32", "batch_matmul.cuda", [["TENSOR", [12, 64, 64], "float32"], ["TENSOR", [12, 64, 64], "float32"], [12, 64, 64], "float32", 0, 1], {}], "config": {"index": 55, "code_hash": null, "entity": [["tile_y", "sp", [-1, 1, 64]], ["tile_x", "sp", [-1, 2, 1]], ["tile_k", "sp", [-1, 1]], ["auto_unroll_max_step", "ot", 8], ["unroll_explicit", "ot", 0]]}, "result": [[6.448450911081064e-05], 0, 2.2664685249328613, 1704884444.196381], "version": 0.2, "tvm_version": "0.14.dev0"}
{"input": ["cuda -keys=cuda,gpu -arch=sm_70 -max_num_threads=1024 -thread_warp_size=32", "batch_matmul.cuda", [["TENSOR", [12, 64, 64], "float32"], ["TENSOR", [12, 64, 64], "float32"], [12, 64, 64], "float32", 0, 1], {}], "config": {"index": 32332, "code_hash": null, "entity": [["tile_y", "sp", [-1, 4, 8]], ["tile_x", "sp", [-1, 64, 1]], ["tile_k", "sp", [-1, 64]], ["auto_unroll_max_step", "ot", 16], ["unroll_explicit", "ot", 1]]}, "result": [[6.9784658126324865e-06], 0, 3.5675506591796875, 1704884447.0531714], "version": 0.2, "tvm_version": "0.14.dev0"}
{"input": ["cuda -keys=cuda,gpu -arch=sm_70 -max_num_threads=1024 -thread_warp_size=32", "batch_matmul.cuda", [["TENSOR", [12, 64, 64], "float32"], ["TENSOR", [12, 64, 64], "float32"], [12, 64, 64], "float32", 0, 1], {}], "config": {"index": 11602, "code_hash": null, "entity": [["tile_y", "sp", [-1, 8, 2]], ["tile_x", "sp", [-1, 1, 16]], ["tile_k", "sp", [-1, 1]], ["auto_unroll_max_step", "ot", 32], ["unroll_explicit", "ot", 0]]}, "result": [[1.2668524911452184e-05], 0, 3.7073071002960205, 1704884449.93347], "version": 0.2, "tvm_version": "0.14.dev0"}
{"input": ["cuda -keys=cuda,gpu -arch=sm_70 -max_num_threads=1024 -thread_warp_size=32", "batch_matmul.cuda", [["TENSOR", [12, 64, 64], "float32"], ["TENSOR", [12, 64, 64], "float32"], [12, 64, 64], "float32", 0, 1], {}], "config": {"index": 19230, "code_hash": null, "entity": [["tile_y", "sp", [-1, 1, 16]], ["tile_x", "sp", [-1, 2, 4]], ["tile_k", "sp", [-1, 8]], ["auto_unroll_max_step", "ot", 64], ["unroll_explicit", "ot", 0]]}, "result": [[1.714103316243754e-05], 0, 3.7491812705993652, 1704884452.8624434], "version": 0.2, "tvm_version": "0.14.dev0"}
{"input": ["cuda -keys=cuda,gpu -arch=sm_70 -max_num_threads=1024 -thread_warp_size=32", "batch_matmul.cuda", [["TENSOR", [12, 64, 64], "float32"], ["TENSOR", [12, 64, 64], "float32"], [12, 64, 64], "float32", 0, 1], {}], "config": {"index": 15653, "code_hash": null, "entity": [["tile_y", "sp", [-1, 2, 1]], ["tile_x", "sp", [-1, 1, 64]], ["tile_k", "sp", [-1, 32]], ["auto_unroll_max_step", "ot", 32], ["unroll_explicit", "ot", 0]]}, "result": [[4.274986149943184e-05], 0, 4.273479461669922, 1704884455.8827083], "version": 0.2, "tvm_version": "0.14.dev0"}
{"input": ["cuda -keys=cuda,gpu -arch=sm_70 -max_num_threads=1024 -thread_warp_size=32", "batch_matmul.cuda", [["TENSOR", [12, 64, 64], "float32"], ["TENSOR", [12, 64, 64], "float32"], [12, 64, 64], "float32", 0, 1], {}], "config": {"index": 1833, "code_hash": null, "entity": [["tile_y", "sp", [-1, 1, 4]], ["tile_x", "sp", [-1, 4, 2]], ["tile_k", "sp", [-1, 4]], ["auto_unroll_max_step", "ot", 8], ["unroll_explicit", "ot", 0]]}, "result": [[1.1989774815466815e-05], 0, 3.6661484241485596, 1704884458.7559462], "version": 0.2, "tvm_version": "0.14.dev0"}
{"input": ["cuda -keys=cuda,gpu -arch=sm_70 -max_num_threads=1024 -thread_warp_size=32", "batch_matmul.cuda", [["TENSOR", [12, 64, 64], "float32"], ["TENSOR", [12, 64, 64], "float32"], [12, 64, 64], "float32", 0, 1], {}], "config": {"index": 30331, "code_hash": null, "entity": [["tile_y", "sp", [-1, 1, 2]], ["tile_x", "sp", [-1, 2, 8]], ["tile_k", "sp", [-1, 8]], ["auto_unroll_max_step", "ot", 16], ["unroll_explicit", "ot", 1]]}, "result": [[2.2445502317497103e-05], 0, 3.621774435043335, 1704884461.6829007], "version": 0.2, "tvm_version": "0.14.dev0"}
{"input": ["cuda -keys=cuda,gpu -arch=sm_70 -max_num_threads=1024 -thread_warp_size=32", "batch_matmul.cuda", [["TENSOR", [12, 64, 64], "float32"], ["TENSOR", [12, 64, 64], "float32"], [12, 64, 64], "float32", 0, 1], {}], "config": {"index": 36517, "code_hash": null, "entity": [["tile_y", "sp", [-1, 32, 1]], ["tile_x", "sp", [-1, 8, 4]], ["tile_k", "sp", [-1, 16]], ["auto_unroll_max_step", "ot", 32], ["unroll_explicit", "ot", 1]]}, "result": [[1.4094976574968217e-05], 0, 3.7426700592041016, 1704884464.6283975], "version": 0.2, "tvm_version": "0.14.dev0"}
{"input": ["cuda -keys=cuda,gpu -arch=sm_70 -max_num_threads=1024 -thread_warp_size=32", "batch_matmul.cuda", [["TENSOR", [12, 64, 64], "float32"], ["TENSOR", [12, 64, 64], "float32"], [12, 64, 64], "float32", 0, 1], {}], "config": {"index": 19160, "code_hash": null, "entity": [["tile_y", "sp", [-1, 2, 2]], ["tile_x", "sp", [-1, 32, 2]], ["tile_k", "sp", [-1, 8]], ["auto_unroll_max_step", "ot", 64], ["unroll_explicit", "ot", 0]]}, "result": [[8.685933864755219e-06], 0, 3.7005765438079834, 1704884467.4556167], "version": 0.2, "tvm_version": "0.14.dev0"}
{"input": ["cuda -keys=cuda,gpu -arch=sm_70 -max_num_threads=1024 -thread_warp_size=32", "batch_matmul.cuda", [["TENSOR", [12, 64, 64], "float32"], ["TENSOR", [12, 64, 64], "float32"], [12, 64, 64], "float32", 0, 1], {}], "config": {"index": 16949, "code_hash": null, "entity": [["tile_y", "sp", [-1, 4, 2]], ["tile_x", "sp", [-1, 16, 4]], ["tile_k", "sp", [-1, 1]], ["auto_unroll_max_step", "ot", 64], ["unroll_explicit", "ot", 0]]}, "result": [[2.2502631728005006e-05], 0, 3.782064914703369, 1704884470.4768763], "version": 0.2, "tvm_version": "0.14.dev0"}
{"input": ["cuda -keys=cuda,gpu -arch=sm_70 -max_num_threads=1024 -thread_warp_size=32", "batch_matmul.cuda", [["TENSOR", [12, 64, 64], "float32"], ["TENSOR", [12, 64, 64], "float32"], [12, 64, 64], "float32", 0, 1], {}], "config": {"index": 21026, "code_hash": null, "entity": [["tile_y", "sp", [-1, 2, 32]], ["tile_x", "sp", [-1, 1, 16]], ["tile_k", "sp", [-1, 32]], ["auto_unroll_max_step", "ot", 64], ["unroll_explicit", "ot", 0]]}, "result": [[0.00046579481226993865], 0, 3.72880482673645, 1704884473.3544998], "version": 0.2, "tvm_version": "0.14.dev0"}
{"input": ["cuda -keys=cuda,gpu -arch=sm_70 -max_num_threads=1024 -thread_warp_size=32", "batch_matmul.cuda", [["TENSOR", [12, 64, 64], "float32"], ["TENSOR", [12, 64, 64], "float32"], [12, 64, 64], "float32", 0, 1], {}], "config": {"index": 18154, "code_hash": null, "entity": [["tile_y", "sp", [-1, 8, 2]], ["tile_x", "sp", [-1, 16, 1]], ["tile_k", "sp", [-1, 4]], ["auto_unroll_max_step", "ot", 64], ["unroll_explicit", "ot", 0]]}, "result": [[5.3364887952315515e-06], 0, 3.0462069511413574, 1704884538.6586368], "version": 0.2, "tvm_version": "0.14.dev0"}
{"input": ["cuda -keys=cuda,gpu -arch=sm_70 -max_num_threads=1024 -thread_warp_size=32", "batch_matmul.cuda", [["TENSOR", [12, 64, 64], "float32"], ["TENSOR", [12, 64, 64], "float32"], [12, 64, 64], "float32", 0, 1], {}], "config": {"index": 40107, "code_hash": null, "entity": [["tile_y", "sp", [-1, 16, 2]], ["tile_x", "sp", [-1, 16, 1]], ["tile_k", "sp", [-1, 4]], ["auto_unroll_max_step", "ot", 64], ["unroll_explicit", "ot", 1]]}, "result": [[5.8139792922777705e-06], 0, 3.3062095642089844, 1704884541.4464564], "version": 0.2, "tvm_version": "0.14.dev0"}
{"input": ["cuda -keys=cuda,gpu -arch=sm_70 -max_num_threads=1024 -thread_warp_size=32", "batch_matmul.cuda", [["TENSOR", [12, 64, 64], "float32"], ["TENSOR", [12, 64, 64], "float32"], [12, 64, 64], "float32", 0, 1], {}], "config": {"index": 40890, "code_hash": null, "entity": [["tile_y", "sp", [-1, 8, 2]], ["tile_x", "sp", [-1, 16, 1]], ["tile_k", "sp", [-1, 8]], ["auto_unroll_max_step", "ot", 64], ["unroll_explicit", "ot", 1]]}, "result": [[4.883127547549817e-06], 0, 3.324695348739624, 1704884544.2648568], "version": 0.2, "tvm_version": "0.14.dev0"}
{"input": ["cuda -keys=cuda,gpu -arch=sm_70 -max_num_threads=1024 -thread_warp_size=32", "batch_matmul.cuda", [["TENSOR", [12, 64, 64], "float32"], ["TENSOR", [12, 64, 64], "float32"], [12, 64, 64], "float32", 0, 1], {}], "config": {"index": 34618, "code_hash": null, "entity": [["tile_y", "sp", [-1, 8, 2]], ["tile_x", "sp", [-1, 16, 1]], ["tile_k", "sp", [-1, 4]], ["auto_unroll_max_step", "ot", 32], ["unroll_explicit", "ot", 1]]}, "result": [[5.3203873143431155e-06], 0, 3.1889150142669678, 1704884547.0378654], "version": 0.2, "tvm_version": "0.14.dev0"}
{"input": ["cuda -keys=cuda,gpu -arch=sm_70 -max_num_threads=1024 -thread_warp_size=32", "batch_matmul.cuda", [["TENSOR", [12, 64, 64], "float32"], ["TENSOR", [12, 64, 64], "float32"], [12, 64, 64], "float32", 0, 1], {}], "config": {"index": 40896, "code_hash": null, "entity": [["tile_y", "sp", [-1, 8, 4]], ["tile_x", "sp", [-1, 16, 1]], ["tile_k", "sp", [-1, 8]], ["auto_unroll_max_step", "ot", 64], ["unroll_explicit", "ot", 1]]}, "result": [[5.482227743332641e-06], 0, 3.33697509765625, 1704884549.8862863], "version": 0.2, "tvm_version": "0.14.dev0"}
{"input": ["cuda -keys=cuda,gpu -arch=sm_70 -max_num_threads=1024 -thread_warp_size=32", "batch_matmul.cuda", [["TENSOR", [12, 64, 64], "float32"], ["TENSOR", [12, 64, 64], "float32"], [12, 64, 64], "float32", 0, 1], {}], "config": {"index": 18155, "code_hash": null, "entity": [["tile_y", "sp", [-1, 16, 2]], ["tile_x", "sp", [-1, 16, 1]], ["tile_k", "sp", [-1, 4]], ["auto_unroll_max_step", "ot", 64], ["unroll_explicit", "ot", 0]]}, "result": [[5.650301515700368e-06], 0, 3.2940926551818848, 1704884552.6904595], "version": 0.2, "tvm_version": "0.14.dev0"}
{"input": ["cuda -keys=cuda,gpu -arch=sm_70 -max_num_threads=1024 -thread_warp_size=32", "batch_matmul.cuda", [["TENSOR", [12, 64, 64], "float32"], ["TENSOR", [12, 64, 64], "float32"], [12, 64, 64], "float32", 0, 1], {}], "config": {"index": 40112, "code_hash": null, "entity": [["tile_y", "sp", [-1, 8, 4]], ["tile_x", "sp", [-1, 16, 1]], ["tile_k", "sp", [-1, 4]], ["auto_unroll_max_step", "ot", 64], ["unroll_explicit", "ot", 1]]}, "result": [[6.127518627785027e-06], 0, 3.3763294219970703, 1704884555.5509815], "version": 0.2, "tvm_version": "0.14.dev0"}
{"input": ["cuda -keys=cuda,gpu -arch=sm_70 -max_num_threads=1024 -thread_warp_size=32", "batch_matmul.cuda", [["TENSOR", [12, 64, 64], "float32"], ["TENSOR", [12, 64, 64], "float32"], [12, 64, 64], "float32", 0, 1], {}], "config": {"index": 18938, "code_hash": null, "entity": [["tile_y", "sp", [-1, 8, 2]], ["tile_x", "sp", [-1, 16, 1]], ["tile_k", "sp", [-1, 8]], ["auto_unroll_max_step", "ot", 64], ["unroll_explicit", "ot", 0]]}, "result": [[4.9157218160529876e-06], 0, 3.404665946960449, 1704884558.3340971], "version": 0.2, "tvm_version": "0.14.dev0"}
{"input": ["cuda -keys=cuda,gpu -arch=sm_70 -max_num_threads=1024 -thread_warp_size=32", "batch_matmul.cuda", [["TENSOR", [12, 64, 64], "float32"], ["TENSOR", [12, 64, 64], "float32"], [12, 64, 64], "float32", 0, 1], {}], "config": {"index": 12666, "code_hash": null, "entity": [["tile_y", "sp", [-1, 8, 2]], ["tile_x", "sp", [-1, 16, 1]], ["tile_k", "sp", [-1, 4]], ["auto_unroll_max_step", "ot", 32], ["unroll_explicit", "ot", 0]]}, "result": [[5.331053959774644e-06], 0, 3.2762086391448975, 1704884561.1053107], "version": 0.2, "tvm_version": "0.14.dev0"}
{"input": ["cuda -keys=cuda,gpu -arch=sm_70 -max_num_threads=1024 -thread_warp_size=32", "batch_matmul.cuda", [["TENSOR", [12, 64, 64], "float32"], ["TENSOR", [12, 64, 64], "float32"], [12, 64, 64], "float32", 0, 1], {}], "config": {"index": 18160, "code_hash": null, "entity": [["tile_y", "sp", [-1, 8, 4]], ["tile_x", "sp", [-1, 16, 1]], ["tile_k", "sp", [-1, 4]], ["auto_unroll_max_step", "ot", 64], ["unroll_explicit", "ot", 0]]}, "result": [[6.175801994331294e-06], 0, 3.3624839782714844, 1704884563.916991], "version": 0.2, "tvm_version": "0.14.dev0"}
{"input": ["cuda -keys=cuda,gpu -arch=sm_70 -max_num_threads=1024 -thread_warp_size=32", "batch_matmul.cuda", [["TENSOR", [12, 64, 64], "float32"], ["TENSOR", [12, 64, 64], "float32"], [12, 64, 64], "float32", 0, 1], {}], "config": {"index": 18944, "code_hash": null, "entity": [["tile_y", "sp", [-1, 8, 4]], ["tile_x", "sp", [-1, 16, 1]], ["tile_k", "sp", [-1, 8]], ["auto_unroll_max_step", "ot", 64], ["unroll_explicit", "ot", 0]]}, "result": [[5.588578879980255e-06], 0, 3.3489630222320557, 1704884566.8006995], "version": 0.2, "tvm_version": "0.14.dev0"}
{"input": ["cuda -keys=cuda,gpu -arch=sm_70 -max_num_threads=1024 -thread_warp_size=32", "batch_matmul.cuda", [["TENSOR", [12, 64, 64], "float32"], ["TENSOR", [12, 64, 64], "float32"], [12, 64, 64], "float32", 0, 1], {}], "config": {"index": 40895, "code_hash": null, "entity": [["tile_y", "sp", [-1, 4, 4]], ["tile_x", "sp", [-1, 16, 1]], ["tile_k", "sp", [-1, 8]], ["auto_unroll_max_step", "ot", 64], ["unroll_explicit", "ot", 1]]}, "result": [[5.443442482059375e-06], 0, 3.2919862270355225, 1704884569.568563], "version": 0.2, "tvm_version": "0.14.dev0"}
{"input": ["cuda -keys=cuda,gpu -arch=sm_70 -max_num_threads=1024 -thread_warp_size=32", "batch_matmul.cuda", [["TENSOR", [12, 64, 64], "float32"], ["TENSOR", [12, 64, 64], "float32"], [12, 64, 64], "float32", 0, 1], {}], "config": {"index": 34619, "code_hash": null, "entity": [["tile_y", "sp", [-1, 16, 2]], ["tile_x", "sp", [-1, 16, 1]], ["tile_k", "sp", [-1, 4]], ["auto_unroll_max_step", "ot", 32], ["unroll_explicit", "ot", 1]]}, "result": [[5.768426590055042e-06], 0, 3.4018032550811768, 1704884572.3688643], "version": 0.2, "tvm_version": "0.14.dev0"}
{"input": ["cuda -keys=cuda,gpu -arch=sm_70 -max_num_threads=1024 -thread_warp_size=32", "batch_matmul.cuda", [["TENSOR", [12, 64, 64], "float32"], ["TENSOR", [12, 64, 64], "float32"], [12, 64, 64], "float32", 0, 1], {}], "config": {"index": 41684, "code_hash": null, "entity": [["tile_y", "sp", [-1, 4, 8]], ["tile_x", "sp", [-1, 16, 1]], ["tile_k", "sp", [-1, 16]], ["auto_unroll_max_step", "ot", 64], ["unroll_explicit", "ot", 1]]}, "result": [[4.8234069417667985e-06], 0, 3.5382156372070312, 1704884575.206137], "version": 0.2, "tvm_version": "0.14.dev0"}
{"input": ["cuda -keys=cuda,gpu -arch=sm_70 -max_num_threads=1024 -thread_warp_size=32", "batch_matmul.cuda", [["TENSOR", [12, 64, 64], "float32"], ["TENSOR", [12, 64, 64], "float32"], [12, 64, 64], "float32", 0, 1], {}], "config": {"index": 40105, "code_hash": null, "entity": [["tile_y", "sp", [-1, 4, 2]], ["tile_x", "sp", [-1, 16, 1]], ["tile_k", "sp", [-1, 4]], ["auto_unroll_max_step", "ot", 64], ["unroll_explicit", "ot", 1]]}, "result": [[5.6278927137252195e-06], 0, 3.3949997425079346, 1704884578.0518491], "version": 0.2, "tvm_version": "0.14.dev0"}
