util/prepare_model_store/distilgpt2-tune-v100.json
{"input": ["cuda -keys=cuda,gpu -arch=sm_70 -max_num_threads=1024 -thread_warp_size=32", "dense_small_batch.gpu", [["TENSOR", [64, 768], "float32"], ["TENSOR", [2304, 768], "float32"], null, "float32"], {}], "config": {"index": 12, "code_hash": null, "entity": [["tile_k", "sp", [-1, 96]]]}, "result": [[0.00035253308944014565], 0, 3.131333589553833, 1712852532.3531036], "version": 0.2, "tvm_version": "0.14.dev0"}
{"input": ["cuda -keys=cuda,gpu -arch=sm_70 -max_num_threads=1024 -thread_warp_size=32", "dense_small_batch.gpu", [["TENSOR", [64, 768], "float32"], ["TENSOR", [2304, 768], "float32"], null, "float32"], {}], "config": {"index": 6, "code_hash": null, "entity": [["tile_k", "sp", [-1, 12]]]}, "result": [[0.0003815341468019825], 0, 3.3246524333953857, 1712852535.3846788], "version": 0.2, "tvm_version": "0.14.dev0"}
{"input": ["cuda -keys=cuda,gpu -arch=sm_70 -max_num_threads=1024 -thread_warp_size=32", "dense_small_batch.gpu", [["TENSOR", [64, 768], "float32"], ["TENSOR", [2304, 768], "float32"], null, "float32"], {}], "config": {"index": 15, "code_hash": null, "entity": [["tile_k", "sp", [-1, 256]]]}, "result": [[0.0005060912510172145], 0, 3.2860183715820312, 1712852538.3874946], "version": 0.2, "tvm_version": "0.14.dev0"}
{"input": ["cuda -keys=cuda,gpu -arch=sm_70 -max_num_threads=1024 -thread_warp_size=32", "dense_small_batch.gpu", [["TENSOR", [64, 768], "float32"], ["TENSOR", [2304, 768], "float32"], null, "float32"], {}], "config": {"index": 14, "code_hash": null, "entity": [["tile_k", "sp", [-1, 192]]]}, "result": [[0.0004970849142066421], 0, 3.321632146835327, 1712852541.4390345], "version": 0.2, "tvm_version": "0.14.dev0"}
{"input": ["cuda -keys=cuda,gpu -arch=sm_70 -max_num_threads=1024 -thread_warp_size=32", "dense_small_batch.gpu", [["TENSOR", [64, 768], "float32"], ["TENSOR", [2304, 768], "float32"], null, "float32"], {}], "config": {"index": 2, "code_hash": null, "entity": [["tile_k", "sp", [-1, 3]]]}, "result": [[0.0010867169098250336], 0, 3.291396141052246, 1712852544.4528556], "version": 0.2, "tvm_version": "0.14.dev0"}
{"input": ["cuda -keys=cuda,gpu -arch=sm_70 -max_num_threads=1024 -thread_warp_size=32", "dense_small_batch.gpu", [["TENSOR", [64, 768], "float32"], ["TENSOR", [2304, 768], "float32"], null, "float32"], {}], "config": {"index": 10, "code_hash": null, "entity": [["tile_k", "sp", [-1, 48]]]}, "result": [[0.0003096650322271245], 0, 3.2652087211608887, 1712852547.4515011], "version": 0.2, "tvm_version": "0.14.dev0"}
{"input": ["cuda -keys=cuda,gpu -arch=sm_70 -max_num_threads=1024 -thread_warp_size=32", "dense_small_batch.gpu", [["TENSOR", [64, 768], "float32"], ["TENSOR", [2304, 768], "float32"], null, "float32"], {}], "config": {"index": 11, "code_hash": null, "entity": [["tile_k", "sp", [-1, 64]]]}, "result": [[0.0003069422254977029], 0, 3.297222852706909, 1712852550.477887], "version": 0.2, "tvm_version": "0.14.dev0"}
{"input": ["cuda -keys=cuda,gpu -arch=sm_70 -max_num_threads=1024 -thread_warp_size=32", "dense_small_batch.gpu", [["TENSOR", [64, 768], "float32"], ["TENSOR", [2304, 768], "float32"], null, "float32"], {}], "config": {"index": 7, "code_hash": null, "entity": [["tile_k", "sp", [-1, 16]]]}, "result": [[0.0003475002361290323], 0, 3.3128302097320557, 1712852553.480761], "version": 0.2, "tvm_version": "0.14.dev0"}
{"input": ["cuda -keys=cuda,gpu -arch=sm_70 -max_num_threads=1024 -thread_warp_size=32", "dense_small_batch.gpu", [["TENSOR", [64, 768], "float32"], ["TENSOR", [2304, 768], "float32"], null, "float32"], {}], "config": {"index": 3, "code_hash": null, "entity": [["tile_k", "sp", [-1, 4]]]}, "result": [[0.0008507177680168333], 0, 3.3081960678100586, 1712852556.5021195], "version": 0.2, "tvm_version": "0.14.dev0"}
{"input": ["cuda -keys=cuda,gpu -arch=sm_70 -max_num_threads=1024 -thread_warp_size=32", "dense_small_batch.gpu", [["TENSOR", [64, 768], "float32"], ["TENSOR", [2304, 768], "float32"], null, "float32"], {}], "config": {"index": 5, "code_hash": null, "entity": [["tile_k", "sp", [-1, 8]]]}, "result": [[0.00046861752999130687], 0, 3.4067533016204834, 1712852559.628777], "version": 0.2, "tvm_version": "0.14.dev0"}
{"input": ["cuda -keys=cuda,gpu -arch=sm_70 -max_num_threads=1024 -thread_warp_size=32", "dense_small_batch.gpu", [["TENSOR", [64, 768], "float32"], ["TENSOR", [2304, 768], "float32"], null, "float32"], {}], "config": {"index": 17, "code_hash": null, "entity": [["tile_k", "sp", [-1, 768]]]}, "result": [[0.00134812333639399], 0, 3.7524566650390625, 1712852563.1364548], "version": 0.2, "tvm_version": "0.14.dev0"}
{"input": ["cuda -keys=cuda,gpu -arch=sm_70 -max_num_threads=1024 -thread_warp_size=32", "dense_small_batch.gpu", [["TENSOR", [64, 768], "float32"], ["TENSOR", [2304, 768], "float32"], null, "float32"], {}], "config": {"index": 0, "code_hash": null, "entity": [["tile_k", "sp", [-1, 1]]]}, "result": [[0.003014184054216867], 0, 2.3383805751800537, 1712852565.21126], "version": 0.2, "tvm_version": "0.14.dev0"}
{"input": ["cuda -keys=cuda,gpu -arch=sm_70 -max_num_threads=1024 -thread_warp_size=32", "dense_small_batch.gpu", [["TENSOR", [64, 768], "float32"], ["TENSOR", [2304, 768], "float32"], null, "float32"], {}], "config": {"index": 16, "code_hash": null, "entity": [["tile_k", "sp", [-1, 384]]]}, "result": [[0.0005555472831097351], 0, 3.4904050827026367, 1712852568.4589684], "version": 0.2, "tvm_version": "0.14.dev0"}
{"input": ["cuda -keys=cuda,gpu -arch=sm_70 -max_num_threads=1024 -thread_warp_size=32", "dense_small_batch.gpu", [["TENSOR", [64, 768], "float32"], ["TENSOR", [2304, 768], "float32"], null, "float32"], {}], "config": {"index": 9, "code_hash": null, "entity": [["tile_k", "sp", [-1, 32]]]}, "result": [[0.00030231041931860726], 0, 3.3094961643218994, 1712852571.5017698], "version": 0.2, "tvm_version": "0.14.dev0"}
{"input": ["cuda -keys=cuda,gpu -arch=sm_70 -max_num_threads=1024 -thread_warp_size=32", "dense_small_batch.gpu", [["TENSOR", [64, 768], "float32"], ["TENSOR", [2304, 768], "float32"], null, "float32"], {}], "config": {"index": 4, "code_hash": null, "entity": [["tile_k", "sp", [-1, 6]]]}, "result": [[0.0005949843112582781], 0, 3.3900468349456787, 1712852574.6199973], "version": 0.2, "tvm_version": "0.14.dev0"}
{"input": ["cuda -keys=cuda,gpu -arch=sm_70 -max_num_threads=1024 -thread_warp_size=32", "dense_small_batch.gpu", [["TENSOR", [64, 768], "float32"], ["TENSOR", [2304, 768], "float32"], null, "float32"], {}], "config": {"index": 1, "code_hash": null, "entity": [["tile_k", "sp", [-1, 2]]]}, "result": [[0.0015373912626070409], 0, 3.406421184539795, 1712852577.7886727], "version": 0.2, "tvm_version": "0.14.dev0"}
{"input": ["cuda -keys=cuda,gpu -arch=sm_70 -max_num_threads=1024 -thread_warp_size=32", "dense_small_batch.gpu", [["TENSOR", [64, 768], "float32"], ["TENSOR", [2304, 768], "float32"], null, "float32"], {}], "config": {"index": 8, "code_hash": null, "entity": [["tile_k", "sp", [-1, 24]]]}, "result": [[0.00032403109065383076], 0, 3.2973015308380127, 1712852580.8113616], "version": 0.2, "tvm_version": "0.14.dev0"}
{"input": ["cuda -keys=cuda,gpu -arch=sm_70 -max_num_threads=1024 -thread_warp_size=32", "dense_small_batch.gpu", [["TENSOR", [64, 768], "float32"], ["TENSOR", [2304, 768], "float32"], null, "float32"], {}], "config": {"index": 13, "code_hash": null, "entity": [["tile_k", "sp", [-1, 128]]]}, "result": [[0.0003980690936191181], 0, 3.3272595405578613, 1712852583.8935301], "version": 0.2, "tvm_version": "0.14.dev0"}
{"input": ["cuda -keys=cuda,gpu -arch=sm_70 -max_num_threads=1024 -thread_warp_size=32", "dense_large_batch.gpu", [["TENSOR", [64, 768], "float32"], ["TENSOR", [2304, 768], "float32"], null, "float32"], {}], "config": {"index": 9892764, "code_hash": null, "entity": [["tile_x", "sp", [-1, 1, 1, 1]], ["tile_y", "sp", [-1, 1, 1, 4]], ["tile_k", "sp", [-1, 12, 8]]]}, "result": [[0.0026407866717557253], 0, 4.962675333023071, 1712852597.0800583], "version": 0.2, "tvm_version": "0.14.dev0"}
{"input": ["cuda -keys=cuda,gpu -arch=sm_70 -max_num_threads=1024 -thread_warp_size=32", "dense_large_batch.gpu", [["TENSOR", [64, 768], "float32"], ["TENSOR", [2304, 768], "float32"], null, "float32"], {}], "config": {"index": 2217768, "code_hash": null, "entity": [["tile_x", "sp", [-1, 1, 1, 1]], ["tile_y", "sp", [-1, 3, 1, 1]], ["tile_k", "sp", [-1, 384, 1]]]}, "result": [[0.0038654169919999995], 0, 11.539018392562866, 1712852777.6791508], "version": 0.2, "tvm_version": "0.14.dev0"}
{"input": ["cuda -keys=cuda,gpu -arch=sm_70 -max_num_threads=1024 -thread_warp_size=32", "dense_large_batch.gpu", [["TENSOR", [64, 768], "float32"], ["TENSOR", [2304, 768], "float32"], null, "float32"], {}], "config": {"index": 3603769, "code_hash": null, "entity": [["tile_x", "sp", [-1, 2, 1, 1]], ["tile_y", "sp", [-1, 3, 1, 1]], ["tile_k", "sp", [-1, 24, 2]]]}, "result": [[0.001798167939933259], 0, 4.444307565689087, 1712852780.7377973], "version": 0.2, "tvm_version": "0.14.dev0"}
{"input": ["cuda -keys=cuda,gpu -arch=sm_70 -max_num_threads=1024 -thread_warp_size=32", "dense_large_batch.gpu", [["TENSOR", [64, 768], "float32"], ["TENSOR", [2304, 768], "float32"], null, "float32"], {}], "config": {"index": 17740969, "code_hash": null, "entity": [["tile_x", "sp", [-1, 2, 1, 1]], ["tile_y", "sp", [-1, 3, 1, 1]], ["tile_k", "sp", [-1, 2, 192]]]}, "result": [[0.018208091732142856], 0, 5.100277662277222, 1712852782.348907], "version": 0.2, "tvm_version": "0.14.dev0"}
{"input": ["cuda -keys=cuda,gpu -arch=sm_70 -max_num_threads=1024 -thread_warp_size=32", "dense_large_batch.gpu", [["TENSOR", [64, 768], "float32"], ["TENSOR", [2304, 768], "float32"], null, "float32"], {}], "config": {"index": 9906876, "code_hash": null, "entity": [["tile_x", "sp", [-1, 1, 1, 1]], ["tile_y", "sp", [-1, 1, 1, 6]], ["tile_k", "sp", [-1, 12, 8]]]}, "result": [[0.002930924619883041], 0, 3.5041165351867676, 1712852783.7581778], "version": 0.2, "tvm_version": "0.14.dev0"}
{"input": ["cuda -keys=cuda,gpu -arch=sm_70 -max_num_threads=1024 -thread_warp_size=32", "dense_large_batch.gpu", [["TENSOR", [64, 768], "float32"], ["TENSOR", [2304, 768], "float32"], null, "float32"], {}], "config": {"index": 277368, "code_hash": null, "entity": [["tile_x", "sp", [-1, 1, 1, 1]], ["tile_y", "sp", [-1, 3, 1, 1]], ["tile_k", "sp", [-1, 3, 1]]]}, "result": [[0.0034560140655172412], 0, 2.566826343536377, 1712852785.2411644], "version": 0.2, "tvm_version": "0.14.dev0"}
{"input": ["cuda -keys=cuda,gpu -arch=sm_70 -max_num_threads=1024 -thread_warp_size=32", "dense_large_batch.gpu", [["TENSOR", [64, 768], "float32"], ["TENSOR", [2304, 768], "float32"], null, "float32"], {}], "config": {"index": 4042108, "code_hash": null, "entity": [["tile_x", "sp", [-1, 1, 1, 2]], ["tile_y", "sp", [-1, 1, 1, 2]], ["tile_k", "sp", [-1, 64, 2]]]}, "result": [[0.002256387357605178], 0, 6.412869453430176, 1712852893.703536], "version": 0.2, "tvm_version": "0.14.dev0"}
{"input": ["cuda -keys=cuda,gpu -arch=sm_70 -max_num_threads=1024 -thread_warp_size=32", "dense_large_batch.gpu", [["TENSOR", [64, 768], "float32"], ["TENSOR", [2304, 768], "float32"], null, "float32"], {}], "config": {"index": 3881054, "code_hash": null, "entity": [["tile_x", "sp", [-1, 4, 1, 1]], ["tile_y", "sp", [-1, 4, 1, 1]], ["tile_k", "sp", [-1, 48, 2]]]}, "result": [[0.0013741322210884352], 0, 9.101102590560913, 1712852896.7868073], "version": 0.2, "tvm_version": "0.14.dev0"}
{"input": ["cuda -keys=cuda,gpu -arch=sm_70 -max_num_threads=1024 -thread_warp_size=32", "dense_large_batch.gpu", [["TENSOR", [64, 768], "float32"], ["TENSOR", [2304, 768], "float32"], null, "float32"], {}], "config": {"index": 22760, "code_hash": null, "entity": [["tile_x", "sp", [-1, 1, 1, 32]], ["tile_y", "sp", [-1, 1, 1, 2]], ["tile_k", "sp", [-1, 1, 1]]]}, "result": [[0.0013164113092105263], 0, 1.7724218368530273, 1712852898.1865852], "version": 0.2, "tvm_version": "0.14.dev0"}
{"input": ["cuda -keys=cuda,gpu -arch=sm_70 -max_num_threads=1024 -thread_warp_size=32", "dense_large_batch.gpu", [["TENSOR", [64, 768], "float32"], ["TENSOR", [2304, 768], "float32"], null, "float32"], {}], "config": {"index": 2772843, "code_hash": null, "entity": [["tile_x", "sp", [-1, 8, 1, 1]], ["tile_y", "sp", [-1, 24, 1, 1]], ["tile_k", "sp", [-1, 3, 2]]]}, "result": [[0.0013694857948016415], 0, 2.8135390281677246, 1712852899.6213338], "version": 0.2, "tvm_version": "0.14.dev0"}
{"input": ["cuda -keys=cuda,gpu -arch=sm_70 -max_num_threads=1024 -thread_warp_size=32", "dense_large_batch.gpu", [["TENSOR", [64, 768], "float32"], ["TENSOR", [2304, 768], "float32"], null, "float32"], {}], "config": {"index": 3049878, "code_hash": null, "entity": [["tile_x", "sp", [-1, 64, 1, 1]], ["tile_y", "sp", [-1, 16, 1, 1]], ["tile_k", "sp", [-1, 6, 2]]]}, "result": [[0.056113891555555545], 0, 6.200131177902222, 1712852901.7040453], "version": 0.2, "tvm_version": "0.14.dev0"}
{"input": ["cuda -keys=cuda,gpu -arch=sm_70 -max_num_threads=1024 -thread_warp_size=32", "dense_large_batch.gpu", [["TENSOR", [64, 768], "float32"], ["TENSOR", [2304, 768], "float32"], null, "float32"], {}], "config": {"index": 2772340, "code_hash": null, "entity": [["tile_x", "sp", [-1, 16, 1, 1]], ["tile_y", "sp", [-1, 6, 1, 1]], ["tile_k", "sp", [-1, 3, 2]]]}, "result": [[0.0008447277737722047], 0, 3.834904193878174, 1712852904.733499], "version": 0.2, "tvm_version": "0.14.dev0"}
{"input": ["cuda -keys=cuda,gpu -arch=sm_70 -max_num_threads=1024 -thread_warp_size=32", "dense_large_batch.gpu", [["TENSOR", [64, 768], "float32"], ["TENSOR", [2304, 768], "float32"], null, "float32"], {}], "config": {"index": 6514790, "code_hash": null, "entity": [["tile_x", "sp", [-1, 4, 1, 1]], ["tile_y", "sp", [-1, 12, 1, 1]], ["tile_k", "sp", [-1, 6, 4]]]}, "result": [[0.001073361741356383], 0, 4.9662394523620605, 1712852907.765713], "version": 0.2, "tvm_version": "0.14.dev0"}
{"input": ["cuda -keys=cuda,gpu -arch=sm_70 -max_num_threads=1024 -thread_warp_size=32", "dense_large_batch.gpu", [["TENSOR", [64, 768], "float32"], ["TENSOR", [2304, 768], "float32"], null, "float32"], {}], "config": {"index": 5960390, "code_hash": null, "entity": [["tile_x", "sp", [-1, 4, 1, 1]], ["tile_y", "sp", [-1, 12, 1, 1]], ["tile_k", "sp", [-1, 1, 4]]]}, "result": [[0.0009065705545556806], 0, 3.8024425506591797, 1712852911.2105362], "version": 0.2, "tvm_version": "0.14.dev0"}
{"input": ["cuda -keys=cuda,gpu -arch=sm_70 -max_num_threads=1024 -thread_warp_size=32", "dense_large_batch.gpu", [["TENSOR", [64, 768], "float32"], ["TENSOR", [2304, 768], "float32"], null, "float32"], {}], "config": {"index": 6237507, "code_hash": null, "entity": [["tile_x", "sp", [-1, 8, 1, 1]], ["tile_y", "sp", [-1, 9, 1, 1]], ["tile_k", "sp", [-1, 3, 4]]]}, "result": [[0.0009889605893385984], 0, 2.7261033058166504, 1712852912.6099927], "version": 0.2, "tvm_version": "0.14.dev0"}
{"input": ["cuda -keys=cuda,gpu -arch=sm_70 -max_num_threads=1024 -thread_warp_size=32", "dense_large_batch.gpu", [["TENSOR", [64, 768], "float32"], ["TENSOR", [2304, 768], "float32"], null, "float32"], {}], "config": {"index": 6237505, "code_hash": null, "entity": [["tile_x", "sp", [-1, 2, 1, 1]], ["tile_y", "sp", [-1, 9, 1, 1]], ["tile_k", "sp", [-1, 3, 4]]]}, "result": [[0.0014626237394468704], 0, 2.054805278778076, 1712852913.9971025], "version": 0.2, "tvm_version": "0.14.dev0"}
{"input": ["cuda -keys=cuda,gpu -arch=sm_70 -max_num_threads=1024 -thread_warp_size=32", "dense_large_batch.gpu", [["TENSOR", [64, 768], "float32"], ["TENSOR", [2304, 768], "float32"], null, "float32"], {}], "config": {"index": 5961144, "code_hash": null, "entity": [["tile_x", "sp", [-1, 1, 1, 1]], ["tile_y", "sp", [-1, 96, 1, 1]], ["tile_k", "sp", [-1, 1, 4]]]}, "result": [[0.00286563305141844], 0, 4.317927360534668, 1712852917.120042], "version": 0.2, "tvm_version": "0.14.dev0"}
{"input": ["cuda -keys=cuda,gpu -arch=sm_70 -max_num_threads=1024 -thread_warp_size=32", "dense_large_batch.gpu", [["TENSOR", [64, 768], "float32"], ["TENSOR", [2304, 768], "float32"], null, "float32"], {}], "config": {"index": 9702090, "code_hash": null, "entity": [["tile_x", "sp", [-1, 64, 1, 1]], ["tile_y", "sp", [-1, 2, 1, 1]], ["tile_k", "sp", [-1, 8, 8]]]}, "result": [[0.022779624227272723], 0, 7.174387454986572, 1712852918.8313575], "version": 0.2, "tvm_version": "0.14.dev0"}
{"input": ["cuda -keys=cuda,gpu -arch=sm_70 -max_num_threads=1024 -thread_warp_size=32", "dense_large_batch.gpu", [["TENSOR", [64, 768], "float32"], ["TENSOR", [2304, 768], "float32"], null, "float32"], {}], "config": {"index": 1360108, "code_hash": null, "entity": [["tile_x", "sp", [-1, 1, 1, 8]], ["tile_y", "sp", [-1, 1, 1, 32]], ["tile_k", "sp", [-1, 32, 1]]]}, "result": [[0.010697967521276596], 0, 11.061406135559082, 1712852920.482101], "version": 0.2, "tvm_version": "0.14.dev0"}
{"input": ["cuda -keys=cuda,gpu -arch=sm_70 -max_num_threads=1024 -thread_warp_size=32", "dense_large_batch.gpu", [["TENSOR", [64, 768], "float32"], ["TENSOR", [2304, 768], "float32"], null, "float32"], {}], "config": {"index": 1205642, "code_hash": null, "entity": [["tile_x", "sp", [-1, 1, 1, 16]], ["tile_y", "sp", [-1, 1, 1, 16]], ["tile_k", "sp", [-1, 24, 1]]]}, "result": [[0.01009681396], 0, 7.7612292766571045, 1712852922.1240265], "version": 0.2, "tvm_version": "0.14.dev0"}
{"input": ["cuda -keys=cuda,gpu -arch=sm_70 -max_num_threads=1024 -thread_warp_size=32", "dense_large_batch.gpu", [["TENSOR", [64, 768], "float32"], ["TENSOR", [2304, 768], "float32"], null, "float32"], {}], "config": {"index": 6205752, "code_hash": null, "entity": [["tile_x", "sp", [-1, 1, 1, 1]], ["tile_y", "sp", [-1, 1, 1, 24]], ["tile_k", "sp", [-1, 2, 4]]]}, "result": [[0.0023158375763888887], 0, 2.026968240737915, 1712852924.9380462], "version": 0.2, "tvm_version": "0.14.dev0"}
{"input": ["cuda -keys=cuda,gpu -arch=sm_70 -max_num_threads=1024 -thread_warp_size=32", "dense_large_batch.gpu", [["TENSOR", [64, 768], "float32"], ["TENSOR", [2304, 768], "float32"], null, "float32"], {}], "config": {"index": 6099158, "code_hash": null, "entity": [["tile_x", "sp", [-1, 4, 1, 1]], ["tile_y", "sp", [-1, 18, 1, 1]], ["tile_k", "sp", [-1, 2, 4]]]}, "result": [[0.0009593573997243281], 0, 3.4664506912231445, 1712853135.770209], "version": 0.2, "tvm_version": "0.14.dev0"}
{"input": ["cuda -keys=cuda,gpu -arch=sm_70 -max_num_threads=1024 -thread_warp_size=32", "dense_large_batch.gpu", [["TENSOR", [64, 768], "float32"], ["TENSOR", [2304, 768], "float32"], null, "float32"], {}], "config": {"index": 7900958, "code_hash": null, "entity": [["tile_x", "sp", [-1, 4, 1, 1]], ["tile_y", "sp", [-1, 18, 1, 1]], ["tile_k", "sp", [-1, 1, 6]]]}, "result": [[0.0009223683034285715], 0, 3.9325778484344482, 1712853138.7701807], "version": 0.2, "tvm_version": "0.14.dev0"}
{"input": ["cuda -keys=cuda,gpu -arch=sm_70 -max_num_threads=1024 -thread_warp_size=32", "dense_large_batch.gpu", [["TENSOR", [64, 768], "float32"], ["TENSOR", [2304, 768], "float32"], null, "float32"], {}], "config": {"index": 2772759, "code_hash": null, "entity": [["tile_x", "sp", [-1, 8, 1, 1]], ["tile_y", "sp", [-1, 18, 1, 1]], ["tile_k", "sp", [-1, 3, 2]]]}, "result": [[0.0008791045642002177], 0, 4.474295377731323, 1712853141.8230379], "version": 0.2, "tvm_version": "0.14.dev0"}
{"input": ["cuda -keys=cuda,gpu -arch=sm_70 -max_num_threads=1024 -thread_warp_size=32", "dense_large_batch.gpu", [["TENSOR", [64, 768], "float32"], ["TENSOR", [2304, 768], "float32"], null, "float32"], {}], "config": {"index": 554741, "code_hash": null, "entity": [["tile_x", "sp", [-1, 32, 1, 1]], ["tile_y", "sp", [-1, 6, 1, 1]], ["tile_k", "sp", [-1, 6, 1]]]}, "result": [[0.0011814532772494515], 0, 4.861992359161377, 1712853144.8287172], "version": 0.2, "tvm_version": "0.14.dev0"}
{"input": ["cuda -keys=cuda,gpu -arch=sm_70 -max_num_threads=1024 -thread_warp_size=32", "dense_large_batch.gpu", [["TENSOR", [64, 768], "float32"], ["TENSOR", [2304, 768], "float32"], null, "float32"], {}], "config": {"index": 693760, "code_hash": null, "entity": [["tile_x", "sp", [-1, 16, 1, 1]], ["tile_y", "sp", [-1, 18, 1, 1]], ["tile_k", "sp", [-1, 8, 1]]]}, "result": [[0.010815653473118279], 0, 4.19969630241394, 1712853146.3492832], "version": 0.2, "tvm_version": "0.14.dev0"}
{"input": ["cuda -keys=cuda,gpu -arch=sm_70 -max_num_threads=1024 -thread_warp_size=32", "dense_large_batch.gpu", [["TENSOR", [64, 768], "float32"], ["TENSOR", [2304, 768], "float32"], null, "float32"], {}], "config": {"index": 3187804, "code_hash": null, "entity": [["tile_x", "sp", [-1, 16, 1, 1]], ["tile_y", "sp", [-1, 1, 1, 1]], ["tile_k", "sp", [-1, 8, 2]]]}, "result": [[0.002338880591121495], 0, 2.5204713344573975, 1712853147.8091779], "version": 0.2, "tvm_version": "0.14.dev0"}
{"input": ["cuda -keys=cuda,gpu -arch=sm_70 -max_num_threads=1024 -thread_warp_size=32", "dense_large_batch.gpu", [["TENSOR", [64, 768], "float32"], ["TENSOR", [2304, 768], "float32"], null, "float32"], {}], "config": {"index": 10810972, "code_hash": null, "entity": [["tile_x", "sp", [-1, 16, 1, 1]], ["tile_y", "sp", [-1, 3, 1, 1]], ["tile_k", "sp", [-1, 2, 12]]]}, "result": [[0.0011874153886255925], 0, 3.1801040172576904, 1712853149.2584043], "version": 0.2, "tvm_version": "0.14.dev0"}
{"input": ["cuda -keys=cuda,gpu -arch=sm_70 -max_num_threads=1024 -thread_warp_size=32", "dense_large_batch.gpu", [["TENSOR", [64, 768], "float32"], ["TENSOR", [2304, 768], "float32"], null, "float32"], {}], "config": {"index": 831604, "code_hash": null, "entity": [["tile_x", "sp", [-1, 16, 1, 1]], ["tile_y", "sp", [-1, 1, 1, 1]], ["tile_k", "sp", [-1, 12, 1]]]}, "result": [[0.00233215644988345], 0, 2.307136297225952, 1712853150.6655073], "version": 0.2, "tvm_version": "0.14.dev0"}
{"input": ["cuda -keys=cuda,gpu -arch=sm_70 -max_num_threads=1024 -thread_warp_size=32", "dense_large_batch.gpu", [["TENSOR", [64, 768], "float32"], ["TENSOR", [2304, 768], "float32"], null, "float32"], {}], "config": {"index": 5960393, "code_hash": null, "entity": [["tile_x", "sp", [-1, 32, 1, 1]], ["tile_y", "sp", [-1, 12, 1, 1]], ["tile_k", "sp", [-1, 1, 4]]]}, "result": [[0.03544685310344828], 0, 4.861348628997803, 1712853152.5077803], "version": 0.2, "tvm_version": "0.14.dev0"}
{"input": ["cuda -keys=cuda,gpu -arch=sm_70 -max_num_threads=1024 -thread_warp_size=32", "dense_large_batch.gpu", [["TENSOR", [64, 768], "float32"], ["TENSOR", [2304, 768], "float32"], null, "float32"], {}], "config": {"index": 6791739, "code_hash": null, "entity": [["tile_x", "sp", [-1, 8, 1, 1]], ["tile_y", "sp", [-1, 6, 1, 1]], ["tile_k", "sp", [-1, 12, 4]]]}, "result": [[0.001120542384787472], 0, 6.34731388092041, 1712853153.9142978], "version": 0.2, "tvm_version": "0.14.dev0"}
{"input": ["cuda -keys=cuda,gpu -arch=sm_70 -max_num_threads=1024 -thread_warp_size=32", "dense_large_batch.gpu", [["TENSOR", [64, 768], "float32"], ["TENSOR", [2304, 768], "float32"], null, "float32"], {}], "config": {"index": 2911193, "code_hash": null, "entity": [["tile_x", "sp", [-1, 32, 1, 1]], ["tile_y", "sp", [-1, 12, 1, 1]], ["tile_k", "sp", [-1, 4, 2]]]}, "result": [[0.011629365430232557], 0, 9.733512163162231, 1712853155.4317234], "version": 0.2, "tvm_version": "0.14.dev0"}
{"input": ["cuda -keys=cuda,gpu -arch=sm_70 -max_num_threads=1024 -thread_warp_size=32", "dense_large_batch.gpu", [["TENSOR", [64, 768], "float32"], ["TENSOR", [2304, 768], "float32"], null, "float32"], {}], "config": {"index": 6237759, "code_hash": null, "entity": [["tile_x", "sp", [-1, 8, 1, 1]], ["tile_y", "sp", [-1, 18, 1, 1]], ["tile_k", "sp", [-1, 3, 4]]]}, "result": [[0.0032279584638554215], 0, 5.082291126251221, 1712853158.4938557], "version": 0.2, "tvm_version": "0.14.dev0"}
{"input": ["cuda -keys=cuda,gpu -arch=sm_70 -max_num_threads=1024 -thread_warp_size=32", "dense_large_batch.gpu", [["TENSOR", [64, 768], "float32"], ["TENSOR", [2304, 768], "float32"], null, "float32"], {}], "config": {"index": 6237593, "code_hash": null, "entity": [["tile_x", "sp", [-1, 32, 1, 1]], ["tile_y", "sp", [-1, 12, 1, 1]], ["tile_k", "sp", [-1, 3, 4]]]}, "result": [[0.037279744444444436], 0, 9.663420677185059, 1712853160.3339415], "version": 0.2, "tvm_version": "0.14.dev0"}
{"input": ["cuda -keys=cuda,gpu -arch=sm_70 -max_num_threads=1024 -thread_warp_size=32", "dense_large_batch.gpu", [["TENSOR", [64, 768], "float32"], ["TENSOR", [2304, 768], "float32"], null, "float32"], {}], "config": {"index": 832358, "code_hash": null, "entity": [["tile_x", "sp", [-1, 4, 1, 1]], ["tile_y", "sp", [-1, 18, 1, 1]], ["tile_k", "sp", [-1, 12, 1]]]}, "result": [[0.0010538723437703847], 0, 4.562743186950684, 1712853163.359846], "version": 0.2, "tvm_version": "0.14.dev0"}
{"input": ["cuda -keys=cuda,gpu -arch=sm_70 -max_num_threads=1024 -thread_warp_size=32", "dense_large_batch.gpu", [["TENSOR", [64, 768], "float32"], ["TENSOR", [2304, 768], "float32"], null, "float32"], {}], "config": {"index": 6791404, "code_hash": null, "entity": [["tile_x", "sp", [-1, 16, 1, 1]], ["tile_y", "sp", [-1, 1, 1, 1]], ["tile_k", "sp", [-1, 12, 4]]]}, "result": [[0.0026423289885433715], 0, 6.298485040664673, 1712853166.421682], "version": 0.2, "tvm_version": "0.14.dev0"}
{"input": ["cuda -keys=cuda,gpu -arch=sm_70 -max_num_threads=1024 -thread_warp_size=32", "dense_large_batch.gpu", [["TENSOR", [64, 768], "float32"], ["TENSOR", [2304, 768], "float32"], null, "float32"], {}], "config": {"index": 438483, "code_hash": null, "entity": [["tile_x", "sp", [-1, 8, 1, 1]], ["tile_y", "sp", [-1, 1, 1, 2]], ["tile_k", "sp", [-1, 4, 1]]]}, "result": [[0.001475118279452055], 0, 3.6593194007873535, 1712853169.4322908], "version": 0.2, "tvm_version": "0.14.dev0"}
{"input": ["cuda -keys=cuda,gpu -arch=sm_70 -max_num_threads=1024 -thread_warp_size=32", "dense_large_batch.gpu", [["TENSOR", [64, 768], "float32"], ["TENSOR", [2304, 768], "float32"], null, "float32"], {}], "config": {"index": 9702590, "code_hash": null, "entity": [["tile_x", "sp", [-1, 4, 1, 1]], ["tile_y", "sp", [-1, 12, 1, 1]], ["tile_k", "sp", [-1, 8, 8]]]}, "result": [[0.0012563405423465423], 0, 7.735307455062866, 1712853172.4744585], "version": 0.2, "tvm_version": "0.14.dev0"}
{"input": ["cuda -keys=cuda,gpu -arch=sm_70 -max_num_threads=1024 -thread_warp_size=32", "dense_large_batch.gpu", [["TENSOR", [64, 768], "float32"], ["TENSOR", [2304, 768], "float32"], null, "float32"], {}], "config": {"index": 6653390, "code_hash": null, "entity": [["tile_x", "sp", [-1, 4, 1, 1]], ["tile_y", "sp", [-1, 12, 1, 1]], ["tile_k", "sp", [-1, 8, 4]]]}, "result": [[0.0010926046572052402], 0, 4.459225177764893, 1712853173.9167907], "version": 0.2, "tvm_version": "0.14.dev0"}
{"input": ["cuda -keys=cuda,gpu -arch=sm_70 -max_num_threads=1024 -thread_warp_size=32", "dense_large_batch.gpu", [["TENSOR", [64, 768], "float32"], ["TENSOR", [2304, 768], "float32"], null, "float32"], {}], "config": {"index": 4, "code_hash": null, "entity": [["tile_x", "sp", [-1, 16, 1, 1]], ["tile_y", "sp", [-1, 1, 1, 1]], ["tile_k", "sp", [-1, 1, 1]]]}, "result": [[0.002460423499236641], 0, 3.5439414978027344, 1712853176.986561], "version": 0.2, "tvm_version": "0.14.dev0"}
{"input": ["cuda -keys=cuda,gpu -arch=sm_70 -max_num_threads=1024 -thread_warp_size=32", "dense_large_batch.gpu", [["TENSOR", [64, 768], "float32"], ["TENSOR", [2304, 768], "float32"], null, "float32"], {}], "config": {"index": 11642993, "code_hash": null, "entity": [["tile_x", "sp", [-1, 32, 1, 1]], ["tile_y", "sp", [-1, 12, 1, 1]], ["tile_k", "sp", [-1, 1, 16]]]}, "result": [[0.02645183360526316], 0, 4.748747110366821, 1712853178.6926804], "version": 0.2, "tvm_version": "0.14.dev0"}
{"input": ["cuda -keys=cuda,gpu -arch=sm_70 -max_num_threads=1024 -thread_warp_size=32", "dense_large_batch.gpu", [["TENSOR", [64, 768], "float32"], ["TENSOR", [2304, 768], "float32"], null, "float32"], {}], "config": {"index": 138772, "code_hash": null, "entity": [["tile_x", "sp", [-1, 16, 1, 1]], ["tile_y", "sp", [-1, 3, 1, 1]], ["tile_k", "sp", [-1, 2, 1]]]}, "result": [[0.0010566601844342709], 0, 3.639484167098999, 1712853181.7741737], "version": 0.2, "tvm_version": "0.14.dev0"}
{"input": ["cuda -keys=cuda,gpu -arch=sm_70 -max_num_threads=1024 -thread_warp_size=32", "dense_large_batch.gpu", [["TENSOR", [64, 768], "float32"], ["TENSOR", [2304, 768], "float32"], null, "float32"], {}], "config": {"index": 5128958, "code_hash": null, "entity": [["tile_x", "sp", [-1, 4, 1, 1]], ["tile_y", "sp", [-1, 18, 1, 1]], ["tile_k", "sp", [-1, 8, 3]]]}, "result": [[0.001261316209331652], 0, 3.9785404205322266, 1712853183.166213], "version": 0.2, "tvm_version": "0.14.dev0"}
{"input": ["cuda -keys=cuda,gpu -arch=sm_70 -max_num_threads=1024 -thread_warp_size=32", "dense_large_batch.gpu", [["TENSOR", [64, 768], "float32"], ["TENSOR", [2304, 768], "float32"], null, "float32"], {}], "config": {"index": 4713245, "code_hash": null, "entity": [["tile_x", "sp", [-1, 32, 1, 1]], ["tile_y", "sp", [-1, 24, 1, 1]], ["tile_k", "sp", [-1, 1, 3]]]}, "result": [[0.0438278675652174], 0, 3.392150640487671, 1712853185.0620008], "version": 0.2, "tvm_version": "0.14.dev0"}
{"input": ["cuda -keys=cuda,gpu -arch=sm_70 -max_num_threads=1024 -thread_warp_size=32", "dense_large_batch.gpu", [["TENSOR", [64, 768], "float32"], ["TENSOR", [2304, 768], "float32"], null, "float32"], {}], "config": {"index": 11781758, "code_hash": null, "entity": [["tile_x", "sp", [-1, 4, 1, 1]], ["tile_y", "sp", [-1, 18, 1, 1]], ["tile_k", "sp", [-1, 2, 16]]]}, "result": [[0.011799745082352943], 0, 5.0030059814453125, 1712853186.6611776], "version": 0.2, "tvm_version": "0.14.dev0"}
{"input": ["cuda -keys=cuda,gpu -arch=sm_70 -max_num_threads=1024 -thread_warp_size=32", "dense_large_batch.gpu", [["TENSOR", [64, 768], "float32"], ["TENSOR", [2304, 768], "float32"], null, "float32"], {}], "config": {"index": 9425559, "code_hash": null, "entity": [["tile_x", "sp", [-1, 8, 1, 1]], ["tile_y", "sp", [-1, 18, 1, 1]], ["tile_k", "sp", [-1, 4, 8]]]}, "result": [[0.0057916483705035965], 0, 7.687820672988892, 1712853189.7326434], "version": 0.2, "tvm_version": "0.14.dev0"}
{"input": ["cuda -keys=cuda,gpu -arch=sm_70 -max_num_threads=1024 -thread_warp_size=32", "dense_large_batch.gpu", [["TENSOR", [64, 768], "float32"], ["TENSOR", [2304, 768], "float32"], null, "float32"], {}], "config": {"index": 11920358, "code_hash": null, "entity": [["tile_x", "sp", [-1, 4, 1, 1]], ["tile_y", "sp", [-1, 18, 1, 1]], ["tile_k", "sp", [-1, 3, 16]]]}, "result": [[0.013046637987012989], 0, 6.9459757804870605, 1712853191.2654858], "version": 0.2, "tvm_version": "0.14.dev0"}
{"input": ["cuda -keys=cuda,gpu -arch=sm_70 -max_num_threads=1024 -thread_warp_size=32", "dense_large_batch.gpu", [["TENSOR", [64, 768], "float32"], ["TENSOR", [2304, 768], "float32"], null, "float32"], {}], "config": {"index": 10811560, "code_hash": null, "entity": [["tile_x", "sp", [-1, 16, 1, 1]], ["tile_y", "sp", [-1, 18, 1, 1]], ["tile_k", "sp", [-1, 2, 12]]]}, "result": [[0.015580238692307692], 0, 6.279827833175659, 1712853192.887945], "version": 0.2, "tvm_version": "0.14.dev0"}
{"input": ["cuda -keys=cuda,gpu -arch=sm_70 -max_num_threads=1024 -thread_warp_size=32", "dense_large_batch.gpu", [["TENSOR", [64, 768], "float32"], ["TENSOR", [2304, 768], "float32"], null, "float32"], {}], "config": {"index": 6792158, "code_hash": null, "entity": [["tile_x", "sp", [-1, 4, 1, 1]], ["tile_y", "sp", [-1, 18, 1, 1]], ["tile_k", "sp", [-1, 12, 4]]]}, "result": [[0.0014376623233190273], 0, 6.418153524398804, 1712853194.2938554], "version": 0.2, "tvm_version": "0.14.dev0"}
{"input": ["cuda -keys=cuda,gpu -arch=sm_70 -max_num_threads=1024 -thread_warp_size=32", "dense_large_batch.gpu", [["TENSOR", [64, 768], "float32"], ["TENSOR", [2304, 768], "float32"], null, "float32"], {}], "config": {"index": 8316759, "code_hash": null, "entity": [["tile_x", "sp", [-1, 8, 1, 1]], ["tile_y", "sp", [-1, 18, 1, 1]], ["tile_k", "sp", [-1, 8, 6]]]}, "result": [[0.006245681643410853], 0, 11.743164539337158, 1712853197.410558], "version": 0.2, "tvm_version": "0.14.dev0"}
{"input": ["cuda -keys=cuda,gpu -arch=sm_70 -max_num_threads=1024 -thread_warp_size=32", "dense_large_batch.gpu", [["TENSOR", [64, 768], "float32"], ["TENSOR", [2304, 768], "float32"], null, "float32"], {}], "config": {"index": 2494853, "code_hash": null, "entity": [["tile_x", "sp", [-1, 16, 1, 4]], ["tile_y", "sp", [-1, 1, 1, 1]], ["tile_k", "sp", [-1, 1, 2]]]}, "result": [[0.0023727438672985785], 0, 2.3084163665771484, 1712853198.871572], "version": 0.2, "tvm_version": "0.14.dev0"}
{"input": ["cuda -keys=cuda,gpu -arch=sm_70 -max_num_threads=1024 -thread_warp_size=32", "dense_large_batch.gpu", [["TENSOR", [64, 768], "float32"], ["TENSOR", [2304, 768], "float32"], null, "float32"], {}], "config": {"index": 2633453, "code_hash": null, "entity": [["tile_x", "sp", [-1, 16, 1, 4]], ["tile_y", "sp", [-1, 1, 1, 1]], ["tile_k", "sp", [-1, 2, 2]]]}, "result": [[0.0026615568349834984], 0, 4.169509649276733, 1712853201.9010224], "version": 0.2, "tvm_version": "0.14.dev0"}
{"input": ["cuda -keys=cuda,gpu -arch=sm_70 -max_num_threads=1024 -thread_warp_size=32", "dense_large_batch.gpu", [["TENSOR", [64, 768], "float32"], ["TENSOR", [2304, 768], "float32"], null, "float32"], {}], "config": {"index": 277251, "code_hash": null, "entity": [["tile_x", "sp", [-1, 4, 1, 4]], ["tile_y", "sp", [-1, 1, 1, 1]], ["tile_k", "sp", [-1, 3, 1]]]}, "result": [[0.002397957064275037], 0, 3.6959755420684814, 1712853204.9229603], "version": 0.2, "tvm_version": "0.14.dev0"}
{"input": ["cuda -keys=cuda,gpu -arch=sm_70 -max_num_threads=1024 -thread_warp_size=32", "dense_large_batch.gpu", [["TENSOR", [64, 768], "float32"], ["TENSOR", [2304, 768], "float32"], null, "float32"], {}], "config": {"index": 67, "code_hash": null, "entity": [["tile_x", "sp", [-1, 8, 1, 8]], ["tile_y", "sp", [-1, 1, 1, 1]], ["tile_k", "sp", [-1, 1, 1]]]}, "result": [[0.002714329829268293], 0, 2.1538872718811035, 1712853206.4223266], "version": 0.2, "tvm_version": "0.14.dev0"}
{"input": ["cuda -keys=cuda,gpu -arch=sm_70 -max_num_threads=1024 -thread_warp_size=32", "dense_large_batch.gpu", [["TENSOR", [64, 768], "float32"], ["TENSOR", [2304, 768], "float32"], null, "float32"], {}], "config": {"index": 2911105, "code_hash": null, "entity": [["tile_x", "sp", [-1, 2, 1, 1]], ["tile_y", "sp", [-1, 9, 1, 1]], ["tile_k", "sp", [-1, 4, 2]]]}, "result": [[0.0014113344859154932], 0, 2.2464637756347656, 1712853207.8198073], "version": 0.2, "tvm_version": "0.14.dev0"}
{"input": ["cuda -keys=cuda,gpu -arch=sm_70 -max_num_threads=1024 -thread_warp_size=32", "dense_large_batch.gpu", [["TENSOR", [64, 768], "float32"], ["TENSOR", [2304, 768], "float32"], null, "float32"], {}], "config": {"index": 7900789, "code_hash": null, "entity": [["tile_x", "sp", [-1, 2, 1, 1]], ["tile_y", "sp", [-1, 12, 1, 1]], ["tile_k", "sp", [-1, 1, 6]]]}, "result": [[0.0014115570647985991], 0, 3.7875382900238037, 1712853210.871198], "version": 0.2, "tvm_version": "0.14.dev0"}
{"input": ["cuda -keys=cuda,gpu -arch=sm_70 -max_num_threads=1024 -thread_warp_size=32", "dense_large_batch.gpu", [["TENSOR", [64, 768], "float32"], ["TENSOR", [2304, 768], "float32"], null, "float32"], {}], "config": {"index": 6237761, "code_hash": null, "entity": [["tile_x", "sp", [-1, 32, 1, 1]], ["tile_y", "sp", [-1, 18, 1, 1]], ["tile_k", "sp", [-1, 3, 4]]]}, "result": [[0.048802769238095234], 0, 5.007753610610962, 1712853212.9604907], "version": 0.2, "tvm_version": "0.14.dev0"}
{"input": ["cuda -keys=cuda,gpu -arch=sm_70 -max_num_threads=1024 -thread_warp_size=32", "dense_large_batch.gpu", [["TENSOR", [64, 768], "float32"], ["TENSOR", [2304, 768], "float32"], null, "float32"], {}], "config": {"index": 555243, "code_hash": null, "entity": [["tile_x", "sp", [-1, 8, 1, 1]], ["tile_y", "sp", [-1, 24, 1, 1]], ["tile_k", "sp", [-1, 6, 1]]]}, "result": [[0.0013929006058091286], 0, 3.2720096111297607, 1712853214.370222], "version": 0.2, "tvm_version": "0.14.dev0"}
{"input": ["cuda -keys=cuda,gpu -arch=sm_70 -max_num_threads=1024 -thread_warp_size=32", "dense_large_batch.gpu", [["TENSOR", [64, 768], "float32"], ["TENSOR", [2304, 768], "float32"], null, "float32"], {}], "config": {"index": 13306359, "code_hash": null, "entity": [["tile_x", "sp", [-1, 8, 1, 1]], ["tile_y", "sp", [-1, 18, 1, 1]], ["tile_k", "sp", [-1, 4, 24]]]}, "result": [[0.007382701198529412], 0, 6.801795482635498, 1712853215.886273], "version": 0.2, "tvm_version": "0.14.dev0"}
{"input": ["cuda -keys=cuda,gpu -arch=sm_70 -max_num_threads=1024 -thread_warp_size=32", "dense_large_batch.gpu", [["TENSOR", [64, 768], "float32"], ["TENSOR", [2304, 768], "float32"], null, "float32"], {}], "config": {"index": 14276560, "code_hash": null, "entity": [["tile_x", "sp", [-1, 16, 1, 1]], ["tile_y", "sp", [-1, 18, 1, 1]], ["tile_k", "sp", [-1, 4, 32]]]}, "result": [[0.014499691275362318], 0, 4.704371690750122, 1712853217.4792786], "version": 0.2, "tvm_version": "0.14.dev0"}
{"input": ["cuda -keys=cuda,gpu -arch=sm_70 -max_num_threads=1024 -thread_warp_size=32", "dense_large_batch.gpu", [["TENSOR", [64, 768], "float32"], ["TENSOR", [2304, 768], "float32"], null, "float32"], {}], "config": {"index": 7900791, "code_hash": null, "entity": [["tile_x", "sp", [-1, 8, 1, 1]], ["tile_y", "sp", [-1, 12, 1, 1]], ["tile_k", "sp", [-1, 1, 6]]]}, "result": [[0.0008121607725146198], 0, 5.660261631011963, 1712853403.0274963], "version": 0.2, "tvm_version": "0.14.dev0"}
{"input": ["cuda -keys=cuda,gpu -arch=sm_70 -max_num_threads=1024 -thread_warp_size=32", "dense_large_batch.gpu", [["TENSOR", [64, 768], "float32"], ["TENSOR", [2304, 768], "float32"], null, "float32"], {}], "config": {"index": 5960391, "code_hash": null, "entity": [["tile_x", "sp", [-1, 8, 1, 1]], ["tile_y", "sp", [-1, 12, 1, 1]], ["tile_k", "sp", [-1, 1, 4]]]}, "result": [[0.000768775809047619], 0, 5.841993808746338, 1712853406.0577142], "version": 0.2, "tvm_version": "0.14.dev0"}
{"input": ["cuda -keys=cuda,gpu -arch=sm_70 -max_num_threads=1024 -thread_warp_size=32", "dense_large_batch.gpu", [["TENSOR", [64, 768], "float32"], ["TENSOR", [2304, 768], "float32"], null, "float32"], {}], "config": {"index": 555074, "code_hash": null, "entity": [["tile_x", "sp", [-1, 4, 1, 1]], ["tile_y", "sp", [-1, 16, 1, 1]], ["tile_k", "sp", [-1, 6, 1]]]}, "result": [[0.0008504146245762712], 0, 4.1730382442474365, 1712853407.5293834], "version": 0.2, "tvm_version": "0.14.dev0"}
{"input": ["cuda -keys=cuda,gpu -arch=sm_70 -max_num_threads=1024 -thread_warp_size=32", "dense_large_batch.gpu", [["TENSOR", [64, 768], "float32"], ["TENSOR", [2304, 768], "float32"], null, "float32"], {}], "config": {"index": 693339, "code_hash": null, "entity": [["tile_x", "sp", [-1, 8, 1, 1]], ["tile_y", "sp", [-1, 6, 1, 1]], ["tile_k", "sp", [-1, 8, 1]]]}, "result": [[0.0008287249543355567], 0, 6.852599859237671, 1712853410.591088], "version": 0.2, "tvm_version": "0.14.dev0"}
{"input": ["cuda -keys=cuda,gpu -arch=sm_70 -max_num_threads=1024 -thread_warp_size=32", "dense_large_batch.gpu", [["TENSOR", [64, 768], "float32"], ["TENSOR", [2304, 768], "float32"], null, "float32"], {}], "config": {"index": 6099074, "code_hash": null, "entity": [["tile_x", "sp", [-1, 4, 1, 1]], ["tile_y", "sp", [-1, 16, 1, 1]], ["tile_k", "sp", [-1, 2, 4]]]}, "result": [[0.0008828556999439148], 0, 5.714861631393433, 1712853413.6202588], "version": 0.2, "tvm_version": "0.14.dev0"}
{"input": ["cuda -keys=cuda,gpu -arch=sm_70 -max_num_threads=1024 -thread_warp_size=32", "dense_large_batch.gpu", [["TENSOR", [64, 768], "float32"], ["TENSOR", [2304, 768], "float32"], null, "float32"], {}], "config": {"index": 5128538, "code_hash": null, "entity": [["tile_x", "sp", [-1, 4, 1, 1]], ["tile_y", "sp", [-1, 6, 1, 1]], ["tile_k", "sp", [-1, 8, 3]]]}, "result": [[0.0011297698755244755], 0, 6.8327813148498535, 1712853416.7281015], "version": 0.2, "tvm_version": "0.14.dev0"}
{"input": ["cuda -keys=cuda,gpu -arch=sm_70 -max_num_threads=1024 -thread_warp_size=32", "dense_large_batch.gpu", [["TENSOR", [64, 768], "float32"], ["TENSOR", [2304, 768], "float32"], null, "float32"], {}], "config": {"index": 9009507, "code_hash": null, "entity": [["tile_x", "sp", [-1, 8, 1, 1]], ["tile_y", "sp", [-1, 9, 1, 1]], ["tile_k", "sp", [-1, 1, 8]]]}, "result": [[0.0008481113209033614], 0, 4.415443181991577, 1712853419.7790825], "version": 0.2, "tvm_version": "0.14.dev0"}
{"input": ["cuda -keys=cuda,gpu -arch=sm_70 -max_num_threads=1024 -thread_warp_size=32", "dense_large_batch.gpu", [["TENSOR", [64, 768], "float32"], ["TENSOR", [2304, 768], "float32"], null, "float32"], {}], "config": {"index": 2772254, "code_hash": null, "entity": [["tile_x", "sp", [-1, 4, 1, 1]], ["tile_y", "sp", [-1, 4, 1, 1]], ["tile_k", "sp", [-1, 3, 2]]]}, "result": [[0.001202688594237695], 0, 2.3582968711853027, 1712853421.343421], "version": 0.2, "tvm_version": "0.14.dev0"}
{"input": ["cuda -keys=cuda,gpu -arch=sm_70 -max_num_threads=1024 -thread_warp_size=32", "dense_large_batch.gpu", [["TENSOR", [64, 768], "float32"], ["TENSOR", [2304, 768], "float32"], null, "float32"], {}], "config": {"index": 7900538, "code_hash": null, "entity": [["tile_x", "sp", [-1, 4, 1, 1]], ["tile_y", "sp", [-1, 6, 1, 1]], ["tile_k", "sp", [-1, 1, 6]]]}, "result": [[0.001101895311509304], 0, 3.887451648712158, 1712853424.4524903], "version": 0.2, "tvm_version": "0.14.dev0"}
{"input": ["cuda -keys=cuda,gpu -arch=sm_70 -max_num_threads=1024 -thread_warp_size=32", "dense_large_batch.gpu", [["TENSOR", [64, 768], "float32"], ["TENSOR", [2304, 768], "float32"], null, "float32"], {}], "config": {"index": 693591, "code_hash": null, "entity": [["tile_x", "sp", [-1, 8, 1, 1]], ["tile_y", "sp", [-1, 12, 1, 1]], ["tile_k", "sp", [-1, 8, 1]]]}, "result": [[0.0008348746025906735], 0, 7.286420106887817, 1712853427.498992], "version": 0.2, "tvm_version": "0.14.dev0"}
{"input": ["cuda -keys=cuda,gpu -arch=sm_70 -max_num_threads=1024 -thread_warp_size=32", "dense_large_batch.gpu", [["TENSOR", [64, 768], "float32"], ["TENSOR", [2304, 768], "float32"], null, "float32"], {}], "config": {"index": 277567, "code_hash": null, "entity": [["tile_x", "sp", [-1, 8, 1, 2]], ["tile_y", "sp", [-1, 6, 1, 1]], ["tile_k", "sp", [-1, 3, 1]]]}, "result": [[0.0007613794738330976], 0, 4.454985618591309, 1712853430.5567737], "version": 0.2, "tvm_version": "0.14.dev0"}
{"input": ["cuda -keys=cuda,gpu -arch=sm_70 -max_num_threads=1024 -thread_warp_size=32", "dense_large_batch.gpu", [["TENSOR", [64, 768], "float32"], ["TENSOR", [2304, 768], "float32"], null, "float32"], {}], "config": {"index": 5128539, "code_hash": null, "entity": [["tile_x", "sp", [-1, 8, 1, 1]], ["tile_y", "sp", [-1, 6, 1, 1]], ["tile_k", "sp", [-1, 8, 3]]]}, "result": [[0.0010327671033376123], 0, 5.8909831047058105, 1712853433.6688218], "version": 0.2, "tvm_version": "0.14.dev0"}
{"input": ["cuda -keys=cuda,gpu -arch=sm_70 -max_num_threads=1024 -thread_warp_size=32", "dense_large_batch.gpu", [["TENSOR", [64, 768], "float32"], ["TENSOR", [2304, 768], "float32"], null, "float32"], {}], "config": {"index": 2910938, "code_hash": null, "entity": [["tile_x", "sp", [-1, 4, 1, 1]], ["tile_y", "sp", [-1, 6, 1, 1]], ["tile_k", "sp", [-1, 4, 2]]]}, "result": [[0.0010962069665985004], 0, 4.0405731201171875, 1712853436.7991767], "version": 0.2, "tvm_version": "0.14.dev0"}
{"input": ["cuda -keys=cuda,gpu -arch=sm_70 -max_num_threads=1024 -thread_warp_size=32", "dense_large_batch.gpu", [["TENSOR", [64, 768], "float32"], ["TENSOR", [2304, 768], "float32"], null, "float32"], {}], "config": {"index": 8039474, "code_hash": null, "entity": [["tile_x", "sp", [-1, 4, 1, 1]], ["tile_y", "sp", [-1, 16, 1, 1]], ["tile_k", "sp", [-1, 2, 6]]]}, "result": [[0.0009864718218503936], 0, 4.697883129119873, 1712853438.2347403], "version": 0.2, "tvm_version": "0.14.dev0"}
{"input": ["cuda -keys=cuda,gpu -arch=sm_70 -max_num_threads=1024 -thread_warp_size=32", "dense_large_batch.gpu", [["TENSOR", [64, 768], "float32"], ["TENSOR", [2304, 768], "float32"], null, "float32"], {}], "config": {"index": 2772283, "code_hash": null, "entity": [["tile_x", "sp", [-1, 8, 1, 2]], ["tile_y", "sp", [-1, 4, 1, 1]], ["tile_k", "sp", [-1, 3, 2]]]}, "result": [[0.0008575299903846152], 0, 6.561489582061768, 1712853441.4197977], "version": 0.2, "tvm_version": "0.14.dev0"}
{"input": ["cuda -keys=cuda,gpu -arch=sm_70 -max_num_threads=1024 -thread_warp_size=32", "dense_large_batch.gpu", [["TENSOR", [64, 768], "float32"], ["TENSOR", [2304, 768], "float32"], null, "float32"], {}], "config": {"index": 10672538, "code_hash": null, "entity": [["tile_x", "sp", [-1, 4, 1, 1]], ["tile_y", "sp", [-1, 6, 1, 1]], ["tile_k", "sp", [-1, 1, 12]]]}, "result": [[0.0009868861388379205], 0, 5.636978387832642, 1712853444.4343085], "version": 0.2, "tvm_version": "0.14.dev0"}
{"input": ["cuda -keys=cuda,gpu -arch=sm_70 -max_num_threads=1024 -thread_warp_size=32", "dense_large_batch.gpu", [["TENSOR", [64, 768], "float32"], ["TENSOR", [2304, 768], "float32"], null, "float32"], {}], "config": {"index": 4712739, "code_hash": null, "entity": [["tile_x", "sp", [-1, 8, 1, 1]], ["tile_y", "sp", [-1, 6, 1, 1]], ["tile_k", "sp", [-1, 1, 3]]]}, "result": [[0.000809766036242981], 0, 5.360802173614502, 1712853447.4694571], "version": 0.2, "tvm_version": "0.14.dev0"}
{"input": ["cuda -keys=cuda,gpu -arch=sm_70 -max_num_threads=1024 -thread_warp_size=32", "dense_large_batch.gpu", [["TENSOR", [64, 768], "float32"], ["TENSOR", [2304, 768], "float32"], null, "float32"], {}], "config": {"index": 2772303, "code_hash": null, "entity": [["tile_x", "sp", [-1, 4, 1, 4]], ["tile_y", "sp", [-1, 4, 1, 1]], ["tile_k", "sp", [-1, 3, 2]]]}, "result": [[0.0008523531069609509], 0, 4.3898773193359375, 1712853448.9122179], "version": 0.2, "tvm_version": "0.14.dev0"}
{"input": ["cuda -keys=cuda,gpu -arch=sm_70 -max_num_threads=1024 -thread_warp_size=32", "dense_large_batch.gpu", [["TENSOR", [64, 768], "float32"], ["TENSOR", [2304, 768], "float32"], null, "float32"], {}], "config": {"index": 554738, "code_hash": null, "entity": [["tile_x", "sp", [-1, 4, 1, 1]], ["tile_y", "sp", [-1, 6, 1, 1]], ["tile_k", "sp", [-1, 6, 1]]]}, "result": [[0.001106794264241592], 0, 5.547538757324219, 1712853451.9212675], "version": 0.2, "tvm_version": "0.14.dev0"}
{"input": ["cuda -keys=cuda,gpu -arch=sm_70 -max_num_threads=1024 -thread_warp_size=32", "dense_large_batch.gpu", [["TENSOR", [64, 768], "float32"], ["TENSOR", [2304, 768], "float32"], null, "float32"], {}], "config": {"index": 3049817, "code_hash": null, "entity": [["tile_x", "sp", [-1, 2, 1, 2]], ["tile_y", "sp", [-1, 12, 1, 1]], ["tile_k", "sp", [-1, 6, 2]]]}, "result": [[0.0009311236706976744], 0, 5.921618938446045, 1712853453.317322], "version": 0.2, "tvm_version": "0.14.dev0"}
{"input": ["cuda -keys=cuda,gpu -arch=sm_70 -max_num_threads=1024 -thread_warp_size=32", "dense_large_batch.gpu", [["TENSOR", [64, 768], "float32"], ["TENSOR", [2304, 768], "float32"], null, "float32"], {}], "config": {"index": 438986, "code_hash": null, "entity": [["tile_x", "sp", [-1, 4, 1, 1]], ["tile_y", "sp", [-1, 9, 1, 2]], ["tile_k", "sp", [-1, 4, 1]]]}, "result": [[0.0009355337908458864], 0, 6.14508843421936, 1712853456.3671622], "version": 0.2, "tvm_version": "0.14.dev0"}
{"input": ["cuda -keys=cuda,gpu -arch=sm_70 -max_num_threads=1024 -thread_warp_size=32", "dense_large_batch.gpu", [["TENSOR", [64, 768], "float32"], ["TENSOR", [2304, 768], "float32"], null, "float32"], {}], "config": {"index": 6237638, "code_hash": null, "entity": [["tile_x", "sp", [-1, 2, 1, 4]], ["tile_y", "sp", [-1, 12, 1, 1]], ["tile_k", "sp", [-1, 3, 4]]]}, "result": [[0.0010947832616120218], 0, 6.924387454986572, 1712853459.3608124], "version": 0.2, "tvm_version": "0.14.dev0"}
{"input": ["cuda -keys=cuda,gpu -arch=sm_70 -max_num_threads=1024 -thread_warp_size=32", "dense_large_batch.gpu", [["TENSOR", [64, 768], "float32"], ["TENSOR", [2304, 768], "float32"], null, "float32"], {}], "config": {"index": 6237868, "code_hash": null, "entity": [["tile_x", "sp", [-1, 1, 1, 2]], ["tile_y", "sp", [-1, 24, 1, 1]], ["tile_k", "sp", [-1, 3, 4]]]}, "result": [[0.0014530737402597403], 0, 4.8768486976623535, 1712853460.7679386], "version": 0.2, "tvm_version": "0.14.dev0"}
{"input": ["cuda -keys=cuda,gpu -arch=sm_70 -max_num_threads=1024 -thread_warp_size=32", "dense_large_batch.gpu", [["TENSOR", [64, 768], "float32"], ["TENSOR", [2304, 768], "float32"], null, "float32"], {}], "config": {"index": 3049565, "code_hash": null, "entity": [["tile_x", "sp", [-1, 2, 1, 2]], ["tile_y", "sp", [-1, 6, 1, 1]], ["tile_k", "sp", [-1, 6, 2]]]}, "result": [[0.0009869477226634087], 0, 6.156232595443726, 1712853463.820023], "version": 0.2, "tvm_version": "0.14.dev0"}
{"input": ["cuda -keys=cuda,gpu -arch=sm_70 -max_num_threads=1024 -thread_warp_size=32", "dense_large_batch.gpu", [["TENSOR", [64, 768], "float32"], ["TENSOR", [2304, 768], "float32"], null, "float32"], {}], "config": {"index": 7900503, "code_hash": null, "entity": [["tile_x", "sp", [-1, 4, 1, 4]], ["tile_y", "sp", [-1, 4, 1, 1]], ["tile_k", "sp", [-1, 1, 6]]]}, "result": [[0.0008524476727272728], 0, 5.231280088424683, 1712853466.7703173], "version": 0.2, "tvm_version": "0.14.dev0"}
{"input": ["cuda -keys=cuda,gpu -arch=sm_70 -max_num_threads=1024 -thread_warp_size=32", "dense_large_batch.gpu", [["TENSOR", [64, 768], "float32"], ["TENSOR", [2304, 768], "float32"], null, "float32"], {}], "config": {"index": 2772253, "code_hash": null, "entity": [["tile_x", "sp", [-1, 2, 1, 1]], ["tile_y", "sp", [-1, 4, 1, 1]], ["tile_k", "sp", [-1, 3, 2]]]}, "result": [[0.0016564801179487182], 0, 4.632500410079956, 1712853469.805932], "version": 0.2, "tvm_version": "0.14.dev0"}
{"input": ["cuda -keys=cuda,gpu -arch=sm_70 -max_num_threads=1024 -thread_warp_size=32", "dense_large_batch.gpu", [["TENSOR", [64, 768], "float32"], ["TENSOR", [2304, 768], "float32"], null, "float32"], {}], "config": {"index": 2910937, "code_hash": null, "entity": [["tile_x", "sp", [-1, 2, 1, 1]], ["tile_y", "sp", [-1, 6, 1, 1]], ["tile_k", "sp", [-1, 4, 2]]]}, "result": [[0.001512047342900302], 0, 3.6820731163024902, 1712853471.2261124], "version": 0.2, "tvm_version": "0.14.dev0"}
{"input": ["cuda -keys=cuda,gpu -arch=sm_70 -max_num_threads=1024 -thread_warp_size=32", "dense_large_batch.gpu", [["TENSOR", [64, 768], "float32"], ["TENSOR", [2304, 768], "float32"], null, "float32"], {}], "config": {"index": 5267138, "code_hash": null, "entity": [["tile_x", "sp", [-1, 4, 1, 1]], ["tile_y", "sp", [-1, 6, 1, 1]], ["tile_k", "sp", [-1, 16, 3]]]}, "result": [[0.0010376760847240051], 0, 8.521644830703735, 1712853474.2921443], "version": 0.2, "tvm_version": "0.14.dev0"}
{"input": ["cuda -keys=cuda,gpu -arch=sm_70 -max_num_threads=1024 -thread_warp_size=32", "dense_large_batch.gpu", [["TENSOR", [64, 768], "float32"], ["TENSOR", [2304, 768], "float32"], null, "float32"], {}], "config": {"index": 831938, "code_hash": null, "entity": [["tile_x", "sp", [-1, 4, 1, 1]], ["tile_y", "sp", [-1, 6, 1, 1]], ["tile_k", "sp", [-1, 12, 1]]]}, "result": [[0.0009859579565749236], 0, 5.9537270069122314, 1712853477.3573267], "version": 0.2, "tvm_version": "0.14.dev0"}
{"input": ["cuda -keys=cuda,gpu -arch=sm_70 -max_num_threads=1024 -thread_warp_size=32", "dense_large_batch.gpu", [["TENSOR", [64, 768], "float32"], ["TENSOR", [2304, 768], "float32"], null, "float32"], {}], "config": {"index": 179595, "code_hash": null, "entity": [["tile_x", "sp", [-1, 8, 1, 1]], ["tile_y", "sp", [-1, 3, 1, 3]], ["tile_k", "sp", [-1, 2, 1]]]}, "result": [[0.0007928326607236497], 0, 5.408730506896973, 1712853480.3117778], "version": 0.2, "tvm_version": "0.14.dev0"}
{"input": ["cuda -keys=cuda,gpu -arch=sm_70 -max_num_threads=1024 -thread_warp_size=32", "dense_large_batch.gpu", [["TENSOR", [64, 768], "float32"], ["TENSOR", [2304, 768], "float32"], null, "float32"], {}], "config": {"index": 759279, "code_hash": null, "entity": [["tile_x", "sp", [-1, 8, 1, 1]], ["tile_y", "sp", [-1, 1, 1, 6]], ["tile_k", "sp", [-1, 8, 1]]]}, "result": [[0.0008308060231600618], 0, 6.59155535697937, 1712853484.1748614], "version": 0.2, "tvm_version": "0.14.dev0"}
{"input": ["cuda -keys=cuda,gpu -arch=sm_70 -max_num_threads=1024 -thread_warp_size=32", "dense_large_batch.gpu", [["TENSOR", [64, 768], "float32"], ["TENSOR", [2304, 768], "float32"], null, "float32"], {}], "config": {"index": 6238036, "code_hash": null, "entity": [["tile_x", "sp", [-1, 1, 1, 2]], ["tile_y", "sp", [-1, 36, 1, 1]], ["tile_k", "sp", [-1, 3, 4]]]}, "result": [[0.0016330477781402934], 0, 5.787541389465332, 1712853485.9830866], "version": 0.2, "tvm_version": "0.14.dev0"}
{"input": ["cuda -keys=cuda,gpu -arch=sm_70 -max_num_threads=1024 -thread_warp_size=32", "dense_large_batch.gpu", [["TENSOR", [64, 768], "float32"], ["TENSOR", [2304, 768], "float32"], null, "float32"], {}], "config": {"index": 6277911, "code_hash": null, "entity": [["tile_x", "sp", [-1, 8, 1, 1]], ["tile_y", "sp", [-1, 2, 1, 3]], ["tile_k", "sp", [-1, 3, 4]]]}, "result": [[0.000873938841048035], 0, 4.908132553100586, 1712853487.5689354], "version": 0.2, "tvm_version": "0.14.dev0"}
{"input": ["cuda -keys=cuda,gpu -arch=sm_70 -max_num_threads=1024 -thread_warp_size=32", "dense_large_batch.gpu", [["TENSOR", [64, 768], "float32"], ["TENSOR", [2304, 768], "float32"], null, "float32"], {}], "config": {"index": 9009254, "code_hash": null, "entity": [["tile_x", "sp", [-1, 4, 1, 1]], ["tile_y", "sp", [-1, 4, 1, 1]], ["tile_k", "sp", [-1, 1, 8]]]}, "result": [[0.0011932883003575687], 0, 3.979567289352417, 1712853489.0315287], "version": 0.2, "tvm_version": "0.14.dev0"}
{"input": ["cuda -keys=cuda,gpu -arch=sm_70 -max_num_threads=1024 -thread_warp_size=32", "dense_large_batch.gpu", [["TENSOR", [64, 768], "float32"], ["TENSOR", [2304, 768], "float32"], null, "float32"], {}], "config": {"index": 8039438, "code_hash": null, "entity": [["tile_x", "sp", [-1, 2, 1, 4]], ["tile_y", "sp", [-1, 12, 1, 1]], ["tile_k", "sp", [-1, 2, 6]]]}, "result": [[0.0010947380889945652], 0, 6.3209850788116455, 1712853492.0762353], "version": 0.2, "tvm_version": "0.14.dev0"}
{"input": ["cuda -keys=cuda,gpu -arch=sm_70 -max_num_threads=1024 -thread_warp_size=32", "dense_large_batch.gpu", [["TENSOR", [64, 768], "float32"], ["TENSOR", [2304, 768], "float32"], null, "float32"], {}], "config": {"index": 6237842, "code_hash": null, "entity": [["tile_x", "sp", [-1, 4, 1, 1]], ["tile_y", "sp", [-1, 24, 1, 1]], ["tile_k", "sp", [-1, 3, 4]]]}, "result": [[0.0010815666449664428], 0, 6.927058458328247, 1712853495.1902947], "version": 0.2, "tvm_version": "0.14.dev0"}
{"input": ["cuda -keys=cuda,gpu -arch=sm_70 -max_num_threads=1024 -thread_warp_size=32", "dense_large_batch.gpu", [["TENSOR", [64, 768], "float32"], ["TENSOR", [2304, 768], "float32"], null, "float32"], {}], "config": {"index": 9009365, "code_hash": null, "entity": [["tile_x", "sp", [-1, 2, 1, 2]], ["tile_y", "sp", [-1, 6, 1, 1]], ["tile_k", "sp", [-1, 1, 8]]]}, "result": [[0.001096753410326087], 0, 5.2937328815460205, 1712853498.2320185], "version": 0.2, "tvm_version": "0.14.dev0"}
{"input": ["cuda -keys=cuda,gpu -arch=sm_70 -max_num_threads=1024 -thread_warp_size=32", "dense_large_batch.gpu", [["TENSOR", [64, 768], "float32"], ["TENSOR", [2304, 768], "float32"], null, "float32"], {}], "config": {"index": 6098486, "code_hash": null, "entity": [["tile_x", "sp", [-1, 4, 1, 1]], ["tile_y", "sp", [-1, 2, 1, 1]], ["tile_k", "sp", [-1, 2, 4]]]}, "result": [[0.0016460727300613496], 0, 5.035787582397461, 1712853501.2590384], "version": 0.2, "tvm_version": "0.14.dev0"}
{"input": ["cuda -keys=cuda,gpu -arch=sm_70 -max_num_threads=1024 -thread_warp_size=32", "dense_large_batch.gpu", [["TENSOR", [64, 768], "float32"], ["TENSOR", [2304, 768], "float32"], null, "float32"], {}], "config": {"index": 5267139, "code_hash": null, "entity": [["tile_x", "sp", [-1, 8, 1, 1]], ["tile_y", "sp", [-1, 6, 1, 1]], ["tile_k", "sp", [-1, 16, 3]]]}, "result": [[0.0011169377171492204], 0, 10.63388729095459, 1712853502.7225502], "version": 0.2, "tvm_version": "0.14.dev0"}
{"input": ["cuda -keys=cuda,gpu -arch=sm_70 -max_num_threads=1024 -thread_warp_size=32", "dense_large_batch.gpu", [["TENSOR", [64, 768], "float32"], ["TENSOR", [2304, 768], "float32"], null, "float32"], {}], "config": {"index": 2656167, "code_hash": null, "entity": [["tile_x", "sp", [-1, 8, 1, 1]], ["tile_y", "sp", [-1, 2, 1, 2]], ["tile_k", "sp", [-1, 2, 2]]]}, "result": [[0.0009666442279693487], 0, 3.5296645164489746, 1712853504.1580148], "version": 0.2, "tvm_version": "0.14.dev0"}
{"input": ["cuda -keys=cuda,gpu -arch=sm_70 -max_num_threads=1024 -thread_warp_size=32", "dense_large_batch.gpu", [["TENSOR", [64, 768], "float32"], ["TENSOR", [2304, 768], "float32"], null, "float32"], {}], "config": {"index": 139274, "code_hash": null, "entity": [["tile_x", "sp", [-1, 4, 1, 1]], ["tile_y", "sp", [-1, 16, 1, 1]], ["tile_k", "sp", [-1, 2, 1]]]}, "result": [[0.0008553551493644067], 0, 4.9692816734313965, 1712853507.252486], "version": 0.2, "tvm_version": "0.14.dev0"}
{"input": ["cuda -keys=cuda,gpu -arch=sm_70 -max_num_threads=1024 -thread_warp_size=32", "dense_large_batch.gpu", [["TENSOR", [64, 768], "float32"], ["TENSOR", [2304, 768], "float32"], null, "float32"], {}], "config": {"index": 2495474, "code_hash": null, "entity": [["tile_x", "sp", [-1, 4, 1, 1]], ["tile_y", "sp", [-1, 16, 1, 1]], ["tile_k", "sp", [-1, 1, 2]]]}, "result": [[0.0008571771507430997], 0, 5.255199909210205, 1712853510.3382413], "version": 0.2, "tvm_version": "0.14.dev0"}
{"input": ["cuda -keys=cuda,gpu -arch=sm_70 -max_num_threads=1024 -thread_warp_size=32", "dense_large_batch.gpu", [["TENSOR", [64, 768], "float32"], ["TENSOR", [2304, 768], "float32"], null, "float32"], {}], "config": {"index": 9009506, "code_hash": null, "entity": [["tile_x", "sp", [-1, 4, 1, 1]], ["tile_y", "sp", [-1, 9, 1, 1]], ["tile_k", "sp", [-1, 1, 8]]]}, "result": [[0.0009221414934398175], 0, 5.846307277679443, 1712853513.4493148], "version": 0.2, "tvm_version": "0.14.dev0"}
{"input": ["cuda -keys=cuda,gpu -arch=sm_70 -max_num_threads=1024 -thread_warp_size=32", "dense_large_batch.gpu", [["TENSOR", [64, 768], "float32"], ["TENSOR", [2304, 768], "float32"], null, "float32"], {}], "config": {"index": 7900565, "code_hash": null, "entity": [["tile_x", "sp", [-1, 2, 1, 2]], ["tile_y", "sp", [-1, 6, 1, 1]], ["tile_k", "sp", [-1, 1, 6]]]}, "result": [[0.0010977251734693876], 0, 4.96055269241333, 1712853516.4623983], "version": 0.2, "tvm_version": "0.14.dev0"}
{"input": ["cuda -keys=cuda,gpu -arch=sm_70 -max_num_threads=1024 -thread_warp_size=32", "dense_large_batch.gpu", [["TENSOR", [64, 768], "float32"], ["TENSOR", [2304, 768], "float32"], null, "float32"], {}], "config": {"index": 8177765, "code_hash": null, "entity": [["tile_x", "sp", [-1, 2, 1, 2]], ["tile_y", "sp", [-1, 6, 1, 1]], ["tile_k", "sp", [-1, 4, 6]]]}, "result": [[0.0011263592368972745], 0, 6.463596820831299, 1712853519.671469], "version": 0.2, "tvm_version": "0.14.dev0"}
{"input": ["cuda -keys=cuda,gpu -arch=sm_70 -max_num_threads=1024 -thread_warp_size=32", "dense_large_batch.gpu", [["TENSOR", [64, 768], "float32"], ["TENSOR", [2304, 768], "float32"], null, "float32"], {}], "config": {"index": 2772326, "code_hash": null, "entity": [["tile_x", "sp", [-1, 1, 1, 16]], ["tile_y", "sp", [-1, 4, 1, 1]], ["tile_k", "sp", [-1, 3, 2]]]}, "result": [[0.0008501801079014444], 0, 3.5565719604492188, 1712853521.068151], "version": 0.2, "tvm_version": "0.14.dev0"}
{"input": ["cuda -keys=cuda,gpu -arch=sm_70 -max_num_threads=1024 -thread_warp_size=32", "dense_large_batch.gpu", [["TENSOR", [64, 768], "float32"], ["TENSOR", [2304, 768], "float32"], null, "float32"], {}], "config": {"index": 10672600, "code_hash": null, "entity": [["tile_x", "sp", [-1, 1, 1, 8]], ["tile_y", "sp", [-1, 6, 1, 1]], ["tile_k", "sp", [-1, 1, 12]]]}, "result": [[0.0008674039994582883], 0, 5.949951171875, 1712853524.0891213], "version": 0.2, "tvm_version": "0.14.dev0"}
{"input": ["cuda -keys=cuda,gpu -arch=sm_70 -max_num_threads=1024 -thread_warp_size=32", "dense_large_batch.gpu", [["TENSOR", [64, 768], "float32"], ["TENSOR", [2304, 768], "float32"], null, "float32"], {}], "config": {"index": 9286537, "code_hash": null, "entity": [["tile_x", "sp", [-1, 2, 1, 1]], ["tile_y", "sp", [-1, 6, 1, 1]], ["tile_k", "sp", [-1, 3, 8]]]}, "result": [[0.0015054155157894736], 0, 3.9823596477508545, 1712853525.6412008], "version": 0.2, "tvm_version": "0.14.dev0"}
{"input": ["cuda -keys=cuda,gpu -arch=sm_70 -max_num_threads=1024 -thread_warp_size=32", "dense_large_batch.gpu", [["TENSOR", [64, 768], "float32"], ["TENSOR", [2304, 768], "float32"], null, "float32"], {}], "config": {"index": 2910940, "code_hash": null, "entity": [["tile_x", "sp", [-1, 16, 1, 1]], ["tile_y", "sp", [-1, 6, 1, 1]], ["tile_k", "sp", [-1, 4, 2]]]}, "result": [[0.0008554999709649872], 0, 4.586094379425049, 1712853527.0915794], "version": 0.2, "tvm_version": "0.14.dev0"}
{"input": ["cuda -keys=cuda,gpu -arch=sm_70 -max_num_threads=1024 -thread_warp_size=32", "dense_large_batch.gpu", [["TENSOR", [64, 768], "float32"], ["TENSOR", [2304, 768], "float32"], null, "float32"], {}], "config": {"index": 7900610, "code_hash": null, "entity": [["tile_x", "sp", [-1, 1, 1, 16]], ["tile_y", "sp", [-1, 6, 1, 1]], ["tile_k", "sp", [-1, 1, 6]]]}, "result": [[0.0008434031133751305], 0, 5.693552017211914, 1712853530.1476126], "version": 0.2, "tvm_version": "0.14.dev0"}
{"input": ["cuda -keys=cuda,gpu -arch=sm_70 -max_num_threads=1024 -thread_warp_size=32", "dense_large_batch.gpu", [["TENSOR", [64, 768], "float32"], ["TENSOR", [2304, 768], "float32"], null, "float32"], {}], "config": {"index": 9702338, "code_hash": null, "entity": [["tile_x", "sp", [-1, 4, 1, 1]], ["tile_y", "sp", [-1, 6, 1, 1]], ["tile_k", "sp", [-1, 8, 8]]]}, "result": [[0.0011500723205128205], 0, 7.7358317375183105, 1712853533.2890942], "version": 0.2, "tvm_version": "0.14.dev0"}
{"input": ["cuda -keys=cuda,gpu -arch=sm_70 -max_num_threads=1024 -thread_warp_size=32", "dense_large_batch.gpu", [["TENSOR", [64, 768], "float32"], ["TENSOR", [2304, 768], "float32"], null, "float32"], {}], "config": {"index": 2495103, "code_hash": null, "entity": [["tile_x", "sp", [-1, 4, 1, 4]], ["tile_y", "sp", [-1, 4, 1, 1]], ["tile_k", "sp", [-1, 1, 2]]]}, "result": [[0.0008494228304370721], 0, 5.539268732070923, 1712853536.3461664], "version": 0.2, "tvm_version": "0.14.dev0"}
{"input": ["cuda -keys=cuda,gpu -arch=sm_70 -max_num_threads=1024 -thread_warp_size=32", "dense_large_batch.gpu", [["TENSOR", [64, 768], "float32"], ["TENSOR", [2304, 768], "float32"], null, "float32"], {}], "config": {"index": 8039808, "code_hash": null, "entity": [["tile_x", "sp", [-1, 1, 1, 1]], ["tile_y", "sp", [-1, 36, 1, 1]], ["tile_k", "sp", [-1, 2, 6]]]}, "result": [[0.002562877237717908], 0, 6.5707173347473145, 1712853539.5899527], "version": 0.2, "tvm_version": "0.14.dev0"}
{"input": ["cuda -keys=cuda,gpu -arch=sm_70 -max_num_threads=1024 -thread_warp_size=32", "dense_large_batch.gpu", [["TENSOR", [64, 768], "float32"], ["TENSOR", [2304, 768], "float32"], null, "float32"], {}], "config": {"index": 6237087, "code_hash": null, "entity": [["tile_x", "sp", [-1, 8, 1, 1]], ["tile_y", "sp", [-1, 2, 1, 1]], ["tile_k", "sp", [-1, 3, 4]]]}, "result": [[0.0014984268402985074], 0, 4.677950382232666, 1712853541.7508206], "version": 0.2, "tvm_version": "0.14.dev0"}
{"input": ["cuda -keys=cuda,gpu -arch=sm_70 -max_num_threads=1024 -thread_warp_size=32", "dense_large_batch.gpu", [["TENSOR", [64, 768], "float32"], ["TENSOR", [2304, 768], "float32"], null, "float32"], {}], "config": {"index": 2933367, "code_hash": null, "entity": [["tile_x", "sp", [-1, 8, 1, 1]], ["tile_y", "sp", [-1, 2, 1, 2]], ["tile_k", "sp", [-1, 4, 2]]]}, "result": [[0.0009042344042553191], 0, 6.049133539199829, 1712853545.315227], "version": 0.2, "tvm_version": "0.14.dev0"}
