util/prepare_model_store/vit_s_16-tune-v100.json
{"input": ["cuda -keys=cuda,gpu -arch=sm_70 -max_num_threads=1024 -thread_warp_size=32", "conv2d_nchw.cuda", [["TENSOR", [1, 3, 224, 224], "float32"], ["TENSOR", [768, 3, 16, 16], "float32"], [16, 16], [0, 0, 0, 0], [1, 1], "float32"], {}], "config": {"index": 18639290, "code_hash": null, "entity": [["tile_f", "sp", [-1, 8, 48, 2]], ["tile_y", "sp", [-1, 2, 1, 1]], ["tile_x", "sp", [-1, 7, 2, 1]], ["tile_rc", "sp", [-1, 1]], ["tile_ry", "sp", [-1, 1]], ["tile_rx", "sp", [-1, 2]], ["auto_unroll_max_step", "ot", 1500], ["unroll_explicit", "ot", 0]]}, "result": [[0.002539226902752294], 0, 4.761606216430664, 1711981168.9565573], "version": 0.2, "tvm_version": "0.14.dev0"}
{"input": ["cuda -keys=cuda,gpu -arch=sm_70 -max_num_threads=1024 -thread_warp_size=32", "conv2d_nchw.cuda", [["TENSOR", [1, 3, 224, 224], "float32"], ["TENSOR", [768, 3, 16, 16], "float32"], [16, 16], [0, 0, 0, 0], [1, 1], "float32"], {}], "config": {"index": 14277458, "code_hash": null, "entity": [["tile_f", "sp", [-1, 2, 8, 4]], ["tile_y", "sp", [-1, 1, 1, 1]], ["tile_x", "sp", [-1, 1, 14, 1]], ["tile_rc", "sp", [-1, 1]], ["tile_ry", "sp", [-1, 4]], ["tile_rx", "sp", [-1, 8]], ["auto_unroll_max_step", "ot", 512], ["unroll_explicit", "ot", 0]]}, "result": [[0.00013287847789873], 0, 4.100258827209473, 1711981171.917478], "version": 0.2, "tvm_version": "0.14.dev0"}
{"input": ["cuda -keys=cuda,gpu -arch=sm_70 -max_num_threads=1024 -thread_warp_size=32", "conv2d_nchw.cuda", [["TENSOR", [1, 3, 224, 224], "float32"], ["TENSOR", [768, 3, 16, 16], "float32"], [16, 16], [0, 0, 0, 0], [1, 1], "float32"], {}], "config": {"index": 26158241, "code_hash": null, "entity": [["tile_f", "sp", [-1, 3, 16, 8]], ["tile_y", "sp", [-1, 2, 1, 1]], ["tile_x", "sp", [-1, 2, 1, 7]], ["tile_rc", "sp", [-1, 1]], ["tile_ry", "sp", [-1, 4]], ["tile_rx", "sp", [-1, 1]], ["auto_unroll_max_step", "ot", 0], ["unroll_explicit", "ot", 1]]}, "result": [[0.010278556969387755], 0, 3.476938247680664, 1711981173.4370167], "version": 0.2, "tvm_version": "0.14.dev0"}
{"input": ["cuda -keys=cuda,gpu -arch=sm_70 -max_num_threads=1024 -thread_warp_size=32", "conv2d_nchw.cuda", [["TENSOR", [1, 3, 224, 224], "float32"], ["TENSOR", [768, 3, 16, 16], "float32"], [16, 16], [0, 0, 0, 0], [1, 1], "float32"], {}], "config": {"index": 27298989, "code_hash": null, "entity": [["tile_f", "sp", [-1, 6, 8, 1]], ["tile_y", "sp", [-1, 7, 1, 1]], ["tile_x", "sp", [-1, 1, 1, 2]], ["tile_rc", "sp", [-1, 3]], ["tile_ry", "sp", [-1, 1]], ["tile_rx", "sp", [-1, 2]], ["auto_unroll_max_step", "ot", 0], ["unroll_explicit", "ot", 1]]}, "result": [[0.009543133828571427], 0, 2.5018744468688965, 1711981174.8973148], "version": 0.2, "tvm_version": "0.14.dev0"}
{"input": ["cuda -keys=cuda,gpu -arch=sm_70 -max_num_threads=1024 -thread_warp_size=32", "conv2d_nchw.cuda", [["TENSOR", [1, 3, 224, 224], "float32"], ["TENSOR", [768, 3, 16, 16], "float32"], [16, 16], [0, 0, 0, 0], [1, 1], "float32"], {}], "config": {"index": 3677960, "code_hash": null, "entity": [["tile_f", "sp", [-1, 6, 4, 8]], ["tile_y", "sp", [-1, 1, 2, 1]], ["tile_x", "sp", [-1, 1, 1, 7]], ["tile_rc", "sp", [-1, 3]], ["tile_ry", "sp", [-1, 1]], ["tile_rx", "sp", [-1, 4]], ["auto_unroll_max_step", "ot", 0], ["unroll_explicit", "ot", 0]]}, "result": [[0.012118176554216866], 0, 2.9051709175109863, 1711981176.3835192], "version": 0.2, "tvm_version": "0.14.dev0"}
{"input": ["cuda -keys=cuda,gpu -arch=sm_70 -max_num_threads=1024 -thread_warp_size=32", "conv2d_nchw.cuda", [["TENSOR", [1, 3, 224, 224], "float32"], ["TENSOR", [768, 3, 16, 16], "float32"], [16, 16], [0, 0, 0, 0], [1, 1], "float32"], {}], "config": {"index": 35748521, "code_hash": null, "entity": [["tile_f", "sp", [-1, 8, 32, 3]], ["tile_y", "sp", [-1, 1, 2, 1]], ["tile_x", "sp", [-1, 1, 1, 2]], ["tile_rc", "sp", [-1, 3]], ["tile_ry", "sp", [-1, 1]], ["tile_rx", "sp", [-1, 2]], ["auto_unroll_max_step", "ot", 512], ["unroll_explicit", "ot", 1]]}, "result": [[0.0006521470181671377], 0, 4.940069675445557, 1711981179.3978348], "version": 0.2, "tvm_version": "0.14.dev0"}
{"input": ["cuda -keys=cuda,gpu -arch=sm_70 -max_num_threads=1024 -thread_warp_size=32", "conv2d_nchw.cuda", [["TENSOR", [1, 3, 224, 224], "float32"], ["TENSOR", [768, 3, 16, 16], "float32"], [16, 16], [0, 0, 0, 0], [1, 1], "float32"], {}], "config": {"index": 20391445, "code_hash": null, "entity": [["tile_f", "sp", [-1, 2, 16, 1]], ["tile_y", "sp", [-1, 1, 1, 1]], ["tile_x", "sp", [-1, 1, 7, 2]], ["tile_rc", "sp", [-1, 1]], ["tile_ry", "sp", [-1, 1]], ["tile_rx", "sp", [-1, 4]], ["auto_unroll_max_step", "ot", 1500], ["unroll_explicit", "ot", 0]]}, "result": [[0.0002124938200974582], 0, 4.371399402618408, 1711981182.3619938], "version": 0.2, "tvm_version": "0.14.dev0"}
{"input": ["cuda -keys=cuda,gpu -arch=sm_70 -max_num_threads=1024 -thread_warp_size=32", "conv2d_nchw.cuda", [["TENSOR", [1, 3, 224, 224], "float32"], ["TENSOR", [768, 3, 16, 16], "float32"], [16, 16], [0, 0, 0, 0], [1, 1], "float32"], {}], "config": {"index": 10237304, "code_hash": null, "entity": [["tile_f", "sp", [-1, 2, 4, 1]], ["tile_y", "sp", [-1, 2, 7, 1]], ["tile_x", "sp", [-1, 1, 1, 2]], ["tile_rc", "sp", [-1, 1]], ["tile_ry", "sp", [-1, 1]], ["tile_rx", "sp", [-1, 2]], ["auto_unroll_max_step", "ot", 512], ["unroll_explicit", "ot", 0]]}, "result": [[0.012539276875], 0, 3.836944818496704, 1711981183.8609576], "version": 0.2, "tvm_version": "0.14.dev0"}
{"input": ["cuda -keys=cuda,gpu -arch=sm_70 -max_num_threads=1024 -thread_warp_size=32", "conv2d_nchw.cuda", [["TENSOR", [1, 3, 224, 224], "float32"], ["TENSOR", [768, 3, 16, 16], "float32"], [16, 16], [0, 0, 0, 0], [1, 1], "float32"], {}], "config": {"index": 25914892, "code_hash": null, "entity": [["tile_f", "sp", [-1, 1, 4, 192]], ["tile_y", "sp", [-1, 1, 1, 1]], ["tile_x", "sp", [-1, 1, 7, 1]], ["tile_rc", "sp", [-1, 3]], ["tile_ry", "sp", [-1, 2]], ["tile_rx", "sp", [-1, 1]], ["auto_unroll_max_step", "ot", 0], ["unroll_explicit", "ot", 1]]}, "result": [[0.006118937048780488], 0, 2.575528144836426, 1711981185.3282485], "version": 0.2, "tvm_version": "0.14.dev0"}
{"input": ["cuda -keys=cuda,gpu -arch=sm_70 -max_num_threads=1024 -thread_warp_size=32", "conv2d_nchw.cuda", [["TENSOR", [1, 3, 224, 224], "float32"], ["TENSOR", [768, 3, 16, 16], "float32"], [16, 16], [0, 0, 0, 0], [1, 1], "float32"], {}], "config": {"index": 10349927, "code_hash": null, "entity": [["tile_f", "sp", [-1, 3, 32, 8]], ["tile_y", "sp", [-1, 2, 1, 1]], ["tile_x", "sp", [-1, 1, 2, 1]], ["tile_rc", "sp", [-1, 3]], ["tile_ry", "sp", [-1, 1]], ["tile_rx", "sp", [-1, 2]], ["auto_unroll_max_step", "ot", 512], ["unroll_explicit", "ot", 0]]}, "result": [[0.0006685191265508685], 0, 4.703194618225098, 1711981188.3112097], "version": 0.2, "tvm_version": "0.14.dev0"}
{"input": ["cuda -keys=cuda,gpu -arch=sm_70 -max_num_threads=1024 -thread_warp_size=32", "conv2d_nchw.cuda", [["TENSOR", [1, 3, 224, 224], "float32"], ["TENSOR", [768, 3, 16, 16], "float32"], [16, 16], [0, 0, 0, 0], [1, 1], "float32"], {}], "config": {"index": 34687010, "code_hash": null, "entity": [["tile_f", "sp", [-1, 16, 4, 1]], ["tile_y", "sp", [-1, 1, 1, 7]], ["tile_x", "sp", [-1, 1, 2, 1]], ["tile_rc", "sp", [-1, 3]], ["tile_ry", "sp", [-1, 4]], ["tile_rx", "sp", [-1, 1]], ["auto_unroll_max_step", "ot", 512], ["unroll_explicit", "ot", 1]]}, "result": [[0.00589347534117647], 0, 3.2676379680633545, 1711981189.7257288], "version": 0.2, "tvm_version": "0.14.dev0"}
{"input": ["cuda -keys=cuda,gpu -arch=sm_70 -max_num_threads=1024 -thread_warp_size=32", "conv2d_nchw.cuda", [["TENSOR", [1, 3, 224, 224], "float32"], ["TENSOR", [768, 3, 16, 16], "float32"], [16, 16], [0, 0, 0, 0], [1, 1], "float32"], {}], "config": {"index": 28808540, "code_hash": null, "entity": [["tile_f", "sp", [-1, 24, 8, 2]], ["tile_y", "sp", [-1, 2, 1, 1]], ["tile_x", "sp", [-1, 1, 14, 1]], ["tile_rc", "sp", [-1, 1]], ["tile_ry", "sp", [-1, 1]], ["tile_rx", "sp", [-1, 4]], ["auto_unroll_max_step", "ot", 0], ["unroll_explicit", "ot", 1]]}, "result": [[0.0016396892606557378], 0, 2.7179489135742188, 1711981191.1342378], "version": 0.2, "tvm_version": "0.14.dev0"}
{"input": ["cuda -keys=cuda,gpu -arch=sm_70 -max_num_threads=1024 -thread_warp_size=32", "conv2d_nchw.cuda", [["TENSOR", [1, 3, 224, 224], "float32"], ["TENSOR", [768, 3, 16, 16], "float32"], [16, 16], [0, 0, 0, 0], [1, 1], "float32"], {}], "config": {"index": 11978120, "code_hash": null, "entity": [["tile_f", "sp", [-1, 6, 4, 8]], ["tile_y", "sp", [-1, 1, 2, 1]], ["tile_x", "sp", [-1, 1, 2, 7]], ["tile_rc", "sp", [-1, 1]], ["tile_ry", "sp", [-1, 1]], ["tile_rx", "sp", [-1, 4]], ["auto_unroll_max_step", "ot", 512], ["unroll_explicit", "ot", 0]]}, "result": [[0.004484688385650224], 0, 5.997656583786011, 1711981192.5315151], "version": 0.2, "tvm_version": "0.14.dev0"}
{"input": ["cuda -keys=cuda,gpu -arch=sm_70 -max_num_threads=1024 -thread_warp_size=32", "conv2d_nchw.cuda", [["TENSOR", [1, 3, 224, 224], "float32"], ["TENSOR", [768, 3, 16, 16], "float32"], [16, 16], [0, 0, 0, 0], [1, 1], "float32"], {}], "config": {"index": 34491957, "code_hash": null, "entity": [["tile_f", "sp", [-1, 2, 24, 4]], ["tile_y", "sp", [-1, 1, 2, 1]], ["tile_x", "sp", [-1, 7, 1, 1]], ["tile_rc", "sp", [-1, 1]], ["tile_ry", "sp", [-1, 4]], ["tile_rx", "sp", [-1, 1]], ["auto_unroll_max_step", "ot", 512], ["unroll_explicit", "ot", 1]]}, "result": [[0.00036514592212189614], 0, 4.4200663566589355, 1711981195.5059717], "version": 0.2, "tvm_version": "0.14.dev0"}
{"input": ["cuda -keys=cuda,gpu -arch=sm_70 -max_num_threads=1024 -thread_warp_size=32", "conv2d_nchw.cuda", [["TENSOR", [1, 3, 224, 224], "float32"], ["TENSOR", [768, 3, 16, 16], "float32"], [16, 16], [0, 0, 0, 0], [1, 1], "float32"], {}], "config": {"index": 48726818, "code_hash": null, "entity": [["tile_f", "sp", [-1, 2, 8, 4]], ["tile_y", "sp", [-1, 1, 2, 1]], ["tile_x", "sp", [-1, 1, 7, 1]], ["tile_rc", "sp", [-1, 1]], ["tile_ry", "sp", [-1, 16]], ["tile_rx", "sp", [-1, 8]], ["auto_unroll_max_step", "ot", 1500], ["unroll_explicit", "ot", 1]]}, "result": [[0.00018190355428874454], 0, 8.423699378967285, 1711981272.120127], "version": 0.2, "tvm_version": "0.14.dev0"}
{"input": ["cuda -keys=cuda,gpu -arch=sm_70 -max_num_threads=1024 -thread_warp_size=32", "conv2d_nchw.cuda", [["TENSOR", [1, 3, 224, 224], "float32"], ["TENSOR", [768, 3, 16, 16], "float32"], [16, 16], [0, 0, 0, 0], [1, 1], "float32"], {}], "config": {"index": 22706978, "code_hash": null, "entity": [["tile_f", "sp", [-1, 2, 8, 4]], ["tile_y", "sp", [-1, 1, 2, 1]], ["tile_x", "sp", [-1, 1, 7, 1]], ["tile_rc", "sp", [-1, 1]], ["tile_ry", "sp", [-1, 4]], ["tile_rx", "sp", [-1, 8]], ["auto_unroll_max_step", "ot", 1500], ["unroll_explicit", "ot", 0]]}, "result": [[0.00018098334747951048], 0, 4.555998086929321, 1711981275.082728], "version": 0.2, "tvm_version": "0.14.dev0"}
{"input": ["cuda -keys=cuda,gpu -arch=sm_70 -max_num_threads=1024 -thread_warp_size=32", "conv2d_nchw.cuda", [["TENSOR", [1, 3, 224, 224], "float32"], ["TENSOR", [768, 3, 16, 16], "float32"], [16, 16], [0, 0, 0, 0], [1, 1], "float32"], {}], "config": {"index": 48050978, "code_hash": null, "entity": [["tile_f", "sp", [-1, 2, 8, 4]], ["tile_y", "sp", [-1, 1, 2, 1]], ["tile_x", "sp", [-1, 1, 7, 1]], ["tile_rc", "sp", [-1, 1]], ["tile_ry", "sp", [-1, 4]], ["tile_rx", "sp", [-1, 8]], ["auto_unroll_max_step", "ot", 1500], ["unroll_explicit", "ot", 1]]}, "result": [[0.00017517217104691572], 0, 5.133791923522949, 1711981278.0398602], "version": 0.2, "tvm_version": "0.14.dev0"}
{"input": ["cuda -keys=cuda,gpu -arch=sm_70 -max_num_threads=1024 -thread_warp_size=32", "conv2d_nchw.cuda", [["TENSOR", [1, 3, 224, 224], "float32"], ["TENSOR", [768, 3, 16, 16], "float32"], [16, 16], [0, 0, 0, 0], [1, 1], "float32"], {}], "config": {"index": 5810978, "code_hash": null, "entity": [["tile_f", "sp", [-1, 2, 8, 4]], ["tile_y", "sp", [-1, 1, 2, 1]], ["tile_x", "sp", [-1, 1, 7, 1]], ["tile_rc", "sp", [-1, 1]], ["tile_ry", "sp", [-1, 4]], ["tile_rx", "sp", [-1, 8]], ["auto_unroll_max_step", "ot", 0], ["unroll_explicit", "ot", 0]]}, "result": [[0.00029533021901279705], 0, 3.438339948654175, 1711981281.0573328], "version": 0.2, "tvm_version": "0.14.dev0"}
{"input": ["cuda -keys=cuda,gpu -arch=sm_70 -max_num_threads=1024 -thread_warp_size=32", "conv2d_nchw.cuda", [["TENSOR", [1, 3, 224, 224], "float32"], ["TENSOR", [768, 3, 16, 16], "float32"], [16, 16], [0, 0, 0, 0], [1, 1], "float32"], {}], "config": {"index": 4530310, "code_hash": null, "entity": [["tile_f", "sp", [-1, 8, 8, 1]], ["tile_y", "sp", [-1, 1, 1, 1]], ["tile_x", "sp", [-1, 2, 1, 7]], ["tile_rc", "sp", [-1, 1]], ["tile_ry", "sp", [-1, 8]], ["tile_rx", "sp", [-1, 4]], ["auto_unroll_max_step", "ot", 0], ["unroll_explicit", "ot", 0]]}, "result": [[0.0004289484744099708], 0, 3.4451496601104736, 1711981284.0304065], "version": 0.2, "tvm_version": "0.14.dev0"}
{"input": ["cuda -keys=cuda,gpu -arch=sm_70 -max_num_threads=1024 -thread_warp_size=32", "conv2d_nchw.cuda", [["TENSOR", [1, 3, 224, 224], "float32"], ["TENSOR", [768, 3, 16, 16], "float32"], [16, 16], [0, 0, 0, 0], [1, 1], "float32"], {}], "config": {"index": 4889350, "code_hash": null, "entity": [["tile_f", "sp", [-1, 8, 8, 1]], ["tile_y", "sp", [-1, 1, 1, 1]], ["tile_x", "sp", [-1, 1, 1, 14]], ["tile_rc", "sp", [-1, 1]], ["tile_ry", "sp", [-1, 16]], ["tile_rx", "sp", [-1, 4]], ["auto_unroll_max_step", "ot", 0], ["unroll_explicit", "ot", 0]]}, "result": [[0.00042979156522896704], 0, 3.4598140716552734, 1711981287.0059896], "version": 0.2, "tvm_version": "0.14.dev0"}
{"input": ["cuda -keys=cuda,gpu -arch=sm_70 -max_num_threads=1024 -thread_warp_size=32", "conv2d_nchw.cuda", [["TENSOR", [1, 3, 224, 224], "float32"], ["TENSOR", [768, 3, 16, 16], "float32"], [16, 16], [0, 0, 0, 0], [1, 1], "float32"], {}], "config": {"index": 4551430, "code_hash": null, "entity": [["tile_f", "sp", [-1, 8, 8, 1]], ["tile_y", "sp", [-1, 1, 1, 1]], ["tile_x", "sp", [-1, 1, 1, 14]], ["tile_rc", "sp", [-1, 1]], ["tile_ry", "sp", [-1, 8]], ["tile_rx", "sp", [-1, 4]], ["auto_unroll_max_step", "ot", 0], ["unroll_explicit", "ot", 0]]}, "result": [[0.00042831988553259146], 0, 3.4798262119293213, 1711981290.0167956], "version": 0.2, "tvm_version": "0.14.dev0"}
{"input": ["cuda -keys=cuda,gpu -arch=sm_70 -max_num_threads=1024 -thread_warp_size=32", "conv2d_nchw.cuda", [["TENSOR", [1, 3, 224, 224], "float32"], ["TENSOR", [768, 3, 16, 16], "float32"], [16, 16], [0, 0, 0, 0], [1, 1], "float32"], {}], "config": {"index": 5987913, "code_hash": null, "entity": [["tile_f", "sp", [-1, 1, 8, 6]], ["tile_y", "sp", [-1, 1, 1, 1]], ["tile_x", "sp", [-1, 2, 7, 1]], ["tile_rc", "sp", [-1, 3]], ["tile_ry", "sp", [-1, 4]], ["tile_rx", "sp", [-1, 8]], ["auto_unroll_max_step", "ot", 0], ["unroll_explicit", "ot", 0]]}, "result": [[0.0001887129693746347], 0, 3.4421238899230957, 1711981292.975072], "version": 0.2, "tvm_version": "0.14.dev0"}
{"input": ["cuda -keys=cuda,gpu -arch=sm_70 -max_num_threads=1024 -thread_warp_size=32", "conv2d_nchw.cuda", [["TENSOR", [1, 3, 224, 224], "float32"], ["TENSOR", [768, 3, 16, 16], "float32"], [16, 16], [0, 0, 0, 0], [1, 1], "float32"], {}], "config": {"index": 5874338, "code_hash": null, "entity": [["tile_f", "sp", [-1, 2, 8, 4]], ["tile_y", "sp", [-1, 1, 2, 1]], ["tile_x", "sp", [-1, 1, 1, 7]], ["tile_rc", "sp", [-1, 1]], ["tile_ry", "sp", [-1, 4]], ["tile_rx", "sp", [-1, 8]], ["auto_unroll_max_step", "ot", 0], ["unroll_explicit", "ot", 0]]}, "result": [[0.00027877825508796137], 0, 3.392862319946289, 1711981295.9427397], "version": 0.2, "tvm_version": "0.14.dev0"}
{"input": ["cuda -keys=cuda,gpu -arch=sm_70 -max_num_threads=1024 -thread_warp_size=32", "conv2d_nchw.cuda", [["TENSOR", [1, 3, 224, 224], "float32"], ["TENSOR", [768, 3, 16, 16], "float32"], [16, 16], [0, 0, 0, 0], [1, 1], "float32"], {}], "config": {"index": 4858368, "code_hash": null, "entity": [["tile_f", "sp", [-1, 1, 48, 1]], ["tile_y", "sp", [-1, 2, 1, 1]], ["tile_x", "sp", [-1, 1, 1, 7]], ["tile_rc", "sp", [-1, 1]], ["tile_ry", "sp", [-1, 16]], ["tile_rx", "sp", [-1, 4]], ["auto_unroll_max_step", "ot", 0], ["unroll_explicit", "ot", 0]]}, "result": [[0.0002217199698009609], 0, 3.451920509338379, 1711981298.9574776], "version": 0.2, "tvm_version": "0.14.dev0"}
{"input": ["cuda -keys=cuda,gpu -arch=sm_70 -max_num_threads=1024 -thread_warp_size=32", "conv2d_nchw.cuda", [["TENSOR", [1, 3, 224, 224], "float32"], ["TENSOR", [768, 3, 16, 16], "float32"], [16, 16], [0, 0, 0, 0], [1, 1], "float32"], {}], "config": {"index": 7493189, "code_hash": null, "entity": [["tile_f", "sp", [-1, 2, 16, 2]], ["tile_y", "sp", [-1, 1, 1, 2]], ["tile_x", "sp", [-1, 7, 2, 1]], ["tile_rc", "sp", [-1, 1]], ["tile_ry", "sp", [-1, 4]], ["tile_rx", "sp", [-1, 16]], ["auto_unroll_max_step", "ot", 0], ["unroll_explicit", "ot", 0]]}, "result": [[0.0002377093702666863], 0, 3.5097100734710693, 1711981301.919212], "version": 0.2, "tvm_version": "0.14.dev0"}
{"input": ["cuda -keys=cuda,gpu -arch=sm_70 -max_num_threads=1024 -thread_warp_size=32", "conv2d_nchw.cuda", [["TENSOR", [1, 3, 224, 224], "float32"], ["TENSOR", [768, 3, 16, 16], "float32"], [16, 16], [0, 0, 0, 0], [1, 1], "float32"], {}], "config": {"index": 12704018, "code_hash": null, "entity": [["tile_f", "sp", [-1, 2, 8, 4]], ["tile_y", "sp", [-1, 1, 1, 1]], ["tile_x", "sp", [-1, 14, 1, 1]], ["tile_rc", "sp", [-1, 3]], ["tile_ry", "sp", [-1, 4]], ["tile_rx", "sp", [-1, 4]], ["auto_unroll_max_step", "ot", 512], ["unroll_explicit", "ot", 0]]}, "result": [[0.0007200571248785229], 0, 7.440062046051025, 1711981304.680541], "version": 0.2, "tvm_version": "0.14.dev0"}
{"input": ["cuda -keys=cuda,gpu -arch=sm_70 -max_num_threads=1024 -thread_warp_size=32", "conv2d_nchw.cuda", [["TENSOR", [1, 3, 224, 224], "float32"], ["TENSOR", [768, 3, 16, 16], "float32"], [16, 16], [0, 0, 0, 0], [1, 1], "float32"], {}], "config": {"index": 6473553, "code_hash": null, "entity": [["tile_f", "sp", [-1, 1, 16, 3]], ["tile_y", "sp", [-1, 1, 1, 1]], ["tile_x", "sp", [-1, 7, 2, 1]], ["tile_rc", "sp", [-1, 1]], ["tile_ry", "sp", [-1, 16]], ["tile_rx", "sp", [-1, 8]], ["auto_unroll_max_step", "ot", 0], ["unroll_explicit", "ot", 0]]}, "result": [[0.00020070425506777762], 0, 3.382150173187256, 1711981307.6859207], "version": 0.2, "tvm_version": "0.14.dev0"}
{"input": ["cuda -keys=cuda,gpu -arch=sm_70 -max_num_threads=1024 -thread_warp_size=32", "conv2d_nchw.cuda", [["TENSOR", [1, 3, 224, 224], "float32"], ["TENSOR", [768, 3, 16, 16], "float32"], [16, 16], [0, 0, 0, 0], [1, 1], "float32"], {}], "config": {"index": 7472133, "code_hash": null, "entity": [["tile_f", "sp", [-1, 1, 16, 3]], ["tile_y", "sp", [-1, 1, 1, 2]], ["tile_x", "sp", [-1, 14, 1, 1]], ["tile_rc", "sp", [-1, 1]], ["tile_ry", "sp", [-1, 4]], ["tile_rx", "sp", [-1, 16]], ["auto_unroll_max_step", "ot", 0], ["unroll_explicit", "ot", 0]]}, "result": [[0.00028566395544554453], 0, 3.5534636974334717, 1711981310.6509395], "version": 0.2, "tvm_version": "0.14.dev0"}
{"input": ["cuda -keys=cuda,gpu -arch=sm_70 -max_num_threads=1024 -thread_warp_size=32", "conv2d_nchw.cuda", [["TENSOR", [1, 3, 224, 224], "float32"], ["TENSOR", [768, 3, 16, 16], "float32"], [16, 16], [0, 0, 0, 0], [1, 1], "float32"], {}], "config": {"index": 13337350, "code_hash": null, "entity": [["tile_f", "sp", [-1, 8, 8, 1]], ["tile_y", "sp", [-1, 1, 1, 1]], ["tile_x", "sp", [-1, 1, 1, 14]], ["tile_rc", "sp", [-1, 1]], ["tile_ry", "sp", [-1, 16]], ["tile_rx", "sp", [-1, 4]], ["auto_unroll_max_step", "ot", 512], ["unroll_explicit", "ot", 0]]}, "result": [[0.00033047235718997357], 0, 4.7434539794921875, 1711981312.0059354], "version": 0.2, "tvm_version": "0.14.dev0"}
{"input": ["cuda -keys=cuda,gpu -arch=sm_70 -max_num_threads=1024 -thread_warp_size=32", "conv2d_nchw.cuda", [["TENSOR", [1, 3, 224, 224], "float32"], ["TENSOR", [768, 3, 16, 16], "float32"], [16, 16], [0, 0, 0, 0], [1, 1], "float32"], {}], "config": {"index": 7514373, "code_hash": null, "entity": [["tile_f", "sp", [-1, 1, 16, 3]], ["tile_y", "sp", [-1, 1, 1, 2]], ["tile_x", "sp", [-1, 2, 7, 1]], ["tile_rc", "sp", [-1, 1]], ["tile_ry", "sp", [-1, 4]], ["tile_rx", "sp", [-1, 16]], ["auto_unroll_max_step", "ot", 0], ["unroll_explicit", "ot", 0]]}, "result": [[0.00015155585722358259], 0, 3.4037022590637207, 1711981315.0081449], "version": 0.2, "tvm_version": "0.14.dev0"}
{"input": ["cuda -keys=cuda,gpu -arch=sm_70 -max_num_threads=1024 -thread_warp_size=32", "conv2d_nchw.cuda", [["TENSOR", [1, 3, 224, 224], "float32"], ["TENSOR", [768, 3, 16, 16], "float32"], [16, 16], [0, 0, 0, 0], [1, 1], "float32"], {}], "config": {"index": 14219909, "code_hash": null, "entity": [["tile_f", "sp", [-1, 2, 16, 2]], ["tile_y", "sp", [-1, 1, 1, 2]], ["tile_x", "sp", [-1, 7, 1, 1]], ["tile_rc", "sp", [-1, 1]], ["tile_ry", "sp", [-1, 4]], ["tile_rx", "sp", [-1, 8]], ["auto_unroll_max_step", "ot", 512], ["unroll_explicit", "ot", 0]]}, "result": [[0.00036192595228494624], 0, 4.721950054168701, 1711981317.97855], "version": 0.2, "tvm_version": "0.14.dev0"}
{"input": ["cuda -keys=cuda,gpu -arch=sm_70 -max_num_threads=1024 -thread_warp_size=32", "dense_small_batch.gpu", [["TENSOR", [197, 768], "float32"], ["TENSOR", [768, 768], "float32"], null, "float32"], {}], "config": {"index": 0, "code_hash": null, "entity": [["tile_k", "sp", [-1, 1]]]}, "result": [[0.0030839176160714285], 0, 2.8622846603393555, 1711981327.6354132], "version": 0.2, "tvm_version": "0.14.dev0"}
{"input": ["cuda -keys=cuda,gpu -arch=sm_70 -max_num_threads=1024 -thread_warp_size=32", "dense_small_batch.gpu", [["TENSOR", [197, 768], "float32"], ["TENSOR", [768, 768], "float32"], null, "float32"], {}], "config": {"index": 8, "code_hash": null, "entity": [["tile_k", "sp", [-1, 24]]]}, "result": [[0.00021815311450588075], 0, 3.2926905155181885, 1711981330.6438794], "version": 0.2, "tvm_version": "0.14.dev0"}
{"input": ["cuda -keys=cuda,gpu -arch=sm_70 -max_num_threads=1024 -thread_warp_size=32", "dense_small_batch.gpu", [["TENSOR", [197, 768], "float32"], ["TENSOR", [768, 768], "float32"], null, "float32"], {}], "config": {"index": 6, "code_hash": null, "entity": [["tile_k", "sp", [-1, 12]]]}, "result": [[0.00028279932597266035], 0, 3.2498435974121094, 1711981333.611933], "version": 0.2, "tvm_version": "0.14.dev0"}
{"input": ["cuda -keys=cuda,gpu -arch=sm_70 -max_num_threads=1024 -thread_warp_size=32", "dense_small_batch.gpu", [["TENSOR", [197, 768], "float32"], ["TENSOR", [768, 768], "float32"], null, "float32"], {}], "config": {"index": 5, "code_hash": null, "entity": [["tile_k", "sp", [-1, 8]]]}, "result": [[0.00039180545705967977], 0, 3.252293348312378, 1711981336.5862615], "version": 0.2, "tvm_version": "0.14.dev0"}
{"input": ["cuda -keys=cuda,gpu -arch=sm_70 -max_num_threads=1024 -thread_warp_size=32", "dense_small_batch.gpu", [["TENSOR", [197, 768], "float32"], ["TENSOR", [768, 768], "float32"], null, "float32"], {}], "config": {"index": 17, "code_hash": null, "entity": [["tile_k", "sp", [-1, 768]]]}, "result": [[0.001234451503053435], 0, 3.293621301651001, 1711981339.6166427], "version": 0.2, "tvm_version": "0.14.dev0"}
{"input": ["cuda -keys=cuda,gpu -arch=sm_70 -max_num_threads=1024 -thread_warp_size=32", "dense_small_batch.gpu", [["TENSOR", [197, 768], "float32"], ["TENSOR", [768, 768], "float32"], null, "float32"], {}], "config": {"index": 2, "code_hash": null, "entity": [["tile_k", "sp", [-1, 3]]]}, "result": [[0.0010317973299298023], 0, 3.25899338722229, 1711981342.5996761], "version": 0.2, "tvm_version": "0.14.dev0"}
{"input": ["cuda -keys=cuda,gpu -arch=sm_70 -max_num_threads=1024 -thread_warp_size=32", "dense_small_batch.gpu", [["TENSOR", [197, 768], "float32"], ["TENSOR", [768, 768], "float32"], null, "float32"], {}], "config": {"index": 3, "code_hash": null, "entity": [["tile_k", "sp", [-1, 4]]]}, "result": [[0.0007754518647482015], 0, 3.247551679611206, 1711981345.5779855], "version": 0.2, "tvm_version": "0.14.dev0"}
{"input": ["cuda -keys=cuda,gpu -arch=sm_70 -max_num_threads=1024 -thread_warp_size=32", "dense_small_batch.gpu", [["TENSOR", [197, 768], "float32"], ["TENSOR", [768, 768], "float32"], null, "float32"], {}], "config": {"index": 15, "code_hash": null, "entity": [["tile_k", "sp", [-1, 256]]]}, "result": [[0.0003396593993690852], 0, 3.281935930252075, 1711981348.5925813], "version": 0.2, "tvm_version": "0.14.dev0"}
{"input": ["cuda -keys=cuda,gpu -arch=sm_70 -max_num_threads=1024 -thread_warp_size=32", "dense_small_batch.gpu", [["TENSOR", [197, 768], "float32"], ["TENSOR", [768, 768], "float32"], null, "float32"], {}], "config": {"index": 12, "code_hash": null, "entity": [["tile_k", "sp", [-1, 96]]]}, "result": [[0.00021690189581933056], 0, 3.228012800216675, 1711981351.5594194], "version": 0.2, "tvm_version": "0.14.dev0"}
{"input": ["cuda -keys=cuda,gpu -arch=sm_70 -max_num_threads=1024 -thread_warp_size=32", "dense_small_batch.gpu", [["TENSOR", [197, 768], "float32"], ["TENSOR", [768, 768], "float32"], null, "float32"], {}], "config": {"index": 10, "code_hash": null, "entity": [["tile_k", "sp", [-1, 48]]]}, "result": [[0.0002180450055427876], 0, 3.2312052249908447, 1711981354.5264196], "version": 0.2, "tvm_version": "0.14.dev0"}
{"input": ["cuda -keys=cuda,gpu -arch=sm_70 -max_num_threads=1024 -thread_warp_size=32", "dense_small_batch.gpu", [["TENSOR", [197, 768], "float32"], ["TENSOR", [768, 768], "float32"], null, "float32"], {}], "config": {"index": 4, "code_hash": null, "entity": [["tile_k", "sp", [-1, 6]]]}, "result": [[0.0005208305109677419], 0, 3.315932035446167, 1711981357.5676603], "version": 0.2, "tvm_version": "0.14.dev0"}
{"input": ["cuda -keys=cuda,gpu -arch=sm_70 -max_num_threads=1024 -thread_warp_size=32", "dense_small_batch.gpu", [["TENSOR", [197, 768], "float32"], ["TENSOR", [768, 768], "float32"], null, "float32"], {}], "config": {"index": 9, "code_hash": null, "entity": [["tile_k", "sp", [-1, 32]]]}, "result": [[0.00021689313905325444], 0, 3.246201753616333, 1711981360.5382988], "version": 0.2, "tvm_version": "0.14.dev0"}
{"input": ["cuda -keys=cuda,gpu -arch=sm_70 -max_num_threads=1024 -thread_warp_size=32", "dense_small_batch.gpu", [["TENSOR", [197, 768], "float32"], ["TENSOR", [768, 768], "float32"], null, "float32"], {}], "config": {"index": 14, "code_hash": null, "entity": [["tile_k", "sp", [-1, 192]]]}, "result": [[0.000281678141460007], 0, 3.216980218887329, 1711981363.4989302], "version": 0.2, "tvm_version": "0.14.dev0"}
{"input": ["cuda -keys=cuda,gpu -arch=sm_70 -max_num_threads=1024 -thread_warp_size=32", "dense_small_batch.gpu", [["TENSOR", [197, 768], "float32"], ["TENSOR", [768, 768], "float32"], null, "float32"], {}], "config": {"index": 1, "code_hash": null, "entity": [["tile_k", "sp", [-1, 2]]]}, "result": [[0.0015488937823585809], 0, 3.2981245517730713, 1711981366.5297542], "version": 0.2, "tvm_version": "0.14.dev0"}
{"input": ["cuda -keys=cuda,gpu -arch=sm_70 -max_num_threads=1024 -thread_warp_size=32", "dense_small_batch.gpu", [["TENSOR", [197, 768], "float32"], ["TENSOR", [768, 768], "float32"], null, "float32"], {}], "config": {"index": 11, "code_hash": null, "entity": [["tile_k", "sp", [-1, 64]]]}, "result": [[0.00021715030205949658], 0, 3.2189366817474365, 1711981369.4946413], "version": 0.2, "tvm_version": "0.14.dev0"}
{"input": ["cuda -keys=cuda,gpu -arch=sm_70 -max_num_threads=1024 -thread_warp_size=32", "dense_small_batch.gpu", [["TENSOR", [197, 768], "float32"], ["TENSOR", [768, 768], "float32"], null, "float32"], {}], "config": {"index": 7, "code_hash": null, "entity": [["tile_k", "sp", [-1, 16]]]}, "result": [[0.00023990369451464252], 0, 3.270292043685913, 1711981372.4609625], "version": 0.2, "tvm_version": "0.14.dev0"}
{"input": ["cuda -keys=cuda,gpu -arch=sm_70 -max_num_threads=1024 -thread_warp_size=32", "dense_small_batch.gpu", [["TENSOR", [197, 768], "float32"], ["TENSOR", [768, 768], "float32"], null, "float32"], {}], "config": {"index": 16, "code_hash": null, "entity": [["tile_k", "sp", [-1, 384]]]}, "result": [[0.0004967322456194282], 0, 3.2756879329681396, 1711981375.4768405], "version": 0.2, "tvm_version": "0.14.dev0"}
{"input": ["cuda -keys=cuda,gpu -arch=sm_70 -max_num_threads=1024 -thread_warp_size=32", "dense_small_batch.gpu", [["TENSOR", [197, 768], "float32"], ["TENSOR", [768, 768], "float32"], null, "float32"], {}], "config": {"index": 13, "code_hash": null, "entity": [["tile_k", "sp", [-1, 128]]]}, "result": [[0.0002194982263021896], 0, 3.237276792526245, 1711981378.443548], "version": 0.2, "tvm_version": "0.14.dev0"}
{"input": ["cuda -keys=cuda,gpu -arch=sm_70 -max_num_threads=1024 -thread_warp_size=32", "dense_large_batch.gpu", [["TENSOR", [197, 768], "float32"], ["TENSOR", [768, 768], "float32"], null, "float32"], {}], "config": {"index": 2020, "code_hash": null, "entity": [["tile_x", "sp", [-1, 1, 1, 1]], ["tile_y", "sp", [-1, 12, 1, 16]], ["tile_k", "sp", [-1, 1, 1]]]}, "result": [[0.0036233477467362924], 0, 3.4264414310455322, 1711981392.2349105], "version": 0.2, "tvm_version": "0.14.dev0"}
{"input": ["cuda -keys=cuda,gpu -arch=sm_70 -max_num_threads=1024 -thread_warp_size=32", "dense_large_batch.gpu", [["TENSOR", [197, 768], "float32"], ["TENSOR", [768, 768], "float32"], null, "float32"], {}], "config": {"index": 6780, "code_hash": null, "entity": [["tile_x", "sp", [-1, 1, 1, 1]], ["tile_y", "sp", [-1, 8, 1, 6]], ["tile_k", "sp", [-1, 3, 1]]]}, "result": [[0.002496220842892768], 0, 1.9237122535705566, 1711981411.882638], "version": 0.2, "tvm_version": "0.14.dev0"}
{"input": ["cuda -keys=cuda,gpu -arch=sm_70 -max_num_threads=1024 -thread_warp_size=32", "dense_large_batch.gpu", [["TENSOR", [197, 768], "float32"], ["TENSOR", [768, 768], "float32"], null, "float32"], {}], "config": {"index": 3228, "code_hash": null, "entity": [["tile_x", "sp", [-1, 1, 1, 1]], ["tile_y", "sp", [-1, 96, 1, 2]], ["tile_k", "sp", [-1, 2, 1]]]}, "result": [[0.0038181328368794326], 0, 4.330929517745972, 1711981414.933182], "version": 0.2, "tvm_version": "0.14.dev0"}
{"input": ["cuda -keys=cuda,gpu -arch=sm_70 -max_num_threads=1024 -thread_warp_size=32", "dense_large_batch.gpu", [["TENSOR", [197, 768], "float32"], ["TENSOR", [768, 768], "float32"], null, "float32"], {}], "config": {"index": 5868, "code_hash": null, "entity": [["tile_x", "sp", [-1, 1, 1, 1]], ["tile_y", "sp", [-1, 96, 1, 2]], ["tile_k", "sp", [-1, 3, 1]]]}, "result": [[0.02318005509090909], 0, 3.928159713745117, 1711981416.5926714], "version": 0.2, "tvm_version": "0.14.dev0"}
{"input": ["cuda -keys=cuda,gpu -arch=sm_70 -max_num_threads=1024 -thread_warp_size=32", "batch_matmul.cuda", [["TENSOR", [12, 197, 64], "float32"], ["TENSOR", [12, 197, 64], "float32"], [12, 197, 197], "float32", 0, 1], {}], "config": {"index": 64, "code_hash": null, "entity": [["tile_y", "sp", [-1, 197, 1]], ["tile_x", "sp", [-1, 1, 1]], ["tile_k", "sp", [-1, 1]], ["auto_unroll_max_step", "ot", 16], ["unroll_explicit", "ot", 0]]}, "result": [[0.0003480694932523616], 0, 1.9018230438232422, 1711981431.1056306], "version": 0.2, "tvm_version": "0.14.dev0"}
{"input": ["cuda -keys=cuda,gpu -arch=sm_70 -max_num_threads=1024 -thread_warp_size=32", "batch_matmul.cuda", [["TENSOR", [12, 197, 64], "float32"], ["TENSOR", [12, 197, 64], "float32"], [12, 197, 197], "float32", 0, 1], {}], "config": {"index": 95, "code_hash": null, "entity": [["tile_y", "sp", [-1, 1, 197]], ["tile_x", "sp", [-1, 197, 1]], ["tile_k", "sp", [-1, 8]], ["auto_unroll_max_step", "ot", 16], ["unroll_explicit", "ot", 0]]}, "result": [[0.0005778679657064472], 0, 3.8959522247314453, 1711981433.5669053], "version": 0.2, "tvm_version": "0.14.dev0"}
{"input": ["cuda -keys=cuda,gpu -arch=sm_70 -max_num_threads=1024 -thread_warp_size=32", "batch_matmul.cuda", [["TENSOR", [12, 197, 64], "float32"], ["TENSOR", [12, 197, 64], "float32"], [12, 197, 197], "float32", 0, 1], {}], "config": {"index": 460, "code_hash": null, "entity": [["tile_y", "sp", [-1, 197, 1]], ["tile_x", "sp", [-1, 1, 1]], ["tile_k", "sp", [-1, 4]], ["auto_unroll_max_step", "ot", 64], ["unroll_explicit", "ot", 1]]}, "result": [[0.0003037918050018804], 0, 3.44472336769104, 1711981436.5357907], "version": 0.2, "tvm_version": "0.14.dev0"}
{"input": ["cuda -keys=cuda,gpu -arch=sm_70 -max_num_threads=1024 -thread_warp_size=32", "batch_matmul.cuda", [["TENSOR", [12, 197, 64], "float32"], ["TENSOR", [12, 197, 64], "float32"], [12, 197, 197], "float32", 0, 1], {}], "config": {"index": 295, "code_hash": null, "entity": [["tile_y", "sp", [-1, 197, 1]], ["tile_x", "sp", [-1, 1, 197]], ["tile_k", "sp", [-1, 16]], ["auto_unroll_max_step", "ot", 8], ["unroll_explicit", "ot", 1]]}, "result": [[0.00016449216496424923], 0, 8.69076418876648, 1711981439.509262], "version": 0.2, "tvm_version": "0.14.dev0"}
{"input": ["cuda -keys=cuda,gpu -arch=sm_70 -max_num_threads=1024 -thread_warp_size=32", "batch_matmul.cuda", [["TENSOR", [12, 197, 64], "float32"], ["TENSOR", [12, 197, 64], "float32"], [12, 197, 197], "float32", 0, 1], {}], "config": {"index": 388, "code_hash": null, "entity": [["tile_y", "sp", [-1, 197, 1]], ["tile_x", "sp", [-1, 1, 1]], ["tile_k", "sp", [-1, 2]], ["auto_unroll_max_step", "ot", 32], ["unroll_explicit", "ot", 1]]}, "result": [[0.00031522645194754356], 0, 3.631725549697876, 1711981442.512761], "version": 0.2, "tvm_version": "0.14.dev0"}
{"input": ["cuda -keys=cuda,gpu -arch=sm_70 -max_num_threads=1024 -thread_warp_size=32", "batch_matmul.cuda", [["TENSOR", [12, 197, 64], "float32"], ["TENSOR", [12, 197, 64], "float32"], [12, 197, 197], "float32", 0, 1], {}], "config": {"index": 464, "code_hash": null, "entity": [["tile_y", "sp", [-1, 1, 197]], ["tile_x", "sp", [-1, 197, 1]], ["tile_k", "sp", [-1, 4]], ["auto_unroll_max_step", "ot", 64], ["unroll_explicit", "ot", 1]]}, "result": [[0.0007979615621890548], 0, 3.5620460510253906, 1711981444.9463842], "version": 0.2, "tvm_version": "0.14.dev0"}
{"input": ["cuda -keys=cuda,gpu -arch=sm_70 -max_num_threads=1024 -thread_warp_size=32", "batch_matmul.cuda", [["TENSOR", [12, 197, 64], "float32"], ["TENSOR", [12, 197, 64], "float32"], [12, 197, 197], "float32", 0, 1], {}], "config": {"index": 127, "code_hash": null, "entity": [["tile_y", "sp", [-1, 197, 1]], ["tile_x", "sp", [-1, 1, 1]], ["tile_k", "sp", [-1, 1]], ["auto_unroll_max_step", "ot", 32], ["unroll_explicit", "ot", 0]]}, "result": [[0.0003366209173942243], 0, 1.8164348602294922, 1711981446.3044047], "version": 0.2, "tvm_version": "0.14.dev0"}
{"input": ["cuda -keys=cuda,gpu -arch=sm_70 -max_num_threads=1024 -thread_warp_size=32", "batch_matmul.cuda", [["TENSOR", [12, 197, 64], "float32"], ["TENSOR", [12, 197, 64], "float32"], [12, 197, 197], "float32", 0, 1], {}], "config": {"index": 30, "code_hash": null, "entity": [["tile_y", "sp", [-1, 1, 1]], ["tile_x", "sp", [-1, 197, 1]], ["tile_k", "sp", [-1, 8]], ["auto_unroll_max_step", "ot", 8], ["unroll_explicit", "ot", 0]]}, "result": [[0.0005968008564678087], 0, 1.9405343532562256, 1711981447.7118082], "version": 0.2, "tvm_version": "0.14.dev0"}
{"input": ["cuda -keys=cuda,gpu -arch=sm_70 -max_num_threads=1024 -thread_warp_size=32", "batch_matmul.cuda", [["TENSOR", [12, 197, 64], "float32"], ["TENSOR", [12, 197, 64], "float32"], [12, 197, 197], "float32", 0, 1], {}], "config": {"index": 352, "code_hash": null, "entity": [["tile_y", "sp", [-1, 197, 1]], ["tile_x", "sp", [-1, 1, 1]], ["tile_k", "sp", [-1, 16]], ["auto_unroll_max_step", "ot", 16], ["unroll_explicit", "ot", 1]]}, "result": [[0.00035263344383860414], 0, 3.542396068572998, 1711981450.6821096], "version": 0.2, "tvm_version": "0.14.dev0"}
{"input": ["cuda -keys=cuda,gpu -arch=sm_70 -max_num_threads=1024 -thread_warp_size=32", "batch_matmul.cuda", [["TENSOR", [12, 197, 64], "float32"], ["TENSOR", [12, 197, 64], "float32"], [12, 197, 197], "float32", 0, 1], {}], "config": {"index": 198, "code_hash": null, "entity": [["tile_y", "sp", [-1, 1, 1]], ["tile_x", "sp", [-1, 1, 1]], ["tile_k", "sp", [-1, 2]], ["auto_unroll_max_step", "ot", 64], ["unroll_explicit", "ot", 0]]}, "result": [[0.002194757561403509], 0, 1.8413097858428955, 1711981452.062154], "version": 0.2, "tvm_version": "0.14.dev0"}
{"input": ["cuda -keys=cuda,gpu -arch=sm_70 -max_num_threads=1024 -thread_warp_size=32", "batch_matmul.cuda", [["TENSOR", [12, 197, 64], "float32"], ["TENSOR", [12, 197, 64], "float32"], [12, 197, 197], "float32", 0, 1], {}], "config": {"index": 335, "code_hash": null, "entity": [["tile_y", "sp", [-1, 1, 197]], ["tile_x", "sp", [-1, 1, 1]], ["tile_k", "sp", [-1, 4]], ["auto_unroll_max_step", "ot", 16], ["unroll_explicit", "ot", 1]]}, "result": [[0.00594281727810651], 0, 2.662668466567993, 1711981453.5316598], "version": 0.2, "tvm_version": "0.14.dev0"}
{"input": ["cuda -keys=cuda,gpu -arch=sm_70 -max_num_threads=1024 -thread_warp_size=32", "batch_matmul.cuda", [["TENSOR", [12, 197, 64], "float32"], ["TENSOR", [12, 197, 64], "float32"], [12, 197, 197], "float32", 0, 1], {}], "config": {"index": 218, "code_hash": null, "entity": [["tile_y", "sp", [-1, 1, 197]], ["tile_x", "sp", [-1, 1, 1]], ["tile_k", "sp", [-1, 8]], ["auto_unroll_max_step", "ot", 64], ["unroll_explicit", "ot", 0]]}, "result": [[0.0045513560819209035], 0, 4.835035562515259, 1711981456.5510404], "version": 0.2, "tvm_version": "0.14.dev0"}
{"input": ["cuda -keys=cuda,gpu -arch=sm_70 -max_num_threads=1024 -thread_warp_size=32", "batch_matmul.cuda", [["TENSOR", [12, 197, 64], "float32"], ["TENSOR", [12, 197, 64], "float32"], [12, 197, 197], "float32", 0, 1], {}], "config": {"index": 11, "code_hash": null, "entity": [["tile_y", "sp", [-1, 1, 197]], ["tile_x", "sp", [-1, 1, 1]], ["tile_k", "sp", [-1, 2]], ["auto_unroll_max_step", "ot", 8], ["unroll_explicit", "ot", 0]]}, "result": [[0.0006576018688925081], 0, 3.8932650089263916, 1711981459.5329652], "version": 0.2, "tvm_version": "0.14.dev0"}
{"input": ["cuda -keys=cuda,gpu -arch=sm_70 -max_num_threads=1024 -thread_warp_size=32", "batch_matmul.cuda", [["TENSOR", [12, 197, 64], "float32"], ["TENSOR", [12, 197, 64], "float32"], [12, 197, 197], "float32", 0, 1], {}], "config": {"index": 479, "code_hash": null, "entity": [["tile_y", "sp", [-1, 1, 197]], ["tile_x", "sp", [-1, 1, 1]], ["tile_k", "sp", [-1, 16]], ["auto_unroll_max_step", "ot", 64], ["unroll_explicit", "ot", 1]]}, "result": [[0.0045266406018099545], 0, 4.197316646575928, 1711981460.9924219], "version": 0.2, "tvm_version": "0.14.dev0"}
{"input": ["cuda -keys=cuda,gpu -arch=sm_70 -max_num_threads=1024 -thread_warp_size=32", "batch_matmul.cuda", [["TENSOR", [12, 197, 64], "float32"], ["TENSOR", [12, 197, 64], "float32"], [12, 197, 197], "float32", 0, 1], {}], "config": {"index": 84, "code_hash": null, "entity": [["tile_y", "sp", [-1, 1, 1]], ["tile_x", "sp", [-1, 197, 1]], ["tile_k", "sp", [-1, 4]], ["auto_unroll_max_step", "ot", 16], ["unroll_explicit", "ot", 0]]}, "result": [[0.0009818085442342892], 0, 3.379448652267456, 1711981463.9501693], "version": 0.2, "tvm_version": "0.14.dev0"}
{"input": ["cuda -keys=cuda,gpu -arch=sm_70 -max_num_threads=1024 -thread_warp_size=32", "batch_matmul.cuda", [["TENSOR", [12, 197, 64], "float32"], ["TENSOR", [12, 197, 64], "float32"], [12, 197, 197], "float32", 0, 1], {}], "config": {"index": 466, "code_hash": null, "entity": [["tile_y", "sp", [-1, 197, 1]], ["tile_x", "sp", [-1, 1, 197]], ["tile_k", "sp", [-1, 4]], ["auto_unroll_max_step", "ot", 64], ["unroll_explicit", "ot", 1]]}, "result": [[0.0001468624199726402], 0, 8.429383516311646, 1711981467.5377326], "version": 0.2, "tvm_version": "0.14.dev0"}
{"input": ["cuda -keys=cuda,gpu -arch=sm_70 -max_num_threads=1024 -thread_warp_size=32", "batch_matmul.cuda", [["TENSOR", [12, 197, 64], "float32"], ["TENSOR", [12, 197, 64], "float32"], [12, 197, 197], "float32", 0, 1], {}], "config": {"index": 473, "code_hash": null, "entity": [["tile_y", "sp", [-1, 1, 197]], ["tile_x", "sp", [-1, 197, 1]], ["tile_k", "sp", [-1, 8]], ["auto_unroll_max_step", "ot", 64], ["unroll_explicit", "ot", 1]]}, "result": [[0.0005777774578971326], 0, 3.809544801712036, 1711981469.9593968], "version": 0.2, "tvm_version": "0.14.dev0"}
{"input": ["cuda -keys=cuda,gpu -arch=sm_70 -max_num_threads=1024 -thread_warp_size=32", "batch_matmul.cuda", [["TENSOR", [12, 197, 64], "float32"], ["TENSOR", [12, 197, 64], "float32"], [12, 197, 197], "float32", 0, 1], {}], "config": {"index": 12, "code_hash": null, "entity": [["tile_y", "sp", [-1, 1, 1]], ["tile_x", "sp", [-1, 197, 1]], ["tile_k", "sp", [-1, 2]], ["auto_unroll_max_step", "ot", 8], ["unroll_explicit", "ot", 0]]}, "result": [[0.0018605549741219965], 0, 1.8769426345825195, 1711981471.339121], "version": 0.2, "tvm_version": "0.14.dev0"}
{"input": ["cuda -keys=cuda,gpu -arch=sm_70 -max_num_threads=1024 -thread_warp_size=32", "batch_matmul.cuda", [["TENSOR", [12, 197, 64], "float32"], ["TENSOR", [12, 197, 64], "float32"], [12, 197, 197], "float32", 0, 1], {}], "config": {"index": 259, "code_hash": null, "entity": [["tile_y", "sp", [-1, 197, 1]], ["tile_x", "sp", [-1, 1, 197]], ["tile_k", "sp", [-1, 1]], ["auto_unroll_max_step", "ot", 8], ["unroll_explicit", "ot", 1]]}, "result": [[0.00011334434614028903], 0, 3.6167078018188477, 1711981474.3328393], "version": 0.2, "tvm_version": "0.14.dev0"}
{"input": ["cuda -keys=cuda,gpu -arch=sm_70 -max_num_threads=1024 -thread_warp_size=32", "batch_matmul.cuda", [["TENSOR", [12, 197, 64], "float32"], ["TENSOR", [12, 197, 64], "float32"], [12, 197, 197], "float32", 0, 1], {}], "config": {"index": 275, "code_hash": null, "entity": [["tile_y", "sp", [-1, 1, 197]], ["tile_x", "sp", [-1, 197, 1]], ["tile_k", "sp", [-1, 4]], ["auto_unroll_max_step", "ot", 8], ["unroll_explicit", "ot", 1]]}, "result": [[0.0007976278426616916], 0, 3.502706527709961, 1711981476.770307], "version": 0.2, "tvm_version": "0.14.dev0"}
{"input": ["cuda -keys=cuda,gpu -arch=sm_70 -max_num_threads=1024 -thread_warp_size=32", "batch_matmul.cuda", [["TENSOR", [12, 197, 64], "float32"], ["TENSOR", [12, 197, 64], "float32"], [12, 197, 197], "float32", 0, 1], {}], "config": {"index": 32, "code_hash": null, "entity": [["tile_y", "sp", [-1, 1, 197]], ["tile_x", "sp", [-1, 197, 1]], ["tile_k", "sp", [-1, 8]], ["auto_unroll_max_step", "ot", 8], ["unroll_explicit", "ot", 0]]}, "result": [[0.0005779482811646952], 0, 3.8132612705230713, 1711981479.1950142], "version": 0.2, "tvm_version": "0.14.dev0"}
{"input": ["cuda -keys=cuda,gpu -arch=sm_70 -max_num_threads=1024 -thread_warp_size=32", "batch_matmul.cuda", [["TENSOR", [12, 197, 64], "float32"], ["TENSOR", [12, 197, 64], "float32"], [12, 197, 197], "float32", 0, 1], {}], "config": {"index": 299, "code_hash": null, "entity": [["tile_y", "sp", [-1, 1, 197]], ["tile_x", "sp", [-1, 1, 1]], ["tile_k", "sp", [-1, 32]], ["auto_unroll_max_step", "ot", 8], ["unroll_explicit", "ot", 1]]}, "result": [[0.0013875569029126213], 0, 2.1305739879608154, 1711981480.6010435], "version": 0.2, "tvm_version": "0.14.dev0"}
{"input": ["cuda -keys=cuda,gpu -arch=sm_70 -max_num_threads=1024 -thread_warp_size=32", "batch_matmul.cuda", [["TENSOR", [12, 197, 64], "float32"], ["TENSOR", [12, 197, 64], "float32"], [12, 197, 197], "float32", 0, 1], {}], "config": {"index": 277, "code_hash": null, "entity": [["tile_y", "sp", [-1, 197, 1]], ["tile_x", "sp", [-1, 1, 197]], ["tile_k", "sp", [-1, 4]], ["auto_unroll_max_step", "ot", 8], ["unroll_explicit", "ot", 1]]}, "result": [[0.00014685682024623802], 0, 8.296917200088501, 1711981483.569055], "version": 0.2, "tvm_version": "0.14.dev0"}
{"input": ["cuda -keys=cuda,gpu -arch=sm_70 -max_num_threads=1024 -thread_warp_size=32", "batch_matmul.cuda", [["TENSOR", [12, 197, 64], "float32"], ["TENSOR", [12, 197, 64], "float32"], [12, 197, 197], "float32", 0, 1], {}], "config": {"index": 459, "code_hash": null, "entity": [["tile_y", "sp", [-1, 1, 1]], ["tile_x", "sp", [-1, 1, 1]], ["tile_k", "sp", [-1, 4]], ["auto_unroll_max_step", "ot", 64], ["unroll_explicit", "ot", 1]]}, "result": [[0.001471027238235294], 0, 1.9002861976623535, 1711981484.934647], "version": 0.2, "tvm_version": "0.14.dev0"}
{"input": ["cuda -keys=cuda,gpu -arch=sm_70 -max_num_threads=1024 -thread_warp_size=32", "batch_matmul.cuda", [["TENSOR", [12, 197, 64], "float32"], ["TENSOR", [12, 197, 64], "float32"], [12, 197, 197], "float32", 0, 1], {}], "config": {"index": 140, "code_hash": null, "entity": [["tile_y", "sp", [-1, 1, 197]], ["tile_x", "sp", [-1, 197, 1]], ["tile_k", "sp", [-1, 2]], ["auto_unroll_max_step", "ot", 32], ["unroll_explicit", "ot", 0]]}, "result": [[0.0005739043842329546], 0, 3.822174310684204, 1711981487.9516146], "version": 0.2, "tvm_version": "0.14.dev0"}
{"input": ["cuda -keys=cuda,gpu -arch=sm_70 -max_num_threads=1024 -thread_warp_size=32", "batch_matmul.cuda", [["TENSOR", [12, 197, 64], "float32"], ["TENSOR", [12, 197, 64], "float32"], [12, 197, 197], "float32", 0, 1], {}], "config": {"index": 90, "code_hash": null, "entity": [["tile_y", "sp", [-1, 1, 1]], ["tile_x", "sp", [-1, 1, 1]], ["tile_k", "sp", [-1, 8]], ["auto_unroll_max_step", "ot", 16], ["unroll_explicit", "ot", 0]]}, "result": [[0.0012168952296686749], 0, 3.529571771621704, 1711981490.9325428], "version": 0.2, "tvm_version": "0.14.dev0"}
{"input": ["cuda -keys=cuda,gpu -arch=sm_70 -max_num_threads=1024 -thread_warp_size=32", "batch_matmul.cuda", [["TENSOR", [12, 197, 64], "float32"], ["TENSOR", [12, 197, 64], "float32"], [12, 197, 197], "float32", 0, 1], {}], "config": {"index": 252, "code_hash": null, "entity": [["tile_y", "sp", [-1, 1, 1]], ["tile_x", "sp", [-1, 1, 1]], ["tile_k", "sp", [-1, 1]], ["auto_unroll_max_step", "ot", 8], ["unroll_explicit", "ot", 1]]}, "result": [[0.003725395795539034], 0, 1.9428393840789795, 1711981492.3260078], "version": 0.2, "tvm_version": "0.14.dev0"}
{"input": ["cuda -keys=cuda,gpu -arch=sm_70 -max_num_threads=1024 -thread_warp_size=32", "batch_matmul.cuda", [["TENSOR", [12, 197, 64], "float32"], ["TENSOR", [12, 197, 64], "float32"], [12, 197, 197], "float32", 0, 1], {}], "config": {"index": 339, "code_hash": null, "entity": [["tile_y", "sp", [-1, 1, 1]], ["tile_x", "sp", [-1, 1, 197]], ["tile_k", "sp", [-1, 4]], ["auto_unroll_max_step", "ot", 16], ["unroll_explicit", "ot", 1]]}, "result": [[0.005875693871345029], 0, 2.709634304046631, 1711981493.7898488], "version": 0.2, "tvm_version": "0.14.dev0"}
{"input": ["cuda -keys=cuda,gpu -arch=sm_70 -max_num_threads=1024 -thread_warp_size=32", "batch_matmul.cuda", [["TENSOR", [12, 197, 64], "float32"], ["TENSOR", [12, 197, 64], "float32"], [12, 197, 197], "float32", 0, 1], {}], "config": {"index": 194, "code_hash": null, "entity": [["tile_y", "sp", [-1, 1, 197]], ["tile_x", "sp", [-1, 197, 1]], ["tile_k", "sp", [-1, 1]], ["auto_unroll_max_step", "ot", 64], ["unroll_explicit", "ot", 0]]}, "result": [[0.0007990245592885375], 0, 3.6332905292510986, 1711981496.76069], "version": 0.2, "tvm_version": "0.14.dev0"}
{"input": ["cuda -keys=cuda,gpu -arch=sm_70 -max_num_threads=1024 -thread_warp_size=32", "batch_matmul.cuda", [["TENSOR", [12, 197, 64], "float32"], ["TENSOR", [12, 197, 64], "float32"], [12, 197, 197], "float32", 0, 1], {}], "config": {"index": 492, "code_hash": null, "entity": [["tile_y", "sp", [-1, 1, 1]], ["tile_x", "sp", [-1, 1, 197]], ["tile_k", "sp", [-1, 32]], ["auto_unroll_max_step", "ot", 64], ["unroll_explicit", "ot", 1]]}, "result": [[0.0013873026735395188], 0, 3.9690473079681396, 1711981500.3998015], "version": 0.2, "tvm_version": "0.14.dev0"}
{"input": ["cuda -keys=cuda,gpu -arch=sm_70 -max_num_threads=1024 -thread_warp_size=32", "batch_matmul.cuda", [["TENSOR", [12, 197, 64], "float32"], ["TENSOR", [12, 197, 64], "float32"], [12, 197, 197], "float32", 0, 1], {}], "config": {"index": 257, "code_hash": null, "entity": [["tile_y", "sp", [-1, 1, 197]], ["tile_x", "sp", [-1, 197, 1]], ["tile_k", "sp", [-1, 1]], ["auto_unroll_max_step", "ot", 8], ["unroll_explicit", "ot", 1]]}, "result": [[0.0007990023043478261], 0, 3.6891062259674072, 1711981503.3798409], "version": 0.2, "tvm_version": "0.14.dev0"}
{"input": ["cuda -keys=cuda,gpu -arch=sm_70 -max_num_threads=1024 -thread_warp_size=32", "batch_matmul.cuda", [["TENSOR", [12, 197, 64], "float32"], ["TENSOR", [12, 197, 64], "float32"], [12, 197, 197], "float32", 0, 1], {}], "config": {"index": 230, "code_hash": null, "entity": [["tile_y", "sp", [-1, 1, 197]], ["tile_x", "sp", [-1, 197, 1]], ["tile_k", "sp", [-1, 16]], ["auto_unroll_max_step", "ot", 64], ["unroll_explicit", "ot", 0]]}, "result": [[0.000557993335763467], 0, 5.515586853027344, 1711981506.6334276], "version": 0.2, "tvm_version": "0.14.dev0"}
{"input": ["cuda -keys=cuda,gpu -arch=sm_70 -max_num_threads=1024 -thread_warp_size=32", "batch_matmul.cuda", [["TENSOR", [12, 197, 64], "float32"], ["TENSOR", [12, 197, 64], "float32"], [12, 197, 197], "float32", 0, 1], {}], "config": {"index": 362, "code_hash": null, "entity": [["tile_y", "sp", [-1, 1, 197]], ["tile_x", "sp", [-1, 1, 1]], ["tile_k", "sp", [-1, 32]], ["auto_unroll_max_step", "ot", 16], ["unroll_explicit", "ot", 1]]}, "result": [[0.0013876141417525775], 0, 3.8045599460601807, 1711981509.609551], "version": 0.2, "tvm_version": "0.14.dev0"}
{"input": ["cuda -keys=cuda,gpu -arch=sm_70 -max_num_threads=1024 -thread_warp_size=32", "batch_matmul.cuda", [["TENSOR", [12, 197, 64], "float32"], ["TENSOR", [12, 197, 64], "float32"], [12, 197, 197], "float32", 0, 1], {}], "config": {"index": 232, "code_hash": null, "entity": [["tile_y", "sp", [-1, 197, 1]], ["tile_x", "sp", [-1, 1, 197]], ["tile_k", "sp", [-1, 16]], ["auto_unroll_max_step", "ot", 64], ["unroll_explicit", "ot", 0]]}, "result": [[0.00016450889826353422], 0, 8.462781190872192, 1711981512.5869882], "version": 0.2, "tvm_version": "0.14.dev0"}
{"input": ["cuda -keys=cuda,gpu -arch=sm_70 -max_num_threads=1024 -thread_warp_size=32", "batch_matmul.cuda", [["TENSOR", [12, 197, 64], "float32"], ["TENSOR", [12, 197, 64], "float32"], [12, 197, 197], "float32", 0, 1], {}], "config": {"index": 207, "code_hash": null, "entity": [["tile_y", "sp", [-1, 1, 1]], ["tile_x", "sp", [-1, 1, 1]], ["tile_k", "sp", [-1, 4]], ["auto_unroll_max_step", "ot", 64], ["unroll_explicit", "ot", 0]]}, "result": [[0.0014711235485294117], 0, 1.8710660934448242, 1711981514.6071424], "version": 0.2, "tvm_version": "0.14.dev0"}
{"input": ["cuda -keys=cuda,gpu -arch=sm_70 -max_num_threads=1024 -thread_warp_size=32", "batch_matmul.cuda", [["TENSOR", [12, 197, 64], "float32"], ["TENSOR", [12, 197, 64], "float32"], [12, 197, 197], "float32", 0, 1], {}], "config": {"index": 219, "code_hash": null, "entity": [["tile_y", "sp", [-1, 1, 1]], ["tile_x", "sp", [-1, 197, 1]], ["tile_k", "sp", [-1, 8]], ["auto_unroll_max_step", "ot", 64], ["unroll_explicit", "ot", 0]]}, "result": [[0.0005967125472747497], 0, 3.44084095954895, 1711981517.5663328], "version": 0.2, "tvm_version": "0.14.dev0"}
{"input": ["cuda -keys=cuda,gpu -arch=sm_70 -max_num_threads=1024 -thread_warp_size=32", "batch_matmul.cuda", [["TENSOR", [12, 197, 64], "float32"], ["TENSOR", [12, 197, 64], "float32"], [12, 197, 197], "float32", 0, 1], {}], "config": {"index": 480, "code_hash": null, "entity": [["tile_y", "sp", [-1, 1, 1]], ["tile_x", "sp", [-1, 197, 1]], ["tile_k", "sp", [-1, 16]], ["auto_unroll_max_step", "ot", 64], ["unroll_explicit", "ot", 1]]}, "result": [[0.0003653949069003286], 0, 1.8127925395965576, 1711981518.967463], "version": 0.2, "tvm_version": "0.14.dev0"}
{"input": ["cuda -keys=cuda,gpu -arch=sm_70 -max_num_threads=1024 -thread_warp_size=32", "batch_matmul.cuda", [["TENSOR", [12, 197, 64], "float32"], ["TENSOR", [12, 197, 64], "float32"], [12, 197, 197], "float32", 0, 1], {}], "config": {"index": 340, "code_hash": null, "entity": [["tile_y", "sp", [-1, 197, 1]], ["tile_x", "sp", [-1, 1, 197]], ["tile_k", "sp", [-1, 4]], ["auto_unroll_max_step", "ot", 16], ["unroll_explicit", "ot", 1]]}, "result": [[0.00014685548072541693], 0, 8.338745594024658, 1711981521.939047], "version": 0.2, "tvm_version": "0.14.dev0"}
{"input": ["cuda -keys=cuda,gpu -arch=sm_70 -max_num_threads=1024 -thread_warp_size=32", "batch_matmul.cuda", [["TENSOR", [12, 197, 64], "float32"], ["TENSOR", [12, 197, 64], "float32"], [12, 197, 197], "float32", 0, 1], {}], "config": {"index": 65, "code_hash": null, "entity": [["tile_y", "sp", [-1, 1, 197]], ["tile_x", "sp", [-1, 1, 1]], ["tile_k", "sp", [-1, 1]], ["auto_unroll_max_step", "ot", 16], ["unroll_explicit", "ot", 0]]}, "result": [[0.0006556513400974026], 0, 3.765164375305176, 1711981525.5646718], "version": 0.2, "tvm_version": "0.14.dev0"}
{"input": ["cuda -keys=cuda,gpu -arch=sm_70 -max_num_threads=1024 -thread_warp_size=32", "batch_matmul.cuda", [["TENSOR", [12, 197, 64], "float32"], ["TENSOR", [12, 197, 64], "float32"], [12, 197, 197], "float32", 0, 1], {}], "config": {"index": 147, "code_hash": null, "entity": [["tile_y", "sp", [-1, 1, 1]], ["tile_x", "sp", [-1, 197, 1]], ["tile_k", "sp", [-1, 4]], ["auto_unroll_max_step", "ot", 32], ["unroll_explicit", "ot", 0]]}, "result": [[0.0009818131980392157], 0, 1.836409091949463, 1711981526.9263945], "version": 0.2, "tvm_version": "0.14.dev0"}
{"input": ["cuda -keys=cuda,gpu -arch=sm_70 -max_num_threads=1024 -thread_warp_size=32", "batch_matmul.cuda", [["TENSOR", [12, 197, 64], "float32"], ["TENSOR", [12, 197, 64], "float32"], [12, 197, 197], "float32", 0, 1], {}], "config": {"index": 461, "code_hash": null, "entity": [["tile_y", "sp", [-1, 1, 197]], ["tile_x", "sp", [-1, 1, 1]], ["tile_k", "sp", [-1, 4]], ["auto_unroll_max_step", "ot", 64], ["unroll_explicit", "ot", 1]]}, "result": [[0.005945586254437869], 0, 2.6787402629852295, 1711981528.3527875], "version": 0.2, "tvm_version": "0.14.dev0"}
{"input": ["cuda -keys=cuda,gpu -arch=sm_70 -max_num_threads=1024 -thread_warp_size=32", "batch_matmul.cuda", [["TENSOR", [12, 197, 64], "float32"], ["TENSOR", [12, 197, 64], "float32"], [12, 197, 197], "float32", 0, 1], {}], "config": {"index": 154, "code_hash": null, "entity": [["tile_y", "sp", [-1, 197, 1]], ["tile_x", "sp", [-1, 1, 1]], ["tile_k", "sp", [-1, 8]], ["auto_unroll_max_step", "ot", 32], ["unroll_explicit", "ot", 0]]}, "result": [[0.00031805701062992127], 0, 3.5112271308898926, 1711981531.3683517], "version": 0.2, "tvm_version": "0.14.dev0"}
{"input": ["cuda -keys=cuda,gpu -arch=sm_70 -max_num_threads=1024 -thread_warp_size=32", "batch_matmul.cuda", [["TENSOR", [12, 197, 64], "float32"], ["TENSOR", [12, 197, 64], "float32"], [12, 197, 197], "float32", 0, 1], {}], "config": {"index": 82, "code_hash": null, "entity": [["tile_y", "sp", [-1, 197, 1]], ["tile_x", "sp", [-1, 1, 1]], ["tile_k", "sp", [-1, 4]], ["auto_unroll_max_step", "ot", 16], ["unroll_explicit", "ot", 0]]}, "result": [[0.0002985444106770057], 0, 1.8567345142364502, 1711981532.7224472], "version": 0.2, "tvm_version": "0.14.dev0"}
{"input": ["cuda -keys=cuda,gpu -arch=sm_70 -max_num_threads=1024 -thread_warp_size=32", "batch_matmul.cuda", [["TENSOR", [12, 197, 64], "float32"], ["TENSOR", [12, 197, 64], "float32"], [12, 197, 197], "float32", 0, 1], {}], "config": {"index": 167, "code_hash": null, "entity": [["tile_y", "sp", [-1, 1, 197]], ["tile_x", "sp", [-1, 197, 1]], ["tile_k", "sp", [-1, 16]], ["auto_unroll_max_step", "ot", 32], ["unroll_explicit", "ot", 0]]}, "result": [[0.0005580878814935065], 0, 5.596846580505371, 1711981535.3039553], "version": 0.2, "tvm_version": "0.14.dev0"}
{"input": ["cuda -keys=cuda,gpu -arch=sm_70 -max_num_threads=1024 -thread_warp_size=32", "batch_matmul.cuda", [["TENSOR", [12, 197, 64], "float32"], ["TENSOR", [12, 197, 64], "float32"], [12, 197, 197], "float32", 0, 1], {}], "config": {"index": 389, "code_hash": null, "entity": [["tile_y", "sp", [-1, 1, 197]], ["tile_x", "sp", [-1, 1, 1]], ["tile_k", "sp", [-1, 2]], ["auto_unroll_max_step", "ot", 32], ["unroll_explicit", "ot", 1]]}, "result": [[0.0006576818046398047], 0, 3.99330472946167, 1711981538.3324566], "version": 0.2, "tvm_version": "0.14.dev0"}
{"input": ["cuda -keys=cuda,gpu -arch=sm_70 -max_num_threads=1024 -thread_warp_size=32", "batch_matmul.cuda", [["TENSOR", [12, 197, 64], "float32"], ["TENSOR", [12, 197, 64], "float32"], [12, 197, 197], "float32", 0, 1], {}], "config": {"index": 266, "code_hash": null, "entity": [["tile_y", "sp", [-1, 1, 197]], ["tile_x", "sp", [-1, 197, 1]], ["tile_k", "sp", [-1, 2]], ["auto_unroll_max_step", "ot", 8], ["unroll_explicit", "ot", 1]]}, "result": [[0.00057390114158978], 0, 3.8015966415405273, 1711981541.3087628], "version": 0.2, "tvm_version": "0.14.dev0"}
{"input": ["cuda -keys=cuda,gpu -arch=sm_70 -max_num_threads=1024 -thread_warp_size=32", "batch_matmul.cuda", [["TENSOR", [12, 197, 64], "float32"], ["TENSOR", [12, 197, 64], "float32"], [12, 197, 197], "float32", 0, 1], {}], "config": {"index": 33, "code_hash": null, "entity": [["tile_y", "sp", [-1, 1, 1]], ["tile_x", "sp", [-1, 1, 197]], ["tile_k", "sp", [-1, 8]], ["auto_unroll_max_step", "ot", 8], ["unroll_explicit", "ot", 0]]}, "result": [[0.004445082182320442], 0, 5.022846937179565, 1711981544.3238966], "version": 0.2, "tvm_version": "0.14.dev0"}
{"input": ["cuda -keys=cuda,gpu -arch=sm_70 -max_num_threads=1024 -thread_warp_size=32", "batch_matmul.cuda", [["TENSOR", [12, 197, 64], "float32"], ["TENSOR", [12, 197, 64], "float32"], [12, 197, 197], "float32", 0, 1], {}], "config": {"index": 70, "code_hash": null, "entity": [["tile_y", "sp", [-1, 197, 1]], ["tile_x", "sp", [-1, 1, 197]], ["tile_k", "sp", [-1, 1]], ["auto_unroll_max_step", "ot", 16], ["unroll_explicit", "ot", 0]]}, "result": [[0.00011325015249824067], 0, 3.7566630840301514, 1711981547.3242025], "version": 0.2, "tvm_version": "0.14.dev0"}
{"input": ["cuda -keys=cuda,gpu -arch=sm_70 -max_num_threads=1024 -thread_warp_size=32", "batch_matmul.cuda", [["TENSOR", [12, 197, 64], "float32"], ["TENSOR", [12, 197, 64], "float32"], [12, 197, 197], "float32", 0, 1], {}], "config": {"index": 297, "code_hash": null, "entity": [["tile_y", "sp", [-1, 1, 1]], ["tile_x", "sp", [-1, 1, 1]], ["tile_k", "sp", [-1, 32]], ["auto_unroll_max_step", "ot", 8], ["unroll_explicit", "ot", 1]]}, "result": [[0.0011004368604492854], 0, 3.5781564712524414, 1711981550.3022316], "version": 0.2, "tvm_version": "0.14.dev0"}
{"input": ["cuda -keys=cuda,gpu -arch=sm_70 -max_num_threads=1024 -thread_warp_size=32", "batch_matmul.cuda", [["TENSOR", [12, 197, 64], "float32"], ["TENSOR", [12, 197, 64], "float32"], [12, 197, 197], "float32", 0, 1], {}], "config": {"index": 268, "code_hash": null, "entity": [["tile_y", "sp", [-1, 197, 1]], ["tile_x", "sp", [-1, 1, 197]], ["tile_k", "sp", [-1, 2]], ["auto_unroll_max_step", "ot", 8], ["unroll_explicit", "ot", 1]]}, "result": [[0.000169121585], 0, 7.6551501750946045, 1711981569.371373], "version": 0.2, "tvm_version": "0.14.dev0"}
{"input": ["cuda -keys=cuda,gpu -arch=sm_70 -max_num_threads=1024 -thread_warp_size=32", "batch_matmul.cuda", [["TENSOR", [12, 197, 64], "float32"], ["TENSOR", [12, 197, 64], "float32"], [12, 197, 197], "float32", 0, 1], {}], "config": {"index": 7, "code_hash": null, "entity": [["tile_y", "sp", [-1, 197, 1]], ["tile_x", "sp", [-1, 1, 197]], ["tile_k", "sp", [-1, 1]], ["auto_unroll_max_step", "ot", 8], ["unroll_explicit", "ot", 0]]}, "result": [[0.00011325820405006328], 0, 3.4241762161254883, 1711981572.3294387], "version": 0.2, "tvm_version": "0.14.dev0"}
{"input": ["cuda -keys=cuda,gpu -arch=sm_70 -max_num_threads=1024 -thread_warp_size=32", "batch_matmul.cuda", [["TENSOR", [12, 197, 64], "float32"], ["TENSOR", [12, 197, 64], "float32"], [12, 197, 197], "float32", 0, 1], {}], "config": {"index": 16, "code_hash": null, "entity": [["tile_y", "sp", [-1, 197, 1]], ["tile_x", "sp", [-1, 1, 197]], ["tile_k", "sp", [-1, 2]], ["auto_unroll_max_step", "ot", 8], ["unroll_explicit", "ot", 0]]}, "result": [[0.00016909121822567113], 0, 8.339487791061401, 1711981575.3364136], "version": 0.2, "tvm_version": "0.14.dev0"}
{"input": ["cuda -keys=cuda,gpu -arch=sm_70 -max_num_threads=1024 -thread_warp_size=32", "batch_matmul.cuda", [["TENSOR", [12, 197, 64], "float32"], ["TENSOR", [12, 197, 64], "float32"], [12, 197, 197], "float32", 0, 1], {}], "config": {"index": 322, "code_hash": null, "entity": [["tile_y", "sp", [-1, 197, 1]], ["tile_x", "sp", [-1, 1, 197]], ["tile_k", "sp", [-1, 1]], ["auto_unroll_max_step", "ot", 16], ["unroll_explicit", "ot", 1]]}, "result": [[0.00011332420715644151], 0, 3.4609930515289307, 1711981578.298584], "version": 0.2, "tvm_version": "0.14.dev0"}
{"input": ["cuda -keys=cuda,gpu -arch=sm_70 -max_num_threads=1024 -thread_warp_size=32", "batch_matmul.cuda", [["TENSOR", [12, 197, 64], "float32"], ["TENSOR", [12, 197, 64], "float32"], [12, 197, 197], "float32", 0, 1], {}], "config": {"index": 331, "code_hash": null, "entity": [["tile_y", "sp", [-1, 197, 1]], ["tile_x", "sp", [-1, 1, 197]], ["tile_k", "sp", [-1, 2]], ["auto_unroll_max_step", "ot", 16], ["unroll_explicit", "ot", 1]]}, "result": [[0.0001691128006501678], 0, 8.517110109329224, 1711981581.2717502], "version": 0.2, "tvm_version": "0.14.dev0"}
{"input": ["cuda -keys=cuda,gpu -arch=sm_70 -max_num_threads=1024 -thread_warp_size=32", "batch_matmul.cuda", [["TENSOR", [12, 197, 64], "float32"], ["TENSOR", [12, 197, 64], "float32"], [12, 197, 197], "float32", 0, 1], {}], "config": {"index": 79, "code_hash": null, "entity": [["tile_y", "sp", [-1, 197, 1]], ["tile_x", "sp", [-1, 1, 197]], ["tile_k", "sp", [-1, 2]], ["auto_unroll_max_step", "ot", 16], ["unroll_explicit", "ot", 0]]}, "result": [[0.00016908137763779526], 0, 8.554208517074585, 1711981584.2973273], "version": 0.2, "tvm_version": "0.14.dev0"}
{"input": ["cuda -keys=cuda,gpu -arch=sm_70 -max_num_threads=1024 -thread_warp_size=32", "batch_matmul.cuda", [["TENSOR", [12, 197, 64], "float32"], ["TENSOR", [12, 197, 64], "float32"], [12, 197, 197], "float32", 0, 1], {}], "config": {"index": 385, "code_hash": null, "entity": [["tile_y", "sp", [-1, 197, 1]], ["tile_x", "sp", [-1, 1, 197]], ["tile_k", "sp", [-1, 1]], ["auto_unroll_max_step", "ot", 32], ["unroll_explicit", "ot", 1]]}, "result": [[0.00011324935362420828], 0, 3.4260897636413574, 1711981587.2500546], "version": 0.2, "tvm_version": "0.14.dev0"}
{"input": ["cuda -keys=cuda,gpu -arch=sm_70 -max_num_threads=1024 -thread_warp_size=32", "batch_matmul.cuda", [["TENSOR", [12, 197, 64], "float32"], ["TENSOR", [12, 197, 64], "float32"], [12, 197, 197], "float32", 0, 1], {}], "config": {"index": 133, "code_hash": null, "entity": [["tile_y", "sp", [-1, 197, 1]], ["tile_x", "sp", [-1, 1, 197]], ["tile_k", "sp", [-1, 1]], ["auto_unroll_max_step", "ot", 32], ["unroll_explicit", "ot", 0]]}, "result": [[0.0001132671530612245], 0, 3.427953004837036, 1711981590.2061808], "version": 0.2, "tvm_version": "0.14.dev0"}
{"input": ["cuda -keys=cuda,gpu -arch=sm_70 -max_num_threads=1024 -thread_warp_size=32", "batch_matmul.cuda", [["TENSOR", [12, 197, 64], "float32"], ["TENSOR", [12, 197, 64], "float32"], [12, 197, 197], "float32", 0, 1], {}], "config": {"index": 394, "code_hash": null, "entity": [["tile_y", "sp", [-1, 197, 1]], ["tile_x", "sp", [-1, 1, 197]], ["tile_k", "sp", [-1, 2]], ["auto_unroll_max_step", "ot", 32], ["unroll_explicit", "ot", 1]]}, "result": [[0.00016912223817018153], 0, 8.444601058959961, 1711981593.223332], "version": 0.2, "tvm_version": "0.14.dev0"}
{"input": ["cuda -keys=cuda,gpu -arch=sm_70 -max_num_threads=1024 -thread_warp_size=32", "batch_matmul.cuda", [["TENSOR", [12, 197, 64], "float32"], ["TENSOR", [12, 197, 64], "float32"], [12, 197, 197], "float32", 0, 1], {}], "config": {"index": 142, "code_hash": null, "entity": [["tile_y", "sp", [-1, 197, 1]], ["tile_x", "sp", [-1, 1, 197]], ["tile_k", "sp", [-1, 2]], ["auto_unroll_max_step", "ot", 32], ["unroll_explicit", "ot", 0]]}, "result": [[0.00016911871476510068], 0, 8.44843339920044, 1711981596.1997817], "version": 0.2, "tvm_version": "0.14.dev0"}
